title,description,published date,url,publisher,keywords,content
"Saham Bank Ini Diam-diam Bisa Kasih Cuan dan Dividen Gede, Pegangan LKH - Investor.ID","Saham Bank Ini Diam-diam Bisa Kasih Cuan dan Dividen Gede, Pegangan LKH  Investor.ID",2023-09-25,https://news.google.com/rss/articles/CBMiZ2h0dHBzOi8vaW52ZXN0b3IuaWQvbWFya2V0LzM0MTU1Ni9zYWhhbS1iYW5rLWluaS1kaWFtZGlhbS1iaXNhLWthc2loLWN1YW4tZGFuLWRpdmlkZW4tZ2VkZS1wZWdhbmdhbi1sa2jSAQA?oc=5&hl=en-ID&gl=ID&ceid=ID:en,"{'href': 'https://investor.id', 'title': 'Investor.ID'}",Missing,Missing
"Kelebihan 'KBstar', Mobile Banking yang Serba Bisa Persembahan Bank KB Bukopin - Investor.ID","Kelebihan 'KBstar', Mobile Banking yang Serba Bisa Persembahan Bank KB Bukopin  Investor.ID",2023-09-22,https://news.google.com/rss/articles/CBMibmh0dHBzOi8vaW52ZXN0b3IuaWQvZmluYW5jZS8zNDEzNjUva2VsZWJpaGFuLWtic3Rhci1tb2JpbGUtYmFua2luZy15YW5nLXNlcmJhLWJpc2EtcGVyc2VtYmFoYW4tYmFuay1rYi1idWtvcGlu0gEA?oc=5&hl=en-ID&gl=ID&ceid=ID:en,"{'href': 'https://investor.id', 'title': 'Investor.ID'}",Missing,Missing
"Yang Pegang Saham Medco Sabar, Target Harga Masih Tinggi - Investor.ID","Yang Pegang Saham Medco Sabar, Target Harga Masih Tinggi  Investor.ID",2023-09-21,https://news.google.com/rss/articles/CBMiWWh0dHBzOi8vaW52ZXN0b3IuaWQvbWFya2V0LzM0MTIzMy95YW5nLXBlZ2FuZy1zYWhhbS1tZWRjby1zYWJhci10YXJnZXQtaGFyZ2EtbWFzaWgtdGluZ2dp0gEA?oc=5&hl=en-ID&gl=ID&ceid=ID:en,"{'href': 'https://investor.id', 'title': 'Investor.ID'}",Missing,Missing
"Bank Mandiri (BMRI) Gandeng FishLog, Pacu Kredit Digital ke UMKM - Investor.ID","Bank Mandiri (BMRI) Gandeng FishLog, Pacu Kredit Digital ke UMKM  Investor.ID",2023-09-20,https://news.google.com/rss/articles/CBMiYGh0dHBzOi8vaW52ZXN0b3IuaWQvZmluYW5jZS8zNDExMjMvYmFuay1tYW5kaXJpLWJtcmktZ2FuZGVuZy1maXNobG9nLXBhY3Uta3JlZGl0LWRpZ2l0YWwta2UtdW1rbdIBAA?oc=5&hl=en-ID&gl=ID&ceid=ID:en,"{'href': 'https://investor.id', 'title': 'Investor.ID'}",Missing,Missing
Bank Mandiri (BMRI) Dorong Penyaluran Kredit Infrastruktur - Investor.ID,Bank Mandiri (BMRI) Dorong Penyaluran Kredit Infrastruktur  Investor.ID,2023-09-18,https://news.google.com/rss/articles/CBMiW2h0dHBzOi8vaW52ZXN0b3IuaWQvZmluYW5jZS8zNDA4OTIvYmFuay1tYW5kaXJpLWJtcmktZG9yb25nLXBlbnlhbHVyYW4ta3JlZGl0LWluZnJhc3RydWt0dXLSAQA?oc=5&hl=en-ID&gl=ID&ceid=ID:en,"{'href': 'https://investor.id', 'title': 'Investor.ID'}",Missing,Missing
Barito Pacific (BRPT) Tembus Barisan Emiten Elite - Investor.ID,Barito Pacific (BRPT) Tembus Barisan Emiten Elite  Investor.ID,2023-09-18,https://news.google.com/rss/articles/CBMiUWh0dHBzOi8vaW52ZXN0b3IuaWQvbWFya2V0LzM0MDkzNC9iYXJpdG8tcGFjaWZpYy1icnB0LXRlbWJ1cy1iYXJpc2FuLWVtaXRlbi1lbGl0ZdIBAA?oc=5&hl=en-ID&gl=ID&ceid=ID:en,"{'href': 'https://investor.id', 'title': 'Investor.ID'}",Missing,Missing
digibank by DBS Rambah 800 Ribu Pengguna - Investor.ID,digibank by DBS Rambah 800 Ribu Pengguna  Investor.ID,2023-09-17,https://news.google.com/rss/articles/CBMiS2h0dHBzOi8vaW52ZXN0b3IuaWQvZmluYW5jZS8zNDA4MDIvZGlnaWJhbmstYnktZGJzLXJhbWJhaC04MDAtcmlidS1wZW5nZ3VuYdIBAA?oc=5&hl=en-ID&gl=ID&ceid=ID:en,"{'href': 'https://investor.id', 'title': 'Investor.ID'}",Missing,Missing
Bank Mandiri Menggalakkan Program #SuperAPPSuperLengkAPP di Livin' Fest - Investor.ID,Bank Mandiri Menggalakkan Program #SuperAPPSuperLengkAPP di Livin' Fest  Investor.ID,2023-09-14,https://news.google.com/rss/articles/CBMiaGh0dHBzOi8vaW52ZXN0b3IuaWQvZmluYW5jZS8zNDA1OTQvYmFuay1tYW5kaXJpLW1lbmdnYWxha2thbi1wcm9ncmFtLXN1cGVyYXBwc3VwZXJsZW5na2FwcC1kaS1saXZpbi1mZXN00gEA?oc=5&hl=en-ID&gl=ID&ceid=ID:en,"{'href': 'https://investor.id', 'title': 'Investor.ID'}",Missing,Missing
"Didominasi Saham BBRI, BBCA, dan BMRI, Investor Asing Net Sell Rp 1,1 Triliun - Investor.ID","Didominasi Saham BBRI, BBCA, dan BMRI, Investor Asing Net Sell Rp 1,1 Triliun  Investor.ID",2023-09-07,https://news.google.com/rss/articles/CBMia2h0dHBzOi8vaW52ZXN0b3IuaWQvbWFya2V0LzMzOTk4OS9kaWRvbWluYXNpLXNhaGFtLWJicmktYmJjYS1kYW4tYm1yaS1pbnZlc3Rvci1hc2luZy1uZXQtc2VsbC1ycC0xMS10cmlsaXVu0gEA?oc=5&hl=en-ID&gl=ID&ceid=ID:en,"{'href': 'https://investor.id', 'title': 'Investor.ID'}",Missing,Missing
"Beberapa Sektor yang Terdampak Pemilu, 7 Saham Dijagokan - Investor.ID","Beberapa Sektor yang Terdampak Pemilu, 7 Saham Dijagokan  Investor.ID",2023-09-04,https://news.google.com/rss/articles/CBMiWWh0dHBzOi8vaW52ZXN0b3IuaWQvbWFya2V0LzMzOTY1My9iZWJlcmFwYS1zZWt0b3IteWFuZy10ZXJkYW1wYWstcGVtaWx1LTctc2FoYW0tZGlqYWdva2Fu0gEA?oc=5&hl=en-ID&gl=ID&ceid=ID:en,"{'href': 'https://investor.id', 'title': 'Investor.ID'}",Missing,Missing
"Saham Astra (ASII) Lagi Murah, Potensi Cuan Tambah Besar - Investor.ID","Saham Astra (ASII) Lagi Murah, Potensi Cuan Tambah Besar  Investor.ID",2023-08-23,https://news.google.com/rss/articles/CBMiV2h0dHBzOi8vaW52ZXN0b3IuaWQvbWFya2V0LzMzODY5MS9zYWhhbS1hc3RyYS1hc2lpLWxhZ2ktbXVyYWgtcG90ZW5zaS1jdWFuLXRhbWJhaC1iZXNhctIBAA?oc=5&hl=en-ID&gl=ID&ceid=ID:en,"{'href': 'https://investor.id', 'title': 'Investor.ID'}",Missing,Missing
BCA (BBCA) Incar AUM Bisnis Wealth Management Tumbuh 30% - Investor.ID,BCA (BBCA) Incar AUM Bisnis Wealth Management Tumbuh 30%  Investor.ID,2023-08-23,https://news.google.com/rss/articles/CBMiVWh0dHBzOi8vaW52ZXN0b3IuaWQvZmluYW5jZS8zMzg3ODYvYmNhLWJiY2EtaW5jYXItYXVtLWJpc25pc3dlYWx0aC1tYW5hZ2VtZW50dHVtYnVoMzDSAQA?oc=5&hl=en-ID&gl=ID&ceid=ID:en,"{'href': 'https://investor.id', 'title': 'Investor.ID'}",Missing,Missing
Bank Mandiri (BMRI) Proyeksi Kinerja Industri Perbankan Masih Positif Jelang Pemilu - Investor.ID,Bank Mandiri (BMRI) Proyeksi Kinerja Industri Perbankan Masih Positif Jelang Pemilu  Investor.ID,2023-08-22,https://news.google.com/rss/articles/CBMic2h0dHBzOi8vaW52ZXN0b3IuaWQvZmluYW5jZS8zMzg2NjAvYmFuay1tYW5kaXJpLWJtcmktcHJveWVrc2kta2luZXJqYS1pbmR1c3RyaXBlcmJhbmthbi1tYXNpaC1wb3NpdGlmLWplbGFuZy1wZW1pbHXSAQA?oc=5&hl=en-ID&gl=ID&ceid=ID:en,"{'href': 'https://investor.id', 'title': 'Investor.ID'}",Missing,Missing
"Bank Mandiri Optimistis Pertumbuhan Ekonomi RI Tumbuh 5,04%, Ini Penopangnya - Investor.ID","Bank Mandiri Optimistis Pertumbuhan Ekonomi RI Tumbuh 5,04%, Ini Penopangnya  Investor.ID",2023-08-22,https://news.google.com/rss/articles/CBMibGh0dHBzOi8vaW52ZXN0b3IuaWQvZmluYW5jZS8zMzg2NTYvYmFuay1tYW5kaXJpLW9wdGltaXN0aXMtcGVydHVtYnVoYW4tZWtvbm9taS1yaS10dW1idWgtNTA0LWluaS1wZW5vcGFuZ255YdIBAA?oc=5&hl=en-ID&gl=ID&ceid=ID:en,"{'href': 'https://investor.id', 'title': 'Investor.ID'}",Missing,Missing
"Ingin Anak Nikmati Cuan, Bos BCA (BBCA) Hibahkan Sahamnya - Investor.ID","Ingin Anak Nikmati Cuan, Bos BCA (BBCA) Hibahkan Sahamnya  Investor.ID",2023-08-21,https://news.google.com/rss/articles/CBMiV2h0dHBzOi8vaW52ZXN0b3IuaWQvbWFya2V0LzMzODUwMC9pbmdpbi1hbmFrLW5pa21hdGktY3VhbmJvcy1iY2EtYmJjYS1oaWJhaGthbi1zYWhhbW55YdIBAA?oc=5&hl=en-ID&gl=ID&ceid=ID:en,"{'href': 'https://investor.id', 'title': 'Investor.ID'}",Missing,Missing
"Saham Charoen (CPIN) Vs Japfa (JPFA), Mana yang Bakal Paling Cuan? - Investor.ID","Saham Charoen (CPIN) Vs Japfa (JPFA), Mana yang Bakal Paling Cuan?  Investor.ID",2023-08-20,https://news.google.com/rss/articles/CBMiXmh0dHBzOi8vaW52ZXN0b3IuaWQvbWFya2V0LzMzODQ3Mi9zYWhhbS1jaGFyb2VuLWNwaW4tdnMtamFwZmEtanBmYS1tYW5hLXlhbmctYmFrYWwtcGFsaW5nLWN1YW7SAQA?oc=5&hl=en-ID&gl=ID&ceid=ID:en,"{'href': 'https://investor.id', 'title': 'Investor.ID'}",Missing,Missing
"Saham BMRI dan BBRI Ternyata Pilihan Teratas Investor Asal Hong Kong, Berikut Alasannya - Investor.ID","Saham BMRI dan BBRI Ternyata Pilihan Teratas Investor Asal Hong Kong, Berikut Alasannya  Investor.ID",2023-08-18,https://news.google.com/rss/articles/CBMieGh0dHBzOi8vaW52ZXN0b3IuaWQvbWFya2V0LzMzODMyNC9zYWhhbS1ibXJpLWRhbi1iYnJpLXRlcm55YXRhLXBpbGloYW4tdGVyYXRhcy1pbnZlc3Rvci1hc2FsLWhvbmcta29uZy1iZXJpa3V0LWFsYXNhbm55YdIBAA?oc=5&hl=en-ID&gl=ID&ceid=ID:en,"{'href': 'https://investor.id', 'title': 'Investor.ID'}",Missing,Missing
"Tertinggi Sepanjang Masa, Saham Bank Mandiri (BMRI) Sentuh Rp 6.000 dan Asing Lanjut Borong - Investor.ID","Tertinggi Sepanjang Masa, Saham Bank Mandiri (BMRI) Sentuh Rp 6.000 dan Asing Lanjut Borong  Investor.ID",2023-08-10,https://news.google.com/rss/articles/CBMieWh0dHBzOi8vaW52ZXN0b3IuaWQvbWFya2V0LzMzNzc0MC90ZXJ0aW5nZ2ktc2VwYW5qYW5nLW1hc2Etc2FoYW0tYmFuay1tYW5kaXJpLWJtcmktc2VudHVoLXJwLTYwMDAtZGFuLWFzaW5nLWxhbmp1dC1ib3JvbmfSAQA?oc=5&hl=en-ID&gl=ID&ceid=ID:en,"{'href': 'https://investor.id', 'title': 'Investor.ID'}",Missing,Missing
"Tampilan Baru Aplikasi Raya, Transaksi di Bank Raya Semakin Aman dan Terintegrasi - Investor.ID","Tampilan Baru Aplikasi Raya, Transaksi di Bank Raya Semakin Aman dan Terintegrasi  Investor.ID",2023-08-10,https://news.google.com/rss/articles/CBMic2h0dHBzOi8vaW52ZXN0b3IuaWQvZmluYW5jZS8zMzc2OTkvdGFtcGlsYW4tYmFydS1hcGxpa2FzaS1yYXlhLXRyYW5zYWtzaS1kaS1iYW5rLXJheWEtc2VtYWtpbi1hbWFuLWRhbi10ZXJpbnRlZ3Jhc2nSAQA?oc=5&hl=en-ID&gl=ID&ceid=ID:en,"{'href': 'https://investor.id', 'title': 'Investor.ID'}",Missing,Missing
Bank Mandiri Gandeng Yayasan Dian Didaktika Perkuat Inklusi Keuangan - Investor.ID,Bank Mandiri Gandeng Yayasan Dian Didaktika Perkuat Inklusi Keuangan  Investor.ID,2023-08-09,https://news.google.com/rss/articles/CBMiZ2h0dHBzOi8vaW52ZXN0b3IuaWQvZmluYW5jZS8zMzc2MDgvYmFuay1tYW5kaXJpLWdhbmRlbmcteWF5YXNhbi1kaWFuLWRpZGFrdGlrYS1wZXJrdWF0LWlua2x1c2kta2V1YW5nYW7SAQA?oc=5&hl=en-ID&gl=ID&ceid=ID:en,"{'href': 'https://investor.id', 'title': 'Investor.ID'}",Missing,Missing
"Giat Berhemat, Strategi Dharma Polimetal (DRMA) Kebut Kinerja - Investor.ID","Giat Berhemat, Strategi Dharma Polimetal (DRMA) Kebut Kinerja  Investor.ID",2023-08-07,https://news.google.com/rss/articles/CBMiXGh0dHBzOi8vaW52ZXN0b3IuaWQvbWFya2V0LzMzNzQwMC9naWF0LWJlcmhlbWF0LXN0cmF0ZWdpLWRoYXJtYS1wb2xpbWV0YWwtZHJtYS1rZWJ1dC1raW5lcmph0gEA?oc=5&hl=en-ID&gl=ID&ceid=ID:en,"{'href': 'https://investor.id', 'title': 'Investor.ID'}",Missing,Missing
"Analis Ini Revisi Turun Target Saham Bank Neo (BBYB), Kok Bisa? - Investor.ID","Analis Ini Revisi Turun Target Saham Bank Neo (BBYB), Kok Bisa?  Investor.ID",2023-08-03,https://news.google.com/rss/articles/CBMiXWh0dHBzOi8vaW52ZXN0b3IuaWQvbWFya2V0LzMzNzA0MC9hbmFsaXMtaW5pLXJldmlzaS10dXJ1bi10YXJnZXQtc2FoYW0tYmFuay1uZW8tYmJ5Yi1rb2stYmlzYdIBAA?oc=5&hl=en-ID&gl=ID&ceid=ID:en,"{'href': 'https://investor.id', 'title': 'Investor.ID'}",Missing,Missing
"Target Saham Bank Mandiri (BMRI) Direvisi Naik 3 Sekuritas Ini, Berikut Penjelasannya - Investor.ID","Target Saham Bank Mandiri (BMRI) Direvisi Naik 3 Sekuritas Ini, Berikut Penjelasannya  Investor.ID",2023-08-02,https://news.google.com/rss/articles/CBMidGh0dHBzOi8vaW52ZXN0b3IuaWQvbWFya2V0LzMzNjkyMS90YXJnZXQtc2FoYW0tYmFuay1tYW5kaXJpLWJtcmktZGlyZXZpc2ktbmFpay0zLXNla3VyaXRhcy1pbmktYmVyaWt1dC1wZW5qZWxhc2Fubnlh0gEA?oc=5&hl=en-ID&gl=ID&ceid=ID:en,"{'href': 'https://investor.id', 'title': 'Investor.ID'}",Missing,Missing
"Laba Impresif, Target Harga Saham Bank Mandiri (BMRI) Direvisi Naik - Investor.ID","Laba Impresif, Target Harga Saham Bank Mandiri (BMRI) Direvisi Naik  Investor.ID",2023-08-01,https://news.google.com/rss/articles/CBMiYmh0dHBzOi8vaW52ZXN0b3IuaWQvbWFya2V0LzMzNjgxMi9sYWJhLWltcHJlc2lmLXRhcmdldC1oYXJnYS1zYWhhbS1iYW5rLW1hbmRpcmktYm1yaS1kaXJldmlzaS1uYWlr0gEA?oc=5&hl=en-ID&gl=ID&ceid=ID:en,"{'href': 'https://investor.id', 'title': 'Investor.ID'}",Missing,Missing
"Semester I, Panca Mitra (PMMP) Cetak Pendapatan US$ 100,1 Juta - Investor.ID","Semester I, Panca Mitra (PMMP) Cetak Pendapatan US$ 100,1 Juta  Investor.ID",2023-08-01,https://news.google.com/rss/articles/CBMiW2h0dHBzOi8vaW52ZXN0b3IuaWQvbWFya2V0LzMzNjg2OS9zZW1lc3Rlci1pLXBhbmNhLW1pdHJhLXBtbXAtY2V0YWstcGVuZGFwYXRhbi11cy0xMDAxLWp1dGHSAQA?oc=5&hl=en-ID&gl=ID&ceid=ID:en,"{'href': 'https://investor.id', 'title': 'Investor.ID'}",Missing,Missing
"Gelar IPO Saham, Lupromax Pelumas Beberkan Target-target Berikut - Investor.ID","Gelar IPO Saham, Lupromax Pelumas Beberkan Target-target Berikut  Investor.ID",2023-08-01,https://news.google.com/rss/articles/CBMiYGh0dHBzOi8vaW52ZXN0b3IuaWQvbWFya2V0LzMzNjgxOS9nZWxhci1pcG8tc2FoYW0tbHVwcm9tYXgtcGVsdW1hcy1iZWJlcmthbi10YXJnZXR0YXJnZXQtYmVyaWt1dNIBAA?oc=5&hl=en-ID&gl=ID&ceid=ID:en,"{'href': 'https://investor.id', 'title': 'Investor.ID'}",Missing,Missing
Bank Mandiri (BMRI) Perkuat Layanan Trade Finance dan Cash Management - Investor.ID,Bank Mandiri (BMRI) Perkuat Layanan Trade Finance dan Cash Management  Investor.ID,2023-07-30,https://news.google.com/rss/articles/CBMiZWh0dHBzOi8vaW52ZXN0b3IuaWQvbWFya2V0LzMzNjU2Mi9iYW5rLW1hbmRpcmktYm1yaS1wZXJrdWF0LWxheWFuYW4tdHJhZGUtZmluYW5jZS1kYW4tY2FzaC1tYW5hZ2VtZW500gEA?oc=5&hl=en-ID&gl=ID&ceid=ID:en,"{'href': 'https://investor.id', 'title': 'Investor.ID'}",Missing,Missing
"Saham Amman Mineral Lebih Jos ketimbang NCKL dan MBMA, Ini Penyebabnya - Investor.ID","Saham Amman Mineral Lebih Jos ketimbang NCKL dan MBMA, Ini Penyebabnya  Investor.ID",2023-07-29,https://news.google.com/rss/articles/CBMiZ2h0dHBzOi8vaW52ZXN0b3IuaWQvbWFya2V0LzMzNjQ5Ni9zYWhhbS1hbW1hbi1taW5lcmFsLWxlYmloLWpvcy1rZXRpbWJhbmctbmNrbC1kYW4tbWJtYS1pbmktcGVueWViYWJueWHSAQA?oc=5&hl=en-ID&gl=ID&ceid=ID:en,"{'href': 'https://investor.id', 'title': 'Investor.ID'}",Missing,Missing
"Saham Telkom Terguncang Dua Sentimen Negatif, Waktunya Beli? - Investor.ID","Saham Telkom Terguncang Dua Sentimen Negatif, Waktunya Beli?  Investor.ID",2023-07-28,https://news.google.com/rss/articles/CBMiXGh0dHBzOi8vaW52ZXN0b3IuaWQvbWFya2V0LzMzNjM2MS9zYWhhbS10ZWxrb20tdGVyZ3VuY2FuZy1kdWEtc2VudGltZW4tbmVnYXRpZi13YWt0dW55YS1iZWxp0gEA?oc=5&hl=en-ID&gl=ID&ceid=ID:en,"{'href': 'https://investor.id', 'title': 'Investor.ID'}",Missing,Missing
13 Perusahaan Indonesia Sabet Penghargaan ESG Award 2023 - Investor.ID,13 Perusahaan Indonesia Sabet Penghargaan ESG Award 2023  Investor.ID,2023-07-28,https://news.google.com/rss/articles/CBMiWmh0dHBzOi8vaW52ZXN0b3IuaWQvbWFya2V0LzMzNjQzMC8xMy1wZXJ1c2FoYWFuLWluZG9uZXNpYS1zYWJldC1wZW5naGFyZ2Fhbi1lc2ctYXdhcmQtMjAyM9IBAA?oc=5&hl=en-ID&gl=ID&ceid=ID:en,"{'href': 'https://investor.id', 'title': 'Investor.ID'}",Missing,Missing
Bank Mandiri Raih Dua Penghargaan ABF Retail Banking Awards 2023 - Investor.ID,Bank Mandiri Raih Dua Penghargaan ABF Retail Banking Awards 2023  Investor.ID,2023-07-27,https://news.google.com/rss/articles/CBMiY2h0dHBzOi8vaW52ZXN0b3IuaWQvZmluYW5jZS8zMzYzMjkvYmFuay1tYW5kaXJpLXJhaWgtZHVhLXBlbmdoYXJnYWFuLWFiZi1yZXRhaWwtYmFua2luZy1hd2FyZHMtMjAyM9IBAA?oc=5&hl=en-ID&gl=ID&ceid=ID:en,"{'href': 'https://investor.id', 'title': 'Investor.ID'}",Missing,Missing
"Wajar BBRI All Time High Terus, Ini Alasannya - Investor.ID","Wajar BBRI All Time High Terus, Ini Alasannya  Investor.ID",2023-07-26,https://news.google.com/rss/articles/CBMiTmh0dHBzOi8vaW52ZXN0b3IuaWQvbWFya2V0LzMzNjE4Ny93YWphci1iYnJpLWFsbC10aW1lLWhpZ2gtdGVydXMtaW5pLWFsYXNhbm55YdIBAA?oc=5&hl=en-ID&gl=ID&ceid=ID:en,"{'href': 'https://investor.id', 'title': 'Investor.ID'}",Missing,Missing
"Market Cap BEI di Atas Rp 10.000 Triliun, Ukir Sejarah Baru! - Investor.ID","Market Cap BEI di Atas Rp 10.000 Triliun, Ukir Sejarah Baru!  Investor.ID",2023-07-26,https://news.google.com/rss/articles/CBMiW2h0dHBzOi8vaW52ZXN0b3IuaWQvbWFya2V0LzMzNjIyMy9tYXJrZXQtY2FwLWJlaS1kaS1hdGFzLXJwLTEwMDAwLXRyaWxpdW4tdWtpci1zZWphcmFoLWJhcnXSAQA?oc=5&hl=en-ID&gl=ID&ceid=ID:en,"{'href': 'https://investor.id', 'title': 'Investor.ID'}",Missing,Missing
"Siapin Duit, Enam Saham Siklikal Bakal Manggung di Semester II - Investor.ID","Siapin Duit, Enam Saham Siklikal Bakal Manggung di Semester II  Investor.ID",2023-07-26,https://news.google.com/rss/articles/CBMiX2h0dHBzOi8vaW52ZXN0b3IuaWQvbWFya2V0LzMzNjExMS9zaWFwaW4tZHVpdC1lbmFtLXNhaGFtLXNpa2xpa2FsLWJha2FsLW1hbmdndW5nLWRpLXNlbWVzdGVyLWlp0gEA?oc=5&hl=en-ID&gl=ID&ceid=ID:en,"{'href': 'https://investor.id', 'title': 'Investor.ID'}",Missing,Missing
Bank Mandiri Hong Kong Incar Pertumbuhan Bisnis 10% - Investor.ID,Bank Mandiri Hong Kong Incar Pertumbuhan Bisnis 10%  Investor.ID,2023-07-25,https://news.google.com/rss/articles/CBMiVWh0dHBzOi8vaW52ZXN0b3IuaWQvZmluYW5jZS8zMzU5NjAvYmFuay1tYW5kaXJpLWhvbmcta29uZy1pbmNhci1wZXJ0dW1idWhhbi1iaXNuaXMtMTDSAQA?oc=5&hl=en-ID&gl=ID&ceid=ID:en,"{'href': 'https://investor.id', 'title': 'Investor.ID'}",Missing,Missing
"Saham BRI (BBRI) Cetak All Time High, Bagaimana dengan Target Harganya? - Investor.ID","Saham BRI (BBRI) Cetak All Time High, Bagaimana dengan Target Harganya?  Investor.ID",2023-07-25,https://news.google.com/rss/articles/CBMiZGh0dHBzOi8vaW52ZXN0b3IuaWQvbWFya2V0LzMzNjA2MS9zYWhhbS1icmktYmJyaS1jZXRha2FsbC10aW1lLWhpZ2gtYmFnYWltYW5hLWRlbmdhbi10YXJnZXQtaGFyZ2FueWHSAQA?oc=5&hl=en-ID&gl=ID&ceid=ID:en,"{'href': 'https://investor.id', 'title': 'Investor.ID'}",Missing,Missing
"Akhirnya, Amman Mineral (AMMN) Tembus Jajaran Emiten Elite - Investor.ID","Akhirnya, Amman Mineral (AMMN) Tembus Jajaran Emiten Elite  Investor.ID",2023-07-23,https://news.google.com/rss/articles/CBMiWWh0dHBzOi8vaW52ZXN0b3IuaWQvbWFya2V0LzMzNTgyNi9ha2hpcm55YS1hbW1hbi1taW5lcmFsLWFtbW4tdGVtYnVzLWphamFyYW4tZW1pdGVuLWVsaXRl0gEA?oc=5&hl=en-ID&gl=ID&ceid=ID:en,"{'href': 'https://investor.id', 'title': 'Investor.ID'}",Missing,Missing
Dividen Jumbo Kekang Ekspansi BUMN - Investor.ID,Dividen Jumbo Kekang Ekspansi BUMN  Investor.ID,2023-07-21,https://news.google.com/rss/articles/CBMiRGh0dHBzOi8vaW52ZXN0b3IuaWQvbWFya2V0LzMzNTY5Mi9kaXZpZGVuLWp1bWJvLWtla2FuZy1la3NwYW5zaS1idW1u0gEA?oc=5&hl=en-ID&gl=ID&ceid=ID:en,"{'href': 'https://investor.id', 'title': 'Investor.ID'}",Missing,Missing
"Market Cap BEI Dekati Rp 10.000 Triliun, Barisan Emiten Elite Ini Penguasanya - Investor.ID","Market Cap BEI Dekati Rp 10.000 Triliun, Barisan Emiten Elite Ini Penguasanya  Investor.ID",2023-07-16,https://news.google.com/rss/articles/CBMibWh0dHBzOi8vaW52ZXN0b3IuaWQvbWFya2V0LzMzNTI0NC9tYXJrZXQtY2FwLWJlaS1kZWthdGktcnAtMTAwMDAtdHJpbGl1bi1iYXJpc2FuLWVtaXRlbi1lbGl0ZS1pbmktcGVuZ3Vhc2FueWHSAQA?oc=5&hl=en-ID&gl=ID&ceid=ID:en,"{'href': 'https://investor.id', 'title': 'Investor.ID'}",Missing,Missing
"IHSG Masuk Era Bullish, Dua Saham Ini Bakal Tambah Panas - Investor.ID","IHSG Masuk Era Bullish, Dua Saham Ini Bakal Tambah Panas  Investor.ID",2023-07-15,https://news.google.com/rss/articles/CBMiWWh0dHBzOi8vaW52ZXN0b3IuaWQvbWFya2V0LzMzNTE2NC9paHNnLW1hc3VrLWVyYS1idWxsaXNoLWR1YS1zYWhhbS1pbmktYmFrYWwtdGFtYmFoLXBhbmFz0gEA?oc=5&hl=en-ID&gl=ID&ceid=ID:en,"{'href': 'https://investor.id', 'title': 'Investor.ID'}",Missing,Missing
"Gencar Garap ESG, Bank Mandiri (BMRI) Luncurkan Digital Carbon Tracking dan Kartu Plastik Daur Ulang - Investor.ID","Gencar Garap ESG, Bank Mandiri (BMRI) Luncurkan Digital Carbon Tracking dan Kartu Plastik Daur Ulang  Investor.ID",2023-07-12,https://news.google.com/rss/articles/CBMigwFodHRwczovL2ludmVzdG9yLmlkL21hcmtldC8zMzQ4NDUvZ2VuY2FyLWdhcmFwLWVzZy1iYW5rLW1hbmRpcmktYm1yaS1sdW5jdXJrYW4tZGlnaXRhbC1jYXJib24tdHJhY2tpbmctZGFuLWthcnR1LXBsYXN0aWstZGF1ci11bGFuZ9IBAA?oc=5&hl=en-ID&gl=ID&ceid=ID:en,"{'href': 'https://investor.id', 'title': 'Investor.ID'}",Missing,Missing
"Volume Transaksi Remitansi Bank Mandiri Meningkat 13,2% dalam Lima Bulan - Investor.ID","Volume Transaksi Remitansi Bank Mandiri Meningkat 13,2% dalam Lima Bulan  Investor.ID",2023-07-10,https://news.google.com/rss/articles/CBMiaWh0dHBzOi8vaW52ZXN0b3IuaWQvZmluYW5jZS8zMzQ2NDYvdm9sdW1lLXRyYW5zYWtzaS1yZW1pdGFuc2ktYmFuay1tYW5kaXJpLW1lbmluZ2thdC0xMzItZGFsYW0tbGltYS1idWxhbtIBAA?oc=5&hl=en-ID&gl=ID&ceid=ID:en,"{'href': 'https://investor.id', 'title': 'Investor.ID'}",Missing,Missing
Kehadiran Off Taker Bantu Bank Cegah Risiko Kredit Perikanan - Investor.ID,Kehadiran Off Taker Bantu Bank Cegah Risiko Kredit Perikanan  Investor.ID,2023-07-10,https://news.google.com/rss/articles/CBMiX2h0dHBzOi8vaW52ZXN0b3IuaWQvZmluYW5jZS8zMzQ1NDEva2VoYWRpcmFuLW9mZi10YWtlci1iYW50dS1iYW5rLWNlZ2FoLXJpc2lrby1rcmVkaXQtcGVyaWthbmFu0gEA?oc=5&hl=en-ID&gl=ID&ceid=ID:en,"{'href': 'https://investor.id', 'title': 'Investor.ID'}",Missing,Missing
Indodana Jaga Kualitas Pinjaman Lewat Edukasi dan Literasi Keuangan - Investor.ID,Indodana Jaga Kualitas Pinjaman Lewat Edukasi dan Literasi Keuangan  Investor.ID,2023-07-08,https://news.google.com/rss/articles/CBMiZmh0dHBzOi8vaW52ZXN0b3IuaWQvZmluYW5jZS8zMzQ1MDkvaW5kb2RhbmEtamFnYS1rdWFsaXRhcy1waW5qYW1hbi1sZXdhdC1lZHVrYXNpLWRhbi1saXRlcmFzaS1rZXVhbmdhbtIBAA?oc=5&hl=en-ID&gl=ID&ceid=ID:en,"{'href': 'https://investor.id', 'title': 'Investor.ID'}",Missing,Missing
"BCA (BBCA) Cetak Pertumbuhan Tertinggi, Empat Bank Besar Raih Laba Rp 66 T - Investor.ID","BCA (BBCA) Cetak Pertumbuhan Tertinggi, Empat Bank Besar Raih Laba Rp 66 T  Investor.ID",2023-07-06,https://news.google.com/rss/articles/CBMiaGh0dHBzOi8vaW52ZXN0b3IuaWQvbWFya2V0LzMzNDIyNy9iY2EtYmJjYS1jZXRhay1wZXJ0dW1idWhhbi10ZXJ0aW5nZ2llbXBhdC1iYW5rLWJlc2FyLXJhaWgtbGFiYS1ycC02Ni100gEA?oc=5&hl=en-ID&gl=ID&ceid=ID:en,"{'href': 'https://investor.id', 'title': 'Investor.ID'}",Missing,Missing
Bank Mandiri (BMRI) Gandeng Kredivo Salurkan Kredit Rp 1 T - Investor.ID,Bank Mandiri (BMRI) Gandeng Kredivo Salurkan Kredit Rp 1 T  Investor.ID,2023-07-05,https://news.google.com/rss/articles/CBMiW2h0dHBzOi8vaW52ZXN0b3IuaWQvZmluYW5jZS8zMzQxMzcvYmFuay1tYW5kaXJpLWJtcmktZ2FuZGVuZy1rcmVkaXZvLXNhbHVya2FuLWtyZWRpdC1ycC0xLXTSAQA?oc=5&hl=en-ID&gl=ID&ceid=ID:en,"{'href': 'https://investor.id', 'title': 'Investor.ID'}",Missing,Missing
"Kisi-kisi Cuan Saham Bank, BNI (BBNI) dan BRI (BBRI) Pilihan Teratas - Investor.ID","Kisi-kisi Cuan Saham Bank, BNI (BBNI) dan BRI (BBRI) Pilihan Teratas  Investor.ID",2023-07-05,https://news.google.com/rss/articles/CBMiYGh0dHBzOi8vaW52ZXN0b3IuaWQvbWFya2V0LzMzNDIwNi9raXNpa2lzaS1jdWFuLXNhaGFtLWJhbmstYm5pLWJibmktZGFuLWJyaS1iYnJpLXBpbGloYW4tdGVyYXRhc9IBAA?oc=5&hl=en-ID&gl=ID&ceid=ID:en,"{'href': 'https://investor.id', 'title': 'Investor.ID'}",Missing,Missing
Kelangkaan Ban Alat Berat Hambat Ekspor Batu Bara - Investor.ID,Kelangkaan Ban Alat Berat Hambat Ekspor Batu Bara  Investor.ID,2023-06-20,https://news.google.com/rss/articles/CBMiVWh0dHBzOi8vaW52ZXN0b3IuaWQvYnVzaW5lc3MvMzMyNzI1L2tlbGFuZ2thYW4tYmFuLWFsYXQtYmVyYXQtaGFtYmF0LWVrc3Bvci1iYXR1LWJhcmHSAQA?oc=5&hl=en-ID&gl=ID&ceid=ID:en,"{'href': 'https://investor.id', 'title': 'Investor.ID'}",Missing,Missing
"Saat Akuisisi Lahan Sulit, Saham Emiten Properti Ini Jadi Pilihan - Investor.ID","Saat Akuisisi Lahan Sulit, Saham Emiten Properti Ini Jadi Pilihan  Investor.ID",2023-06-20,https://news.google.com/rss/articles/CBMiY2h0dHBzOi8vaW52ZXN0b3IuaWQvbWFya2V0LzMzMjczMy9zYWF0LWFrdWlzaXNpLWxhaGFuLXN1bGl0LXNhaGFtLWVtaXRlbi1wcm9wZXJ0aS1pbmktamFkaS1waWxpaGFuLdIBAA?oc=5&hl=en-ID&gl=ID&ceid=ID:en,"{'href': 'https://investor.id', 'title': 'Investor.ID'}",Missing,Missing
TERPOPULER: Lo Kheng Hong Terpincut Saham Ini hingga Potensi Cuan BRIS (BSI) - Investor.ID,TERPOPULER: Lo Kheng Hong Terpincut Saham Ini hingga Potensi Cuan BRIS (BSI)  Investor.ID,2023-06-14,https://news.google.com/rss/articles/CBMia2h0dHBzOi8vaW52ZXN0b3IuaWQvbWFya2V0LzMzMjIwMi90ZXJwb3B1bGVyLWxvLWtoZW5nLWhvbmctdGVycGluY3V0LXNhaGFtLWluaS1oaW5nZ2EtcG90ZW5zaS1jdWFuLWJyaXMtYnNp0gEA?oc=5&hl=en-ID&gl=ID&ceid=ID:en,"{'href': 'https://investor.id', 'title': 'Investor.ID'}",Missing,Missing
"BSI (BRIS) Sang Penguasa Pangsa Pasar, Potensi Cuan Sahamnya Besar - Investor.ID","BSI (BRIS) Sang Penguasa Pangsa Pasar, Potensi Cuan Sahamnya Besar  Investor.ID",2023-06-13,https://news.google.com/rss/articles/CBMiYWh0dHBzOi8vaW52ZXN0b3IuaWQvbWFya2V0LzMzMjA4OS9ic2ktYnJpcy1zYW5nLXBlbmd1YXNhLXBhbmdzYS1wYXNhci1wb3RlbnNpLWN1YW4tc2FoYW1ueWEtYmVzYXLSAQA?oc=5&hl=en-ID&gl=ID&ceid=ID:en,"{'href': 'https://investor.id', 'title': 'Investor.ID'}",Missing,Missing
"Usai Ditanyai BEI, Saham Bayan (BYAN) Melesat hingga Rebut Market Cap Tiga - Investor.ID","Usai Ditanyai BEI, Saham Bayan (BYAN) Melesat hingga Rebut Market Cap Tiga  Investor.ID",2023-06-12,https://news.google.com/rss/articles/CBMiaWh0dHBzOi8vaW52ZXN0b3IuaWQvbWFya2V0LzMzMjAwMC91c2FpLWRpdGFueWFpLWJlaS1zYWhhbS1iYXlhbi1ieWFuLW1lbGVzYXQtaGluZ2dhLXJlYnV0LW1hcmtldC1jYXAtdGlnYdIBAA?oc=5&hl=en-ID&gl=ID&ceid=ID:en,"{'href': 'https://investor.id', 'title': 'Investor.ID'}",Missing,Missing
PNM Raih CSR Awards 2023 Berkat Program Kampung Madani - Investor.ID,PNM Raih CSR Awards 2023 Berkat Program Kampung Madani  Investor.ID,2023-06-01,https://news.google.com/rss/articles/CBMiWWh0dHBzOi8vaW52ZXN0b3IuaWQvZmluYW5jZS8zMzEwNDQvcG5tLXJhaWgtY3NyLWF3YXJkcy0yMDIzLWJlcmthdC1wcm9ncmFtLWthbXB1bmctbWFkYW5p0gEA?oc=5&hl=en-ID&gl=ID&ceid=ID:en,"{'href': 'https://investor.id', 'title': 'Investor.ID'}",Missing,Missing
"Bangun Pagi, Low Tuck Kwong Langsung Kehilangan Kekayaan Rp 20,32 Triliun - Investor.ID","Bangun Pagi, Low Tuck Kwong Langsung Kehilangan Kekayaan Rp 20,32 Triliun  Investor.ID",2023-05-31,https://news.google.com/rss/articles/CBMiaWh0dHBzOi8vaW52ZXN0b3IuaWQvbWFya2V0LzMzMDkxNC9iYW5ndW4tcGFnaS1sb3ctdHVjay1rd29uZy1sYW5nc3VuZy1rZWhpbGFuZ2FuLWtla2F5YWFuLXJwLTIwMzItdHJpbGl1btIBAA?oc=5&hl=en-ID&gl=ID&ceid=ID:en,"{'href': 'https://investor.id', 'title': 'Investor.ID'}",Missing,Missing
"Kinerja Unggul, 18 Bank Sabet Predikat Bank Terbaik 2023 - Investor.ID","Kinerja Unggul, 18 Bank Sabet Predikat Bank Terbaik 2023  Investor.ID",2023-05-26,https://news.google.com/rss/articles/CBMiWmh0dHBzOi8vaW52ZXN0b3IuaWQvZmluYW5jZS8zMzA1MjIva2luZXJqYS11bmdndWwtMTgtYmFuay1zYWJldC1wcmVkaWthdC1iYW5rLXRlcmJhaWstMjAyM9IBAA?oc=5&hl=en-ID&gl=ID&ceid=ID:en,"{'href': 'https://investor.id', 'title': 'Investor.ID'}",Missing,Missing
MPX Logistics (MPXL) Raih Kontrak Pengangkutan dari Smelter Amman Mineral - Investor.ID,MPX Logistics (MPXL) Raih Kontrak Pengangkutan dari Smelter Amman Mineral  Investor.ID,2023-05-22,https://news.google.com/rss/articles/CBMiaWh0dHBzOi8vaW52ZXN0b3IuaWQvbWFya2V0LzMzMDEyMS9tcHgtbG9naXN0aWNzLW1weGwtcmFpaC1rb250cmFrLXBlbmdhbmdrdXRhbi1kYXJpLXNtZWx0ZXItYW1tYW4tbWluZXJhbNIBAA?oc=5&hl=en-ID&gl=ID&ceid=ID:en,"{'href': 'https://investor.id', 'title': 'Investor.ID'}",Missing,Missing
