title,description,published date,url,publisher,keywords,content
"Pelayaran Tamarin (TAMU) Optimistis Kenaikan Pendapatan 30,9% - Investor.ID","Pelayaran Tamarin (TAMU) Optimistis Kenaikan Pendapatan 30,9%  Investor.ID",2023-05-19,https://news.google.com/rss/articles/CBMiW2h0dHBzOi8vaW52ZXN0b3IuaWQvbWFya2V0LzMyOTkxNi9wZWxheWFyYW4tdGFtYXJpbi10YW11LW9wdGltaXN0aXMta2VuYWlrYW4tcGVuZGFwYXRhbi0zMDnSAQA?oc=5&hl=en-ID&gl=ID&ceid=ID:en,"{'href': 'https://investor.id', 'title': 'Investor.ID'}",Missing,Missing
"Investor Asing Net Sell Rp 595,79 Miliar, Tiga Saham Bank Ini Dilego - Investor.ID","Investor Asing Net Sell Rp 595,79 Miliar, Tiga Saham Bank Ini Dilego  Investor.ID",2023-05-16,https://news.google.com/rss/articles/CBMiZGh0dHBzOi8vaW52ZXN0b3IuaWQvbWFya2V0LzMyOTY1My9pbnZlc3Rvci1hc2luZy1uZXQtc2VsbC1ycC01OTU3OS1taWxpYXItdGlnYS1zYWhhbS1iYW5rLWluaS1kaWxlZ2_SAQA?oc=5&hl=en-ID&gl=ID&ceid=ID:en,"{'href': 'https://investor.id', 'title': 'Investor.ID'}",Missing,Missing
Princess of Bahrain Terpesona Koleksi Passion Jewelry - Investor.ID,Princess of Bahrain Terpesona Koleksi Passion Jewelry  Investor.ID,2023-05-15,https://news.google.com/rss/articles/CBMiWmh0dHBzOi8vaW52ZXN0b3IuaWQvbGlmZXN0eWxlLzMyOTQ5NS9wcmluY2Vzcy1vZi1iYWhyYWluLXRlcnBlc29uYS1rb2xla3NpLXBhc3Npb24tamV3ZWxyedIBAA?oc=5&hl=en-ID&gl=ID&ceid=ID:en,"{'href': 'https://investor.id', 'title': 'Investor.ID'}",Missing,Missing
Bank Mandiri (BMRI) Incar Bisnis Kartu Kredit Tumbuh 40% - Investor.ID,Bank Mandiri (BMRI) Incar Bisnis Kartu Kredit Tumbuh 40%  Investor.ID,2023-05-11,https://news.google.com/rss/articles/CBMiV2h0dHBzOi8vaW52ZXN0b3IuaWQvbWFya2V0LzMyOTEyMS9iYW5rLW1hbmRpcmktYm1yaS1pbmNhci1iaXNuaXMta2FydHUta3JlZGl0LXR1bWJ1aC00MNIBAA?oc=5&hl=en-ID&gl=ID&ceid=ID:en,"{'href': 'https://investor.id', 'title': 'Investor.ID'}",Missing,Missing
Ini Kontribusi Bank Mandiri Sebagai Agen Pembangunan - Investor.ID,Ini Kontribusi Bank Mandiri Sebagai Agen Pembangunan  Investor.ID,2023-04-18,https://news.google.com/rss/articles/CBMiV2h0dHBzOi8vaW52ZXN0b3IuaWQvZmluYW5jZS8zMjc1NDUvaW5pLWtvbnRyaWJ1c2ktYmFuay1tYW5kaXJpLXNlYmFnYWktYWdlbi1wZW1iYW5ndW5hbtIBAA?oc=5&hl=en-ID&gl=ID&ceid=ID:en,"{'href': 'https://investor.id', 'title': 'Investor.ID'}",Missing,Missing
"Bukan Stock Split Kali Pertama, Bank Mandiri (BMRI) Pernah Lakukan Aksi Serupa - Investor.ID","Bukan Stock Split Kali Pertama, Bank Mandiri (BMRI) Pernah Lakukan Aksi Serupa  Investor.ID",2023-04-04,https://news.google.com/rss/articles/CBMibGh0dHBzOi8vaW52ZXN0b3IuaWQvbWFya2V0LzMyNjM2Mi9idWthbi1zdG9jay1zcGxpdC1rYWxpcGVydGFtYS1iYW5rLW1hbmRpcmktYm1yaS1wZXJuYWgtbGFrdWthbi1ha3NpLXNlcnVwYdIBAA?oc=5&hl=en-ID&gl=ID&ceid=ID:en,"{'href': 'https://investor.id', 'title': 'Investor.ID'}",Missing,Missing
Anak Usaha Wijaya Karya (WIKA) Raih Kredit Sindikasi Rp 300 M - Investor.ID,Anak Usaha Wijaya Karya (WIKA) Raih Kredit Sindikasi Rp 300 M  Investor.ID,2023-04-04,https://news.google.com/rss/articles/CBMiXWh0dHBzOi8vaW52ZXN0b3IuaWQvbWFya2V0LzMyNjM0NC9hbmFrLXVzYWhhLXdpamF5YS1rYXJ5YS13aWthLXJhaWgta3JlZGl0LXNpbmRpa2FzaS1ycC0zMDAtbdIBAA?oc=5&hl=en-ID&gl=ID&ceid=ID:en,"{'href': 'https://investor.id', 'title': 'Investor.ID'}",Missing,Missing
"BCA (BBCA) dan GI Milik Duo Hartono Gelar Transaksi, Ternyata Segini Nilai Pasarnya - Investor.ID","BCA (BBCA) dan GI Milik Duo Hartono Gelar Transaksi, Ternyata Segini Nilai Pasarnya  Investor.ID",2023-04-04,https://news.google.com/rss/articles/CBMicWh0dHBzOi8vaW52ZXN0b3IuaWQvbWFya2V0LzMyNjMyOC9iY2EtYmJjYS1kYW5naS1taWxpay1kdW8taGFydG9uby1nZWxhci10cmFuc2Frc2ktdGVybnlhdGEtc2VnaW5pLW5pbGFpLXBhc2Fybnlh0gEA?oc=5&hl=en-ID&gl=ID&ceid=ID:en,"{'href': 'https://investor.id', 'title': 'Investor.ID'}",Missing,Missing
"Jelang Lebaran, Bank Mandiri Siapkan Uang Tunai Rp 49,6 Triliun - Investor.ID","Jelang Lebaran, Bank Mandiri Siapkan Uang Tunai Rp 49,6 Triliun  Investor.ID",2023-03-31,https://news.google.com/rss/articles/CBMiYGh0dHBzOi8vaW52ZXN0b3IuaWQvZmluYW5jZS8zMjYwMzAvamVsYW5nLWxlYmFyYW4tYmFuay1tYW5kaXJpLXNpYXBrYW4tdWFuZy10dW5haS1ycC00OTYtdHJpbGl1btIBAA?oc=5&hl=en-ID&gl=ID&ceid=ID:en,"{'href': 'https://investor.id', 'title': 'Investor.ID'}",Missing,Missing
Semen Baturaja (SMBR) Raih Kredit Sindikasi Berkelanjutan Rp 901 M dari 4 Bank - Investor.ID,Semen Baturaja (SMBR) Raih Kredit Sindikasi Berkelanjutan Rp 901 M dari 4 Bank  Investor.ID,2023-03-29,https://news.google.com/rss/articles/CBMibmh0dHBzOi8vaW52ZXN0b3IuaWQvbWFya2V0LzMyNTgxNi9zZW1lbi1iYXR1cmFqYS1zbWJyLXJhaWgta3JlZGl0LXNpbmRpa2FzaS1iZXJrZWxhbmp1dGFuLXJwLTkwMS1tLWRhcmktNC1iYW5r0gEA?oc=5&hl=en-ID&gl=ID&ceid=ID:en,"{'href': 'https://investor.id', 'title': 'Investor.ID'}",Missing,Missing
Bos Bank Mandiri Bicara Implementasi Bisnis ESG - Investor.ID,Bos Bank Mandiri Bicara Implementasi Bisnis ESG  Investor.ID,2023-03-28,https://news.google.com/rss/articles/CBMiUmh0dHBzOi8vaW52ZXN0b3IuaWQvZmluYW5jZS8zMjU3MDYvYm9zLWJhbmstbWFuZGlyaS1iaWNhcmEtaW1wbGVtZW50YXNpLWJpc25pcy1lc2fSAQA?oc=5&hl=en-ID&gl=ID&ceid=ID:en,"{'href': 'https://investor.id', 'title': 'Investor.ID'}",Missing,Missing
Ssstt! Petrosea Milik Haji Robert (PTRO) Mau Kasih Surprise - Investor.ID,Ssstt! Petrosea Milik Haji Robert (PTRO) Mau Kasih Surprise  Investor.ID,2023-03-27,https://news.google.com/rss/articles/CBMiWmh0dHBzOi8vaW52ZXN0b3IuaWQvbWFya2V0LzMyNTU2NC9zc3N0dC1wZXRyb3NlYS1taWxpay1oYWppLXJvYmVydC1wdHJvLW1hdS1rYXNpaC1zdXJwcmlzZdIBAA?oc=5&hl=en-ID&gl=ID&ceid=ID:en,"{'href': 'https://investor.id', 'title': 'Investor.ID'}",Missing,Missing
"Dana Kelolaan Bank Mandiri (BMRI) Tumbuh 13,4% - Investor.ID","Dana Kelolaan Bank Mandiri (BMRI) Tumbuh 13,4%  Investor.ID",2023-03-26,https://news.google.com/rss/articles/CBMiTGh0dHBzOi8vaW52ZXN0b3IuaWQvbWFya2V0LzMyNTQ5Ni9kYW5hLWtlbG9sYWFuLWJhbmstbWFuZGlyaS1ibXJpLXR1bWJ1aC0xMzTSAQA?oc=5&hl=en-ID&gl=ID&ceid=ID:en,"{'href': 'https://investor.id', 'title': 'Investor.ID'}",Missing,Missing
Sillo Maritime (SHIP) Beli Kapal Tanker Rp 830 Miliar - Investor.ID,Sillo Maritime (SHIP) Beli Kapal Tanker Rp 830 Miliar  Investor.ID,2023-03-25,https://news.google.com/rss/articles/CBMiVGh0dHBzOi8vaW52ZXN0b3IuaWQvbWFya2V0LzMyNTQxOC9zaWxsby1tYXJpdGltZS1zaGlwLWJlbGlrYXBhbC10YW5rZXItcnAtODMwLW1pbGlhctIBAA?oc=5&hl=en-ID&gl=ID&ceid=ID:en,"{'href': 'https://investor.id', 'title': 'Investor.ID'}",Missing,Missing
"Dorong Bisnis Wealth Management, Bank Mandiri Andalkan Fitur Livin' Investasi - Investor.ID","Dorong Bisnis Wealth Management, Bank Mandiri Andalkan Fitur Livin' Investasi  Investor.ID",2023-03-24,https://news.google.com/rss/articles/CBMicGh0dHBzOi8vaW52ZXN0b3IuaWQvZmluYW5jZS8zMjUzOTEvZG9yb25nLWJpc25pcy13ZWFsdGgtbWFuYWdlbWVudC1iYW5rLW1hbmRpcmktYW5kYWxrYW4tZml0dXItbGl2aW4zOS1pbnZlc3Rhc2nSAQA?oc=5&hl=en-ID&gl=ID&ceid=ID:en,"{'href': 'https://investor.id', 'title': 'Investor.ID'}",Missing,Missing
"Gugat 11 Pihak, PN Jakpus Terima Class Action Gagal Ginjal Akut pada Anak - Investor.ID","Gugat 11 Pihak, PN Jakpus Terima Class Action Gagal Ginjal Akut pada Anak  Investor.ID",2023-03-21,https://news.google.com/rss/articles/CBMibGh0dHBzOi8vaW52ZXN0b3IuaWQvbmF0aW9uYWwvMzI1MTY1L2d1Z2F0LTExLXBpaGFrLXBuLWpha3B1cy10ZXJpbWEtY2xhc3MtYWN0aW9uLWdhZ2FsLWdpbmphbC1ha3V0LXBhZGEtYW5ha9IBAA?oc=5&hl=en-ID&gl=ID&ceid=ID:en,"{'href': 'https://investor.id', 'title': 'Investor.ID'}",Missing,Missing
"Waktunya Borong Saham Murah, Ini Daftarnya - Investor.ID","Waktunya Borong Saham Murah, Ini Daftarnya  Investor.ID",2023-03-20,https://news.google.com/rss/articles/CBMiS2h0dHBzOi8vaW52ZXN0b3IuaWQvbWFya2V0LzMyNDk3NC93YWt0dW55YS1ib3Jvbmctc2FoYW0tbXVyYWgtaW5pLWRhZnRhcm55YdIBAA?oc=5&hl=en-ID&gl=ID&ceid=ID:en,"{'href': 'https://investor.id', 'title': 'Investor.ID'}",Missing,Missing
4 Bank BUMN Kini Dipimpin Alumni Bank Mandiri - Investor.ID,4 Bank BUMN Kini Dipimpin Alumni Bank Mandiri  Investor.ID,2023-03-17,https://news.google.com/rss/articles/CBMiT2h0dHBzOi8vaW52ZXN0b3IuaWQvbWFya2V0LzMyNDcxNi80LWJhbmstYnVtbi1raW5pLWRpcGltcGluLWFsdW1uaS1iYW5rLW1hbmRpcmnSAQA?oc=5&hl=en-ID&gl=ID&ceid=ID:en,"{'href': 'https://investor.id', 'title': 'Investor.ID'}",Missing,Missing
Empat Dirut Bank Himbara Tetap di Posisinya - Investor.ID,Empat Dirut Bank Himbara Tetap di Posisinya  Investor.ID,2023-03-13,https://news.google.com/rss/articles/CBMiW2h0dHBzOi8vaW52ZXN0b3IuaWQvbWFya2V0LWFuZC1jb3Jwb3JhdGUvMzI0MzE5L2VtcGF0LWRpcnV0LWJhbmstaGltYmFyYS10ZXRhcC1kaS1wb3Npc2lueWHSAQA?oc=5&hl=en-ID&gl=ID&ceid=ID:en,"{'href': 'https://investor.id', 'title': 'Investor.ID'}",Missing,Missing
"IHSG Berpotensi Menguat, Intip Enam Saham Pilihan Untuk Trading Pekan Ini - Investor.ID","IHSG Berpotensi Menguat, Intip Enam Saham Pilihan Untuk Trading Pekan Ini  Investor.ID",2023-03-13,https://news.google.com/rss/articles/CBMieGh0dHBzOi8vaW52ZXN0b3IuaWQvbWFya2V0LWFuZC1jb3Jwb3JhdGUvMzI0MzQyL2loc2ctYmVycG90ZW5zaS1tZW5ndWF0LWludGlwLWVuYW0tc2FoYW0tcGlsaWhhbi11bnR1ay10cmFkaW5nLXBla2FuLWluadIBAA?oc=5&hl=en-ID&gl=ID&ceid=ID:en,"{'href': 'https://investor.id', 'title': 'Investor.ID'}",Missing,Missing
"BCA Masih Gas Pol di 2023, Broker Ini Kasih Target Harga Tinggi - Investor.ID","BCA Masih Gas Pol di 2023, Broker Ini Kasih Target Harga Tinggi  Investor.ID",2023-03-06,https://news.google.com/rss/articles/CBMibmh0dHBzOi8vaW52ZXN0b3IuaWQvbWFya2V0LWFuZC1jb3Jwb3JhdGUvMzIzNjU0L2JjYS1tYXNpaC1nYXMtcG9sLWRpLTIwMjMtYnJva2VyLWluaS1rYXNpaC10YXJnZXQtaGFyZ2EtdGluZ2dp0gEA?oc=5&hl=en-ID&gl=ID&ceid=ID:en,"{'href': 'https://investor.id', 'title': 'Investor.ID'}",Missing,Missing
"Tawarkan Bunga 6,35-6,6%, Protelindo Terbitkan Obligasi Rp 2,9 Triliun - Investor.ID","Tawarkan Bunga 6,35-6,6%, Protelindo Terbitkan Obligasi Rp 2,9 Triliun  Investor.ID",2023-03-03,https://news.google.com/rss/articles/CBMicGh0dHBzOi8vaW52ZXN0b3IuaWQvbWFya2V0LWFuZC1jb3Jwb3JhdGUvMzIzNDk2L3Rhd2Fya2FuLWJ1bmdhLTYzNTY2LXByb3RlbGluZG8tdGVyYml0a2FuLW9ibGlnYXNpLXJwLTI5LXRyaWxpdW7SAQA?oc=5&hl=en-ID&gl=ID&ceid=ID:en,"{'href': 'https://investor.id', 'title': 'Investor.ID'}",Missing,Missing
"Melesat 225%, MUF Cetak Laba Rp 333 Miliar - Investor.ID","Melesat 225%, MUF Cetak Laba Rp 333 Miliar  Investor.ID",2023-03-02,https://news.google.com/rss/articles/CBMiS2h0dHBzOi8vaW52ZXN0b3IuaWQvZmluYW5jZS8zMjM0MDMvbWVsZXNhdC0yMjUtbXVmLWNldGFrLWxhYmEtcnAtMzMzLW1pbGlhctIBAA?oc=5&hl=en-ID&gl=ID&ceid=ID:en,"{'href': 'https://investor.id', 'title': 'Investor.ID'}",Missing,Missing
Daftar 32 Saham Digembok 'Berjamaah' - Investor.ID,Daftar 32 Saham Digembok 'Berjamaah'  Investor.ID,2023-03-02,https://news.google.com/rss/articles/CBMiVGh0dHBzOi8vaW52ZXN0b3IuaWQvbWFya2V0LWFuZC1jb3Jwb3JhdGUvMzIzMzMyL2RhZnRhci0zMi1zYWhhbS1kaWdlbWJvay1iZXJqYW1hYWgzOdIBAA?oc=5&hl=en-ID&gl=ID&ceid=ID:en,"{'href': 'https://investor.id', 'title': 'Investor.ID'}",Missing,Missing
"Peluang Investasi Masih Besar, Yuanta Sekuritas Indonesia Rilis Mobile App Trading - Investor.ID","Peluang Investasi Masih Besar, Yuanta Sekuritas Indonesia Rilis Mobile App Trading  Investor.ID",2023-03-02,https://news.google.com/rss/articles/CBMigQFodHRwczovL2ludmVzdG9yLmlkL21hcmtldC1hbmQtY29ycG9yYXRlLzMyMzM1Mi9wZWx1YW5nLWludmVzdGFzaS1tYXNpaC1iZXNhci15dWFudGEtc2VrdXJpdGFzLWluZG9uZXNpYS1yaWxpcy1tb2JpbGUtYXBwLXRyYWRpbmfSAQA?oc=5&hl=en-ID&gl=ID&ceid=ID:en,"{'href': 'https://investor.id', 'title': 'Investor.ID'}",Missing,Missing
"Tumbuh 208%, Penyaluran Kredit BTPN Lewat Jenius Tembus Rp 1 T - Investor.ID","Tumbuh 208%, Penyaluran Kredit BTPN Lewat Jenius Tembus Rp 1 T  Investor.ID",2023-03-01,https://news.google.com/rss/articles/CBMiX2h0dHBzOi8vaW52ZXN0b3IuaWQvZmluYW5jZS8zMjMyNDQvdHVtYnVoLTIwOC1wZW55YWx1cmFuLWtyZWRpdC1idHBuLWxld2F0LWplbml1cy10ZW1idXMtcnAtMS100gEA?oc=5&hl=en-ID&gl=ID&ceid=ID:en,"{'href': 'https://investor.id', 'title': 'Investor.ID'}",Missing,Missing
Bank Mandiri Sabet Gelar Indonesia's Best FX Bank 2023 - Investor.ID,Bank Mandiri Sabet Gelar Indonesia's Best FX Bank 2023  Investor.ID,2023-02-24,https://news.google.com/rss/articles/CBMiWGh0dHBzOi8vaW52ZXN0b3IuaWQvZmluYW5jZS8zMjI3OTIvYmFuay1tYW5kaXJpLXNhYmV0LWdlbGFyLWluZG9uZXNpYXMtYmVzdC1meC1iYW5rLTIwMjPSAQA?oc=5&hl=en-ID&gl=ID&ceid=ID:en,"{'href': 'https://investor.id', 'title': 'Investor.ID'}",Missing,Missing
Dana IPO Wulandari Bangun Laksana (BSBK) Ludes - Investor.ID,Dana IPO Wulandari Bangun Laksana (BSBK) Ludes  Investor.ID,2023-02-24,https://news.google.com/rss/articles/CBMiXGh0dHBzOi8vaW52ZXN0b3IuaWQvbWFya2V0LWFuZC1jb3Jwb3JhdGUvMzIyNzY4L2RhbmEtaXBvLXd1bGFuZGFyaS1iYW5ndW4tbGFrc2FuYS1ic2JrLWx1ZGVz0gEA?oc=5&hl=en-ID&gl=ID&ceid=ID:en,"{'href': 'https://investor.id', 'title': 'Investor.ID'}",Missing,Missing
Saham Empat Bank Besar Tumbang Gara-gara Ini - Investor.ID,Saham Empat Bank Besar Tumbang Gara-gara Ini  Investor.ID,2023-02-23,https://news.google.com/rss/articles/CBMiW2h0dHBzOi8vaW52ZXN0b3IuaWQvbWFya2V0LWFuZC1jb3Jwb3JhdGUvMzIyNjI1L3NhaGFtLWVtcGF0LWJhbmstYmVzYXItdHVtYmFuZy1nYXJhZ2FyYS1pbmnSAQA?oc=5&hl=en-ID&gl=ID&ceid=ID:en,"{'href': 'https://investor.id', 'title': 'Investor.ID'}",Missing,Missing
Lima Bank BUMN Terseret Restrukturisasi Waskita - Investor.ID,Lima Bank BUMN Terseret Restrukturisasi Waskita  Investor.ID,2023-02-23,https://news.google.com/rss/articles/CBMiX2h0dHBzOi8vaW52ZXN0b3IuaWQvbWFya2V0LWFuZC1jb3Jwb3JhdGUvMzIyNjI0L2xpbWEtYmFuay1idW1uLXRlcnNlcmV0LXJlc3RydWt0dXJpc2FzaS13YXNraXRh0gEA?oc=5&hl=en-ID&gl=ID&ceid=ID:en,"{'href': 'https://investor.id', 'title': 'Investor.ID'}",Missing,Missing
Laba Bersih Himbara Mencapai Rp 107 T - Investor.ID,Laba Bersih Himbara Mencapai Rp 107 T  Investor.ID,2023-02-21,https://news.google.com/rss/articles/CBMiSGh0dHBzOi8vaW52ZXN0b3IuaWQvZmluYW5jZS8zMjIzOTAvbGFiYS1iZXJzaWgtaGltYmFyYS1tZW5jYXBhaS1ycC0xMDctdNIBAA?oc=5&hl=en-ID&gl=ID&ceid=ID:en,"{'href': 'https://investor.id', 'title': 'Investor.ID'}",Missing,Missing
"Ini Gambaran Pasar Saham Sepekan ke Depan, Salam Cuan! - Investor.ID","Ini Gambaran Pasar Saham Sepekan ke Depan, Salam Cuan!  Investor.ID",2023-02-19,https://news.google.com/rss/articles/CBMiZGh0dHBzOi8vaW52ZXN0b3IuaWQvbWFya2V0LWFuZC1jb3Jwb3JhdGUvMzIyMjU2L2luaS1nYW1iYXJhbi1wYXNhci1zYWhhbS1zZXBla2FuLWtlLWRlcGFuLXNhbGFtLWN1YW7SAQA?oc=5&hl=en-ID&gl=ID&ceid=ID:en,"{'href': 'https://investor.id', 'title': 'Investor.ID'}",Missing,Missing
Bank Mandiri Torehkan Kinerja Apik di 2022 - Investor.ID,Bank Mandiri Torehkan Kinerja Apik di 2022  Investor.ID,2023-02-08,https://news.google.com/rss/articles/CBMiTWh0dHBzOi8vaW52ZXN0b3IuaWQvZmluYW5jZS8zMjExNTUvYmFuay1tYW5kaXJpLXRvcmVoa2FuLWtpbmVyamEtYXBpay1kaS0yMDIy0gEA?oc=5&hl=en-ID&gl=ID&ceid=ID:en,"{'href': 'https://investor.id', 'title': 'Investor.ID'}",Missing,Missing
"Buah Digitalisasi, Bank Mandiri Torehkan Kinerja Cemerlang di 2022 - Investor.ID","Buah Digitalisasi, Bank Mandiri Torehkan Kinerja Cemerlang di 2022  Investor.ID",2023-02-01,https://news.google.com/rss/articles/CBMiZGh0dHBzOi8vaW52ZXN0b3IuaWQvZmluYW5jZS8zMjA1MjcvYnVhaC1kaWdpdGFsaXNhc2ktYmFuay1tYW5kaXJpLXRvcmVoa2FuLWtpbmVyamEtY2VtZXJsYW5nLWRpLTIwMjLSAQA?oc=5&hl=en-ID&gl=ID&ceid=ID:en,"{'href': 'https://investor.id', 'title': 'Investor.ID'}",Missing,Missing
Total Aset Bank Mandiri (BMRI) Nyaris Tembus Rp 2.000 T - Investor.ID,Total Aset Bank Mandiri (BMRI) Nyaris Tembus Rp 2.000 T  Investor.ID,2023-01-31,https://news.google.com/rss/articles/CBMiV2h0dHBzOi8vaW52ZXN0b3IuaWQvZmluYW5jZS8zMjAzOTMvdG90YWwtYXNldC1iYW5rLW1hbmRpcmktYm1yaS1ueWFyaXMtdGVtYnVzLXJwLTIwMDAtdNIBAA?oc=5&hl=en-ID&gl=ID&ceid=ID:en,"{'href': 'https://investor.id', 'title': 'Investor.ID'}",Missing,Missing
Fakta Menarik soal Saham Bank Mandiri (BMRI) - Investor.ID,Fakta Menarik soal Saham Bank Mandiri (BMRI)  Investor.ID,2023-01-31,https://news.google.com/rss/articles/CBMiWmh0dHBzOi8vaW52ZXN0b3IuaWQvbWFya2V0LWFuZC1jb3Jwb3JhdGUvMzIwMzg0L2Zha3RhLW1lbmFyaWstc29hbC1zYWhhbS1iYW5rLW1hbmRpcmktYm1yadIBAA?oc=5&hl=en-ID&gl=ID&ceid=ID:en,"{'href': 'https://investor.id', 'title': 'Investor.ID'}",Missing,Missing
"AS Lolos Resesi, IHSG Bakal Tembus 7.000 Pekan Depan - Investor.ID","AS Lolos Resesi, IHSG Bakal Tembus 7.000 Pekan Depan  Investor.ID",2023-01-28,https://news.google.com/rss/articles/CBMiYmh0dHBzOi8vaW52ZXN0b3IuaWQvbWFya2V0LWFuZC1jb3Jwb3JhdGUvMzIwMTIxL2FzLWxvbG9zLXJlc2VzaS1paHNnLWJha2FsLXRlbWJ1cy03MDAwLXBla2FuLWRlcGFu0gEA?oc=5&hl=en-ID&gl=ID&ceid=ID:en,"{'href': 'https://investor.id', 'title': 'Investor.ID'}",Missing,Missing
"Target Harga Baru Saham BTN (BBTN) Tinggi, kok Bisa? - Investor.ID","Target Harga Baru Saham BTN (BBTN) Tinggi, kok Bisa?  Investor.ID",2023-01-26,https://news.google.com/rss/articles/CBMiYGh0dHBzOi8vaW52ZXN0b3IuaWQvbWFya2V0LWFuZC1jb3Jwb3JhdGUvMzE5OTM2L3RhcmdldC1oYXJnYS1iYXJ1LXNhaGFtLWJ0bi1iYnRuLXRpbmdnaS1rb2stYmlzYdIBAA?oc=5&hl=en-ID&gl=ID&ceid=ID:en,"{'href': 'https://investor.id', 'title': 'Investor.ID'}",Missing,Missing
Pendiri KoinWorks Caplok BPR - Investor.ID,Pendiri KoinWorks Caplok BPR  Investor.ID,2023-01-26,https://news.google.com/rss/articles/CBMiP2h0dHBzOi8vaW52ZXN0b3IuaWQvZmluYW5jZS8zMjAwMDAvcGVuZGlyaS1rb2lud29ya3MtY2FwbG9rLWJwctIBAA?oc=5&hl=en-ID&gl=ID&ceid=ID:en,"{'href': 'https://investor.id', 'title': 'Investor.ID'}",Missing,Missing
"Terapkan ESG, Bank Mandiri Kolaborasi dengan Juara Bike (Selis) - Investor.ID","Terapkan ESG, Bank Mandiri Kolaborasi dengan Juara Bike (Selis)  Investor.ID",2023-01-20,https://news.google.com/rss/articles/CBMiX2h0dHBzOi8vaW52ZXN0b3IuaWQvZmluYW5jZS8zMTk1ODgvdGVyYXBrYW4tZXNnLWJhbmstbWFuZGlyaS1rb2xhYm9yYXNpLWRlbmdhbi1qdWFyYS1iaWtlLXNlbGlz0gEA?oc=5&hl=en-ID&gl=ID&ceid=ID:en,"{'href': 'https://investor.id', 'title': 'Investor.ID'}",Missing,Missing
"BWS Hadirkan WON, Layanan Buka Rekening Full Digital - Investor.ID","BWS Hadirkan WON, Layanan Buka Rekening Full Digital  Investor.ID",2023-01-18,https://news.google.com/rss/articles/CBMiVmh0dHBzOi8vaW52ZXN0b3IuaWQvZmluYW5jZS8zMTkzODgvYndzLWhhZGlya2FuLXdvbi1sYXlhbmFuLWJ1a2EtcmVrZW5pbmctZnVsbC1kaWdpdGFs0gEA?oc=5&hl=en-ID&gl=ID&ceid=ID:en,"{'href': 'https://investor.id', 'title': 'Investor.ID'}",Missing,Missing
"Mengapa Asing Terus-menerus Jual Saham? Ini Pemicunya, plus Arah IHSG - Investor.ID","Mengapa Asing Terus-menerus Jual Saham? Ini Pemicunya, plus Arah IHSG  Investor.ID",2023-01-11,https://news.google.com/rss/articles/CBMicmh0dHBzOi8vaW52ZXN0b3IuaWQvbWFya2V0LWFuZC1jb3Jwb3JhdGUvMzE4ODQ2L21lbmdhcGEtYXNpbmctdGVydXNtZW5lcnVzLWp1YWwtc2FoYW0taW5pLXBlbWljdW55YS1wbHVzLWFyYWgtaWhzZ9IBAA?oc=5&hl=en-ID&gl=ID&ceid=ID:en,"{'href': 'https://investor.id', 'title': 'Investor.ID'}",Missing,Missing
"Saham Bank Melorot, Berikut Daftar Penurunan Terdalam - Investor.ID","Saham Bank Melorot, Berikut Daftar Penurunan Terdalam  Investor.ID",2023-01-10,https://news.google.com/rss/articles/CBMiZGh0dHBzOi8vaW52ZXN0b3IuaWQvbWFya2V0LWFuZC1jb3Jwb3JhdGUvMzE4NzE2L3NhaGFtLWJhbmstbWVsb3JvdC1iZXJpa3V0LWRhZnRhci1wZW51cnVuYW4tdGVyZGFsYW3SAQA?oc=5&hl=en-ID&gl=ID&ceid=ID:en,"{'href': 'https://investor.id', 'title': 'Investor.ID'}",Missing,Missing
Saham Batu Bara Jadi Pemberat IHSG - Investor.ID,Saham Batu Bara Jadi Pemberat IHSG  Investor.ID,2023-01-10,https://news.google.com/rss/articles/CBMiUmh0dHBzOi8vaW52ZXN0b3IuaWQvbWFya2V0LWFuZC1jb3Jwb3JhdGUvMzE4NjMyL3NhaGFtLWJhdHUtYmFyYS1qYWRpLXBlbWJlcmF0LWloc2fSAQA?oc=5&hl=en-ID&gl=ID&ceid=ID:en,"{'href': 'https://investor.id', 'title': 'Investor.ID'}",Missing,Missing
Prakiraan Cuaca Hari Ini: Semua Wilayah Jakarta Cerah Berawan - Investor.ID,Prakiraan Cuaca Hari Ini: Semua Wilayah Jakarta Cerah Berawan  Investor.ID,2023-01-07,https://news.google.com/rss/articles/CBMiYGh0dHBzOi8vaW52ZXN0b3IuaWQvbmF0aW9uYWwvMzE4NDYxL3ByYWtpcmFhbi1jdWFjYS1oYXJpLWluaS1zZW11YS13aWxheWFoLWpha2FydGEtY2VyYWgtYmVyYXdhbtIBAA?oc=5&hl=en-ID&gl=ID&ceid=ID:en,"{'href': 'https://investor.id', 'title': 'Investor.ID'}",Missing,Missing
Giliran Dirut Bank Mandiri (BMRI) Borong Saham Perusahaan - Investor.ID,Giliran Dirut Bank Mandiri (BMRI) Borong Saham Perusahaan  Investor.ID,2023-01-04,https://news.google.com/rss/articles/CBMiZ2h0dHBzOi8vaW52ZXN0b3IuaWQvbWFya2V0LWFuZC1jb3Jwb3JhdGUvMzE4MTgzL2dpbGlyYW4tZGlydXQtYmFuay1tYW5kaXJpLWJtcmktYm9yb25nLXNhaGFtLXBlcnVzYWhhYW7SAQA?oc=5&hl=en-ID&gl=ID&ceid=ID:en,"{'href': 'https://investor.id', 'title': 'Investor.ID'}",Missing,Missing
"IHSG Tahun 2022 Naik 4,09%, Berikut Daftar Top 10 Market Cap BEI - Investor.ID","IHSG Tahun 2022 Naik 4,09%, Berikut Daftar Top 10 Market Cap BEI  Investor.ID",2023-01-02,https://news.google.com/rss/articles/CBMibWh0dHBzOi8vaW52ZXN0b3IuaWQvbWFya2V0LWFuZC1jb3Jwb3JhdGUvMzE4MDAyL2loc2ctdGFodW4tMjAyMi1uYWlrLTQwOS1iZXJpa3V0LWRhZnRhci10b3AtMTAtbWFya2V0LWNhcC1iZWnSAQA?oc=5&hl=en-ID&gl=ID&ceid=ID:en,"{'href': 'https://investor.id', 'title': 'Investor.ID'}",Missing,Missing
"Adaro Minerals (ADMR) Tak Terkalahkan, Bumi Resources (BUMI) Masuk Top 10 - Investor.ID","Adaro Minerals (ADMR) Tak Terkalahkan, Bumi Resources (BUMI) Masuk Top 10  Investor.ID",2022-12-31,https://news.google.com/rss/articles/CBMidGh0dHBzOi8vaW52ZXN0b3IuaWQvbWFya2V0LWFuZC1jb3Jwb3JhdGUvMzE3OTU1L2FkYXJvLW1pbmVyYWxzLWFkbXItdGFrLXRlcmthbGFoa2FuLWJ1bWktcmVzb3VyY2VzLWJ1bWktbWFzdWstdG9wLTEw0gEA?oc=5&hl=en-ID&gl=ID&ceid=ID:en,"{'href': 'https://investor.id', 'title': 'Investor.ID'}",Missing,Missing
"Duit Asing di Saham RI Masih Segunung, Cek di Sini - Investor.ID","Duit Asing di Saham RI Masih Segunung, Cek di Sini  Investor.ID",2022-12-30,https://news.google.com/rss/articles/CBMiYWh0dHBzOi8vaW52ZXN0b3IuaWQvbWFya2V0LWFuZC1jb3Jwb3JhdGUvMzE3ODg4L2R1aXQtYXNpbmctZGktc2FoYW0tcmktbWFzaWgtc2VndW51bmctY2VrLWRpLXNpbmnSAQA?oc=5&hl=en-ID&gl=ID&ceid=ID:en,"{'href': 'https://investor.id', 'title': 'Investor.ID'}",Missing,Missing
Alasan Saham Bayan Lebih Ngacir ketimbang Para Pesaing - Investor.ID,Alasan Saham Bayan Lebih Ngacir ketimbang Para Pesaing  Investor.ID,2022-12-28,https://news.google.com/rss/articles/CBMiZmh0dHBzOi8vaW52ZXN0b3IuaWQvbWFya2V0LWFuZC1jb3Jwb3JhdGUvMzE3NTg2L2FsYXNhbi1zYWhhbS1iYXlhbi1sZWJpaC1uZ2FjaXIta2V0aW1iYW5nLXBhcmEtcGVzYWluZ9IBAA?oc=5&hl=en-ID&gl=ID&ceid=ID:en,"{'href': 'https://investor.id', 'title': 'Investor.ID'}",Missing,Missing
"Menggebrak, 10 Saham Unggulan Kasih Untung Besar pada 2022 - Investor.ID","Menggebrak, 10 Saham Unggulan Kasih Untung Besar pada 2022  Investor.ID",2022-12-28,https://news.google.com/rss/articles/CBMiaWh0dHBzOi8vaW52ZXN0b3IuaWQvbWFya2V0LWFuZC1jb3Jwb3JhdGUvMzE3NjgzL21lbmdnZWJyYWstMTAtc2FoYW0tdW5nZ3VsYW4ta2FzaWgtdW50dW5nLWJlc2FyLXBhZGEtMjAyMtIBAA?oc=5&hl=en-ID&gl=ID&ceid=ID:en,"{'href': 'https://investor.id', 'title': 'Investor.ID'}",Missing,Missing
"Jumlah Investor Saham Melonjak, Stockbit Perkuat Fitur Aplikasi - Investor.ID","Jumlah Investor Saham Melonjak, Stockbit Perkuat Fitur Aplikasi  Investor.ID",2022-12-26,https://news.google.com/rss/articles/CBMibmh0dHBzOi8vaW52ZXN0b3IuaWQvbWFya2V0LWFuZC1jb3Jwb3JhdGUvMzE3NDY2L2p1bWxhaC1pbnZlc3Rvci1zYWhhbS1tZWxvbmphay1zdG9ja2JpdC1wZXJrdWF0LWZpdHVyLWFwbGlrYXNp0gEA?oc=5&hl=en-ID&gl=ID&ceid=ID:en,"{'href': 'https://investor.id', 'title': 'Investor.ID'}",Missing,Missing
Bayan (BYAN) Milik Low Tuck Kwong Menggedor Dominasi Bank Papan Atas - Investor.ID,Bayan (BYAN) Milik Low Tuck Kwong Menggedor Dominasi Bank Papan Atas  Investor.ID,2022-12-25,https://news.google.com/rss/articles/CBMicmh0dHBzOi8vaW52ZXN0b3IuaWQvbWFya2V0LWFuZC1jb3Jwb3JhdGUvMzE3NDAwL2JheWFuLWJ5YW4tbWlsaWstbG93LXR1Y2sta3dvbmctbWVuZ2dlZG9yLWRvbWluYXNpLWJhbmstcGFwYW4tYXRhc9IBAA?oc=5&hl=en-ID&gl=ID&ceid=ID:en,"{'href': 'https://investor.id', 'title': 'Investor.ID'}",Missing,Missing
"Low Tuck Kwong Jadi Orang Terkaya No 1, Geser Duo Hartono! - Investor.ID","Low Tuck Kwong Jadi Orang Terkaya No 1, Geser Duo Hartono!  Investor.ID",2022-12-24,https://news.google.com/rss/articles/CBMiaGh0dHBzOi8vaW52ZXN0b3IuaWQvbWFya2V0LWFuZC1jb3Jwb3JhdGUvMzE3Mzc2L2xvdy10dWNrLWt3b25nLWphZGktb3JhbmctdGVya2F5YS1uby0xLWdlc2VyLWR1by1oYXJ0b25v0gEA?oc=5&hl=en-ID&gl=ID&ceid=ID:en,"{'href': 'https://investor.id', 'title': 'Investor.ID'}",Missing,Missing
"Rights Issue BTN (BBTN), Analis Sebut Kesempatan Langka Dapat Harga Saham Murah - Investor.ID","Rights Issue BTN (BBTN), Analis Sebut Kesempatan Langka Dapat Harga Saham Murah  Investor.ID",2022-12-21,https://news.google.com/rss/articles/CBMifGh0dHBzOi8vaW52ZXN0b3IuaWQvbWFya2V0LWFuZC1jb3Jwb3JhdGUvMzE2OTUzL3JpZ2h0cy1pc3N1ZS1idG4tYmJ0bi1hbmFsaXMtc2VidXQta2VzZW1wYXRhbi1sYW5na2EtZGFwYXQtaGFyZ2Etc2FoYW0tbXVyYWjSAQA?oc=5&hl=en-ID&gl=ID&ceid=ID:en,"{'href': 'https://investor.id', 'title': 'Investor.ID'}",Missing,Missing
"Permintaan Tumbuh, Prospek Saham Menara Telekomunikasi TBIG, TOWR, dan MTEL Menggiurkan - Investor.ID","Permintaan Tumbuh, Prospek Saham Menara Telekomunikasi TBIG, TOWR, dan MTEL Menggiurkan  Investor.ID",2022-12-16,https://news.google.com/rss/articles/CBMihAFodHRwczovL2ludmVzdG9yLmlkL21hcmtldC1hbmQtY29ycG9yYXRlLzMxNjU0NC9wZXJtaW50YWFuLXR1bWJ1aC1wcm9zcGVrLXNhaGFtLW1lbmFyYS10ZWxla29tdW5pa2FzaS10YmlnLXRvd3ItZGFuLW10ZWwtbWVuZ2dpdXJrYW7SAQA?oc=5&hl=en-ID&gl=ID&ceid=ID:en,"{'href': 'https://investor.id', 'title': 'Investor.ID'}",Missing,Missing
Bos-bos Bank Mandiri (BMRI) Terus Borong Saham Perseroan - Investor.ID,Bos-bos Bank Mandiri (BMRI) Terus Borong Saham Perseroan  Investor.ID,2022-12-13,https://news.google.com/rss/articles/CBMiZWh0dHBzOi8vaW52ZXN0b3IuaWQvbWFya2V0LWFuZC1jb3Jwb3JhdGUvMzE2MTQ2L2Jvc2Jvcy1iYW5rLW1hbmRpcmktYm1yaS10ZXJ1cy1ib3Jvbmctc2FoYW0tcGVyc2Vyb2Fu0gEA?oc=5&hl=en-ID&gl=ID&ceid=ID:en,"{'href': 'https://investor.id', 'title': 'Investor.ID'}",Missing,Missing
"Bayan (BYAN) Naik ke Peringkat 3, Bank Mandiri (BMRI) Disalip! - Investor.ID","Bayan (BYAN) Naik ke Peringkat 3, Bank Mandiri (BMRI) Disalip!  Investor.ID",2022-12-07,https://news.google.com/rss/articles/CBMiaGh0dHBzOi8vaW52ZXN0b3IuaWQvbWFya2V0LWFuZC1jb3Jwb3JhdGUvMzE1NTk4L2JheWFuLWJ5YW4tbmFpay1rZS1wZXJpbmdrYXQtMy1iYW5rLW1hbmRpcmktYm1yaS1kaXNhbGlw0gEA?oc=5&hl=en-ID&gl=ID&ceid=ID:en,"{'href': 'https://investor.id', 'title': 'Investor.ID'}",Missing,Missing
