,published_date,title,publisher,kode_emitten
563,2021-12-15,"3 Cara top up M-Tix via BCA terbaru, anti kehabisan tiket bioskop XXI",Kontan,BBCA
564,2021-12-15,"Prestasi Jahja Setiaatmadja, Sukses Pimpin Transformasi BCA",CNBC Indonesia,BBCA
565,2021-12-15,"Hartono Bersaudara Kokoh Pimpin Daftar Orang Terkaya RI, Saham BBCA Jadi Pendorong",Bisnis,BBCA
566,2021-12-16,Praktis! Tarik Tunai Saldo OVO Kini Bisa Lewat ATM BCA,Bisnis,BBCA
567,2021-12-16,Komisaris BCA Raden Pardede Undur Diri dari Adaro,Bisnis,BBCA
568,2021-12-16,"Halo Nasabah, BCA Siapkan Rp 33,2 T Uang Tunai Selama Nataru",CNBC Indonesia,BBCA
569,2021-12-17,"Bank BCA Buka Lowongan Kerja Buat Fresh Graduate di Banyak Posisi, Ini Infonya",Kontan,BBCA
570,2021-12-17,"Cara Bayar Listrik Lewat m-Banking BCA, Praktis!",Bisnis,BBCA
571,2021-12-18,"Bisa Bayar Pajak Kapan Saja Lewat KlikBCA, Simak Langkah-langkahnya Ini",Kontan,BBCA
572,2021-12-22,"BCA Tuntaskan Infrastruktur BI-Fast, Implementasi Secara Bertahap",Bisnis,BBCA
573,2021-12-22,"Cek Dulu, Yuk! Daftar Bunga Deposito Terbaru BCA, BNI, BRI, dan Bank Mandiri",Bisnis,BBCA
574,2021-12-22,Bank BCA (BBCA) Intip Peluang Penyaluran Kredit Sektor Berkelanjutan,Kontan,BBCA
575,2021-12-22,"Cara Buka Rekening Online BCA, BNI, BRI, dan Bank Mandiri",Bisnis,BBCA
576,2021-12-23,BCA (BBCA) Siap Layani Local Currency Settlement Indonesia-Tiongkok,Bisnis,BBCA
577,2021-12-24,Gimana Cara Transfer Antarbank dengan Biaya Rp 2.500 di BCA?,CNBC Indonesia,BBCA
578,2021-12-24,Resmi! BCA (BBCA) Terapkan BI-Fast di Situs Web myBCA,Bisnis,BBCA
579,2021-12-27,Cara Buka Rekening BCA Offline Beserta Syaratnya,Kontan,BBCA
580,2021-12-28,"Topang Transaksi Digital, BCA Bangun 3 Data Center Sekaligus",CNBC Indonesia,BBCA
581,2022-01-05,BCA Digital Akan Luncurkan Fitur Kredit di Aplikasi Blu Akhir Tahun Ini,Kontan,BBCA
582,2022-01-09,Bank Mandiri dan BCA Sebut Pembiayaan Berkelanjutan Punya Prospek Cerah,Bisnis,BBCA
583,2022-01-11,BCA (BBCA) Bakal Rilis Lapkeu 2021 pada 27 Januari Mendatang,Bisnis,BBCA
584,2022-01-11,"Cara Mengambil Uang di ATM BRI, Mandiri, BCA, dan BNI yang Aman serta Praktis",Kontan,BBCA
585,2022-01-13,Transaksi Pembayaran EDC BCA Tembus 1 Miliar Kali Hingga November 2021,Kontan,BBCA
586,2022-01-16,Strategi Bank Mandiri (BMRI) dan BCA (BBCA) Bidik Peningkatan Transaksi Digital,Bisnis,BBCA
587,2022-01-17,"Market Cap BCA Rekor Lagi, Tapi Emtek Malah Ambles",CNBC Indonesia,BBCA
588,2022-01-22,Cara Daftar Internet Banking BCA-KlikBCA dan Aktivasinya Secara Mudah,Kontan,BBCA
589,2022-01-23,"Cara Cek Nomor Rekening BCA, Mandiri, BNI, dan BRI lewat HP",Bisnis,BBCA
590,2022-01-24,"BCA (BBCA) Tetapkan Bunga Deposito Terbaru, Turun ke Level 1 Persenan",Bisnis,BBCA
591,2022-01-26,Mudah! Ini Cara Daftar dan Aktivasi KlikBCA,Bisnis,BBCA
592,2022-01-27,"Kredit BCA Tumbuh 8,2% YoY Pada 2021",CNBC Indonesia,BBCA
593,2022-01-27,"Laba Bersih BCA Naik 15,8% Jadi Rp 31,4 T Pada 2021",CNBC Indonesia,BBCA
594,2022-01-27,"BCA (BBCA) Cetak Laba Rp31,4 Triliun Sepanjang 2021, Tumbuh 15,8 Persen",Bisnis,BBCA
595,2022-01-27,"Kinerja 2021 Lampaui Target, Bos BCA (BBCA) Blak-blakan Strategi",Bisnis,BBCA
596,2022-01-27,BCA (BBCA) Suntik Dana Rp 400 M ke Bisnis Modal Ventura,CNBC Indonesia,BBCA
597,2022-01-28,BCA (BBCA) Siapkan Dana Rp400 Miliar untuk Venture Capital,Bisnis,BBCA
598,2022-01-28,Bos BCA Yakin Kredit Konsumer Bakal Berkembang Tahun Ini,Bisnis,BBCA
599,2022-01-28,"Daftar Call Center BCA, BNI, BRI, BSI, dan Mandiri",Bisnis,BBCA
600,2022-01-31,Bank BCA Suntik Dana Rp 400 Miliar ke Anak Usaha Modal Ventura,Kontan,BBCA
601,2022-02-01,"Nasabah BCA, Ini Cara Mudah Bagikan Angpao Imlek 2022",Bisnis,BBCA
602,2022-02-02,BCA (BBCA) Bakal Gelar RUPS Tahunan. Cek Jadwalnya,Bisnis,BBCA
603,2022-02-03,"Adu Kinerja BRI (BBRI), BCA (BBCA), BNI (BBNI), dan Mandiri (BMRI), Siapa Juara?",Bisnis,BBCA
604,2022-02-03,"Lampaui BCA, BRI (BBRI) Raup Laba Bersih Rp32,21 Triliun Sepanjang 2021",Bisnis,BBCA
605,2022-02-03,Simak! Cara Daftar dan Aktivasi KlikBCA-Internet Banking BCA,CNBC Indonesia,BBCA
606,2022-02-05,"Ini Syarat Pengajuan Kartu Kredit BCA, BRI, Bank Mandiri, dan BNI",Bisnis,BBCA
607,2022-02-06,"Bank BCA (BBCA) Perkirakan Inflasi 2022 Mencapai 3,3 Persen",Bisnis,BBCA
608,2022-02-07,"Ini Bunga Deposito 10 Bank Besar. Bank Mandiri, BRI, BCA, BNI dan BTN Bersaing, BTPN Lebih Tinggi",Bisnis,BBCA
609,2022-02-08,BCA Bidik Transaksi Pembayaran Kartu Kredit bagi Pelanggan XL Axiata,Kontan,BBCA
610,2022-02-09,Simak Tips Memilih Investasi ala Bos BCA (BBCA) Jahja Setiaatmadja,Bisnis,BBCA
611,2022-02-09,"Laba Bersih BCA (BBCA) Rp31,4 Triliun, Lo Kheng Hong: Luar Biasa!",Bisnis,BBCA
612,2022-02-09,"Ini 3 Cara Membuka Blokir ATM BCA Tanpa ke Bank, Bisa Lewat WhatsApp",Kontan,BBCA
613,2022-02-09,"Gokil! Keluarga Hartono Bisa Raup Rp 8,6 T Dari BCA",CNBC Indonesia,BBCA
614,2022-02-09,Raja Rokok RI: Hartono Bersaudara Kini Kaya Raya dari BCA!,CNBC Indonesia,BBCA
615,2022-02-10,Raja Bank di RI: Ada Tangan Dingin Liem Sioe Liong di BCA,CNBC Indonesia,BBCA
616,2022-02-12,"HUT ke-65, BCA Berikan Promo Bunga KPR Hanya 2,65 Persen",Bisnis,BBCA
617,2022-02-14,"Intip Bunga Deposito di BCA, BRI, BNI, dan Bank Mandiri",Bisnis,BBCA
618,2022-02-15,"BCA (BBCA) Buka Lowongan Kerja Tahun 2022, Catat Kebutuhannya",Bisnis,BBCA
619,2022-02-15,"ATM Diperkirakan Bakal Punah, BCA (BBCA): Kartu Debit Masih Jadi Andalan Nasabah",Bisnis,BBCA
620,2022-02-16,"Syarat Pengajuan Kartu Kredit BRI, BCA, BNI, Mandiri, dan CIMB Niaga",Bisnis,BBCA
621,2022-02-16,"RI Tak Bergantung Dolar AS, Bos BCA & Mandiri Beri Buktinya!",CNBC Indonesia,BBCA
622,2022-02-17,"Mau RUPST, BCA Bongkar Pasang Susunan Direksi",CNBC Indonesia,BBCA
623,2022-02-17,"BCA (BBCA) Usul Hendra Lembong jadi Wakil Presdir di RUPST, Ini Profilnya",Bisnis,BBCA
624,2022-02-17,"Profil Antonius Widodo, Petinggi BCA Life yang Diusulkan Jadi Direktur BCA (BBCA)",Bisnis,BBCA
625,2022-02-17,"Kurs Jual Beli Dolar AS di BCA dan BRI, Kamis 17 Februari 2022",Bisnis,BBCA
626,2022-02-17,BCA (BBCA) Gelar RUPS Tahunan 17 Maret. Bahas Dividen hingga Perubahan Pengurus,Bisnis,BBCA
627,2022-02-18,"BCA (BBCA) Bakal Ganti Direktur Kepatuhan, Ini Profilnya",Bisnis,BBCA
628,2022-02-18,Intip Rekam Jejak Calon Wakil Presdir BCA (BBCA) Hendra Lembong,Bisnis,BBCA
629,2022-02-18,"Rasio Dividen Terus Naik, Bagaimana Dividen BCA (BBCA) di Tahun Ini?",Bisnis,BBCA
630,2022-02-20,Transaksi Trade Finance Bank BCA Tumbuh Positif,Kontan,BBCA
631,2022-02-20,"Adu Dana Pihak Ketiga di Bank Jumbo, BBCA, BMRI, BBNI, BBRI. Siapa Terbesar?",Bisnis,BBCA
632,2022-02-21,"Hanya Sampai Besok, BCA Tebar Diskon hingga 65 Persen. Simak Rinciannya",Bisnis,BBCA
633,2022-02-21,"Promo HUT BCA, Ini Daftar Lengkap Produk Diskon hingga 65 Persen",Bisnis,BBCA
634,2022-02-22,BCA (BBCA) Olah Limbah Kartu jadi Paving Block,Bisnis,BBCA
635,2022-02-22,"Hari Terakhir! Daftar Lengkap Promo HUT BCA, Diskon 65 Persen!",Bisnis,BBCA
636,2022-02-22,"HUT BCA Ke-65, Ini Pesan Bos BCA (BBCA)",Bisnis,BBCA
637,2022-02-23,Mudah! Ini 3 Cara Aktivasi PIN Kartu Kredit BCA,Bisnis,BBCA
638,2022-02-23,3 Cara Aktivasi PIN Kartu Kredit BCA via ATM dan Online,Bisnis,BBCA
639,2022-02-23,"Limbah Kartu, BCA (BBCA): Cardless Society itu Mimpi Kita",Bisnis,BBCA
640,2022-02-26,"Suku Bunga KPR BTN, BRI, Bank Mandiri, BCA dan BJB. Ini yang Paling Murah",Bisnis,BBCA
641,2022-03-01,Limit Transaksi QRIS via BCA Mobile dan Sakuku Jadi Rp10 Juta,Bisnis,BBCA
642,2022-03-01,"BCA Expoversary Online 2022 Gulirkan Promo Margin Spesial 2,65 Persen",Bisnis,BBCA
643,2022-03-02,M-Banking BCA Eror? Lapor ke Sini,Bisnis,BBCA
644,2022-03-02,"Gara-gara Eror, M-Banking BCA dan Livin' by Mandiri Jadi Guyonan Warganet",Bisnis,BBCA
645,2022-03-02,Akhirnya Layanan M-Banking BCA Sudah Kembali Normal,Bisnis,BBCA
646,2022-03-02,"Layanan BCA Mobile Mengalami Kendala, Manajemen Sampaikan Permohonan Maaf ke Nasabah",Kontan,BBCA
647,2022-03-03,"Layanan Sudah Kembali Normal, Intip Sederet Kelebihan M-Banking BCA",Bisnis,BBCA
648,2022-03-03,"Sempat Error, Hari Ini M-Banking BCA (BBCA) Kembali Normal",Bisnis,BBCA
649,2022-03-03,"2 Cara Cetak Rekening Koran BCA, Bisa via Online",Bisnis,BBCA
650,2022-03-03,"Cara Blokir Kartu ATM BCA, BNI, BRI, Mandiri secara Online",Bisnis,BBCA
651,2022-03-04,"Selain Mobil Penumpang, Leasing Milik BCA (BBCA) Incar Potensi Segmen Komersial",Bisnis,BBCA
652,2022-03-04,"Livin’ by Mandiri dan M-Banking BCA Sempat Eror, Ada Apa?",Bisnis,BBCA
653,2022-03-04,Bos BCA (BBCA) Angkat Bicara soal M-Banking BCA yang Sempat Eror,Bisnis,BBCA
654,2022-03-08,"Nilai Transaksi Nasabah di Mesin EDC Bank BCA Capai Rp 30,7 Triliun per Januari 2022",Kontan,BBCA
655,2022-03-08,"Target Penyaluran Kredit 8%, Bos BCA Ungkap Sektor Potensial",CNBC Indonesia,BBCA
656,2022-03-09,"BCA (BBCA) Berikan Pinjaman Kredit Rp139,1 Miliar ke Wahana Interfood Nusantara (COCO)",Bisnis,BBCA
657,2022-03-10,"Promo Dunkin Donuts (10/3), Ada Gratis Donuts dan Minuman via Kartu BCA dan Flazz",Kontan,BBCA
658,2022-03-10,"Gelar BCA Expoversary 2022 di ICE BSD, BCA Obral Bunga Murah",Bisnis,BBCA
659,2022-03-10,"Baru 2 Minggu, Pengajuan Kredit BCA Expoversary Rp 7,9 T",CNBC Indonesia,BBCA
660,2022-03-10,"BCA Sediakan 39 Merek Kendaraan buat KKB, Tinggal Pilih!",CNBC Indonesia,BBCA
661,2022-03-10,"BCA Expoversary 2022 Offline Digelar Terbatas, Berikut Cara untuk Berkunjung",Bisnis,BBCA
662,2022-03-10,"Digelar Hybrid, BCA Expoversary Tawarkan Bunga KPR dan KKB 2,65 Persen",Bisnis,BBCA
663,2022-03-10,"39 Merek Kendaraan Mejeng di BCA Expoversary Offline, dari Mercy hingga Benelli",Bisnis,BBCA
664,2022-03-11,"Siap-Siap, Mobile Banking BCA Diperkuat dengan Layanan MyBCA",Bisnis,BBCA
665,2022-03-11,"Masuk ke Gaya Hidup Nasabah, BCA Bakal Melengkapi Layanan Mobile Banking ke MyBCA",Kontan,BBCA
666,2022-03-11,Inisiatif “Hijau” BCA Mendukung Langkah SDGs Pemerintah,Bisnis,BBCA
667,2022-03-11,BCA Terus Kembangkan Layanan Solusi Digital Perbankan,Bisnis,BBCA
668,2022-03-12,BCA Sebut Fitur M-Banking dan MyBCA Saling Melengkapi,Bisnis,BBCA
669,2022-03-12,Cara Daftar myBCA dari Bank BCA,Bisnis,BBCA
670,2022-03-13,"Cek! Ini Biaya Administrasi BCA, BNI, Bank Mandiri, BRI, dan BSI",Bisnis,BBCA
671,2022-03-13,Besaran Bonus dan Tantiem Pejabat Bank BUMN dan BCA Tahun 2021,Kontan,BBCA
672,2022-03-13,"Duet BCA Mobile & MyBCA, Andalan Transaksi Digital Nasabah",CNBC Indonesia,BBCA
673,2022-03-14,BCA (BBCA) Catat Transaksi Mobile Banking Tumbuh 60 Persen di 2021,Bisnis,BBCA
674,2022-03-14,Survei Bain & Company: Jumlah Nasabah Setia BCA (BBCA) Paling Tinggi,Bisnis,BBCA
675,2022-03-14,"BCA Syariah Catat Aset Tumbuh 9,5 Persen jadi Rp10,6 Triliun di 2021",Bisnis,BBCA
676,2022-03-14,BCA Syariah Catat Pengguna Mobile Banking Tumbuh 63 Persen di 2021,Bisnis,BBCA
677,2022-03-15,"Kado HUT ke-65, Market Cap BCA (BBCA) Tembus Rp1.000 Triliun",Bisnis,BBCA
678,2022-03-15,Siap-siap! Aplikasi Halo BCA Bakal Jadi Superapps,Bisnis,BBCA
679,2022-03-16,Kenali Perbedaan antara BCA Mobile dan myBCA,Bisnis,BBCA
680,2022-03-16,"Wow! Saham BBCA Rekor Tertinggi, Market Cap Tembus Rp 1.004 T",CNBC Indonesia,BBCA
681,2022-03-17,"BCA (BBCA) Punya Wakil Presiden Direktur Baru, Berikut Profilnya",Bisnis,BBCA
682,2022-03-17,Transaksi Mobile Banking BCA Naik 60 Persen Yoy Sepanjang 2021,Bisnis,BBCA
683,2022-03-17,"BCA Bagikan Dividen Rp 145/saham atau 56,9% dari Laba 2021",CNBC Indonesia,BBCA
684,2022-03-17,"Sah! BCA (BBCA) Tetapkan Dividen Tunai Rp145 per Saham, Total Rp17,9 Triliun",Bisnis,BBCA
685,2022-03-17,"BCA Tunjuk 1 Wapresdir dan 1 Direktur Baru, Siapa Saja?",CNBC Indonesia,BBCA
686,2022-03-17,Rasio Pembayaran Dividen Bank BCA (BBCA) Meningkat,Kontan,BBCA
687,2022-03-20,"Cukup Lewat HP, Ini 3 Cara Cek Tagihan Kartu Kredit BCA",Bisnis,BBCA
688,2022-03-20,"BMRI, BBRI, BBCA, BBNI Tebar Dividen Jumbo. Siapa Terbesar?",Bisnis,BBCA
689,2022-03-21,"BCA (BBCA) Tebar Dividen Rp17,9 Triliun, Catat Jadwalnya!",Bisnis,BBCA
690,2022-03-21,"BBNI, BBCA, BJTM Masuki Periode Cum Dividen Pekan Ini. Simak Jadwalnya",Bisnis,BBCA
691,2022-03-22,Bos BCA & BNI Beberkan Sederet Tantangan Perbankan RI di 2022,CNBC Indonesia,BBCA
692,2022-03-23,Bos BCA (BBCA): Risiko Kenaikan Suku Bunga Akan Bebani Pelaku Usaha,Bisnis,BBCA
693,2022-03-23,Historia Bisnis : Pemerintah Tawarkan Saham Bank BCA (BBCA) Kepada Publik,Bisnis,BBCA
694,2022-03-23,Simak! Syarat dan Keuntungan Jadi Nasabah BCA Prioritas,Bisnis,BBCA
695,2022-03-23,"Bos BCA (BBCA) Borong Saham Senilai Rp5,10 Miliar",Bisnis,BBCA
696,2022-03-23,Jahja Setiaatmadja Borong Saham BCA Jelang Bagi Dividen,CNBC Indonesia,BBCA
697,2022-03-23,3 Cara Bayar Tagihan Listrik lewat BCA ATM hingga KlikBCA,Kontan,BBCA
698,2022-03-24,Cek Harga Saham BBRI & BBCA yang Kompak Menguat di Perdagangan Bursa Kamis (24/3),Kontan,BBCA
699,2022-03-24,"Bos BCA Jahja Setiaatmadja Raup Bonus Saham Senilai Rp 5,1 M, Dividen Tunai Rp 4,9 M",Kontan,BBCA
700,2022-03-24,"Jangan Lupa, Besok Cum Dividen BCA (BBCA) dan Bank Jatim (BJTM)",Bisnis,BBCA
701,2022-03-24,Cara Beli Tiket Konser Justin Bieber di Jakarta dari BCA,Bisnis,BBCA
702,2022-03-25,Intip Nih Besarnya Penerimaan Dividen Bos BCA,CNBC Indonesia,BBCA
703,2022-03-28,"Duh! Uang Nasabah Hilang Rp135 Juta, BCA Duga Terkena Skimming",Bisnis,BBCA
704,2022-03-28,Uang Nasabah BCA Hilang Rp135 Juta. Ini Modus dan Cara Menghindari Skimming ATM,Bisnis,BBCA
705,2022-03-28,"Duit Nasabah Dibobol Rp135 Juta, BCA Siap Ganti 100 Persen",Bisnis,BBCA
706,2022-03-28,Begini Cara Daftar dan Aktivasi Internet Banking BCA,Bisnis,BBCA
707,2022-03-28,"BCA Ganti 100% Dana Nasabah yang Dicuri Maling, Asal...",CNBC Indonesia,BBCA
708,2022-03-29,Bos BCA (BBCA) Bagikan Cara Menjaga Keamanan Data ATM Nasabah,Bisnis,BBCA
709,2022-03-29,"BCA (BBCA) Guyur Kredit Rp2,7 Triliun ke Anak Usaha Indonet (EDGE)",Bisnis,BBCA
710,2022-03-30,"Gangguan Mobile Banking Mandiri (BMRI) dan BCA (BBCA), Bukti Layanan Digital Bank Punya PR Segudang",Bisnis,BBCA
711,2022-04-01,"Anak Usaha TPMA, Trans Logistik, Raih Kredit dari BCA Setara Rp731 Miliar",Bisnis,BBCA
712,2022-04-04,"Sejumlah Layanan BCA (BBCA) Kena PPN 11 Persen, Ini Daftarnya",Bisnis,BBCA
713,2022-04-04,Ini Dia Layanan BCA yang Terdampak Kenaikan PPN Jadi 11%,CNBC Indonesia,BBCA
714,2022-04-05,Panca Budi Idaman (PBID) dan BCA akan Salurkan KUR Rp20 Miliar,Bisnis,BBCA
715,2022-04-05,"BCA Perpanjang Promo Bunga KPR 2,65 Persen hingga 30 April 2022",Bisnis,BBCA
716,2022-04-05,"BCA (BBCA) Siapkan Uang Tunai Rp58,12 Triliun selama Ramadan dan Lebaran 2022",Bisnis,BBCA
717,2022-04-06,"Kurs Jual Beli Dolar AS di BCA (BBCA), BRI (BBRI), BNI (BBNI), dan Mandiri (BMRI) Hari Ini Rabu 6 April 2022",Bisnis,BBCA
718,2022-04-07,"OJK Punya Pimpinan Baru, Ini Harapan Bos BCA (BBCA) dan Ekonom",Bisnis,BBCA
719,2022-04-08,Cara Menukarkan Uang Baru Lewat BCA dan BRI,Bisnis,BBCA
720,2022-04-11,"Ada Promo Makan Hokben, Burger King, hingga Bebek Kaleyo dari BCA (BBCA) dan Mandiri (BMRI)",Bisnis,BBCA
721,2022-04-12,"Pencairan Insentif Kartu Prakerja Kini Bisa di BCA (BBCA), Berikut Caranya",Bisnis,BBCA
722,2022-04-12,Nasabah BCA dengan Simpanan Rp 5 Miliar Naik 15% pada Maret 2022,Kontan,BBCA
723,2022-04-12,"Paytren Butuh Rp 200 T per Bulan, 5 Bulan Bisa Akuisisi BCA!",CNBC Indonesia,BBCA
724,2022-04-13,"Kurs Jual Beli Dolar AS di BCA dan BRI, Rabu 13 April 2022",Bisnis,BBCA
725,2022-04-13,"BCA Insurance Dongkrak Laba ke Rp134,72 Miliar, Hasil Underwriting Moncer",Bisnis,BBCA
726,2022-04-15,"Per Maret 2022, Nasabah BCA dengan Simpanan Rp5 Miliar Naik 15 Persen",Bisnis,BBCA
727,2022-04-15,"Daftar 20 Bank Terbaik di Indonesia 2022 Versi Forbes, Ada BCA (BBCA) hingga Bank Jago (ARTO)",Bisnis,BBCA
728,2022-04-16,Begini Cara Mudah Top Up dan Cek Saldo Flazz BCA,Bisnis,BBCA
729,2022-04-17,"Jadi Bank Terbaik Dunia Versi Forbes, Bos BCA (BBCA) Bicara Ekspansi",Bisnis,BBCA
730,2022-04-18,"Valuasi Terlalu Mahal, Simak Rekomendasi Saham BBCA",Kontan,BBCA
731,2022-04-18,Mau Jadi Nasabah Prioritas BCA (BBCA)? Berikut Syarat dan Keuntungannya,Bisnis,BBCA
732,2022-04-20,Daftar Lengkap Lokasi Penukaran Uang Lebaran BCA (BBCA) di Jabodetabek,Bisnis,BBCA
733,2022-04-21,"Kuartal I-2022, Kredit BCA Tumbuh 8,6% Jadi Rp 637,1 T",CNBC Indonesia,BBCA
734,2022-04-21,"Di Tengah Ancaman Dampak Perang Rusia-Ukraina, Ini Kata Bos BCA (BBCA)",Bisnis,BBCA
735,2022-04-21,"BCA Cetak Laba Rp 8,1 T di Kuartal I-2022, Tumbuh 14,6%",CNBC Indonesia,BBCA
736,2022-04-21,Top! Dana Masyarakat di BCA Hampir Rp 1.000 T,CNBC Indonesia,BBCA
737,2022-04-23,Transaksi Digital Banking BCA (BBCA) Terus Tumbuh pada Kuartal I/2022,Bisnis,BBCA
738,2022-04-25,"Blu by BCA Digital Punya 675.900 Pengguna, Mayoritas Tinggal di Jakarta",Bisnis,BBCA
739,2022-04-25,"Bank Ramai-ramai Tutup Kantor Cabang, BCA (BBCA): Layanan Tatap Muka Masih Relevan",Bisnis,BBCA
740,2022-04-25,Bos BCA Beberkan Kunci Layanan Prima Perbankan,Bisnis,BBCA
741,2022-04-25,"Catat Yuk! Ini Lokasi Penukaran Uang Lebaran 2022 di BCA, BSI, dan CIMB Niaga",Bisnis,BBCA
742,2022-04-26,"Jalankan Stress Test, Jurus BCA Digital Antisipasi Lonjakan Trafik saat Acara Spesial",Bisnis,BBCA
743,2022-04-26,BCA Digital Luncurkan Fitur Pinjaman Langsung pada Kuartal IV/2022,Bisnis,BBCA
744,2022-04-27,"Jelang Libur Lebaran 2022, Ini Jadwal Operasional Kantor Cabang BCA (BBCA)",Bisnis,BBCA
745,2022-04-27,Daftar Lokasi Penukaran Uang Lebaran Bank BCA di Jabodetabek,CNBC Indonesia,BBCA
746,2022-04-27,"Kantor Cabang BCA Buka Pas Libur Lebaran, Cek Tanggalnya!",CNBC Indonesia,BBCA
747,2022-04-30,Simak Jadwal Kantor Cabang BCA dan Mandiri Selama Libur Lebaran 2022,Bisnis,BBCA
748,2022-05-01,Mobile Banking dan Bank Digital BCA (BBCA) Apa Bedanya?,Bisnis,BBCA
749,2022-05-03,"Daftar Kantor Cabang BCA (BBCA) yang Buka Mulai Besok, 4-5 Mei 2022",Bisnis,BBCA
750,2022-05-04,Simak Cara Memblokir Kartu ATM BCA dan Bank Mandiri Melalui Gadget,Bisnis,BBCA
751,2022-05-04,"Cara Buka Rekening BRI (BBRI), BCA (BBCA), BNI (BBNI), dan Mandiri (BMRI) Secara Online",Bisnis,BBCA
752,2022-05-04,"Mulai Hari Ini 4 Mei Sampai Besok 5 Mei, Ini Daftar Kantor BCA (BBCA) yang Mulai Buka",Bisnis,BBCA
753,2022-05-08,"Bank Mandiri Jadi Bank dengan Aset Terbesar, Bank BCA Catat Pertumbuhan Aset Tinggi",Kontan,BBCA
754,2022-05-09,"Saham Big Caps Tumbang, BBCA, BMRI, BBRI, ASII Sentuh ARB",Kontan,BBCA
755,2022-05-09,"Saham BRI (BBRI), BCA (BBCA), Mandiri (BMRI), BNI (BBNI) Anjlok, Intip Kinerjanya",Bisnis,BBCA
756,2022-05-10,Wisma BCA (BBCA) Foresta BSD Punya SPKLU yang Beroperasi 24 Jam,Bisnis,BBCA
757,2022-05-10,"Ini Promo Nonton Bioskop XXI dari Bank Danamon, BCA, Grab, BNI dan DBS",Bisnis,BBCA
758,2022-05-11,"Kredit Korporasi BCA Tumbuh 9,2 Persen, Sektor Ini Jadi Kontributor Terbesar",Bisnis,BBCA
759,2022-05-11,"Bank Mandiri, BRI dan BCA Menyiapkan Suntikan Modal ke Anak Usaha",Kontan,BBCA
760,2022-05-12,"Bak Petir di Siang Bolong IHSG Anjlok 3 Persen ke 6.600, Saham BCA Dilego Asing Rp617 Miliar",Bisnis,BBCA
761,2022-05-12,Ini 3 Cara Top Up M-Tix via BCA dengan Mudah,Kontan,BBCA
762,2022-05-13,"BBCA, BBRI, BMRI, hingga BBNI Berebut Pembiayaan Manufaktur, Siapa Juara?",Bisnis,BBCA
763,2022-05-14,Top 5 News BisnisIndonesia.id: Strategi Bertahan BCA hingga Runtuhnya Reputasi Softbank,Bisnis,BBCA
764,2022-05-16,"Gaji Direksi BBRI, BMRI, BBCA hingga BBNI",Bisnis,BBCA
765,2022-05-17,Kurs Dolar AS ke Rupiah Hari ini (17/5) di BRI dan BCA,Bisnis,BBCA
766,2022-05-18,Kurs Dolar AS Hari ini (18/5) di BRI & BCA,Bisnis,BBCA
767,2022-05-18,BCA (BBCA) Berikan Fasilitas Pinjaman Kredit ke Bank Oke (DNAR) Senilai Rp100 Miliar,Bisnis,BBCA
768,2022-05-18,"BTN (BBTN) Dapat Pinjaman Rp1,4 Triliun dari JICA, Citi Indonesia, dan BCA (BBCA)",Bisnis,BBCA
769,2022-05-18,Kurs Jual Beli Dolar AS di BCA (BBCA) dan BRI (BBRI) Hari Ini Kamis 19 Mei 2022,Bisnis,BBCA
770,2022-05-19,Jangan Panik! Ini Cara Mengembalikan Uang Salah Transfer di Bank BCA,Bisnis,BBCA
771,2022-05-19,"Simak Menu Saham Hari Ini, Beli BBCA-GOTO dan Jual AALI-ARTO",CNBC Indonesia,BBCA
772,2022-05-20,Bos BCA (BBCA) Buka-bukaan Strategi Antisipasi Kenaikan Bunga Acuan Bank Indonesia,Bisnis,BBCA
773,2022-05-21,Belajar ‘Seni’ Melepas Kredit ala Bos BCA (BBCA) Jahja Setiaatmadja,Bisnis,BBCA
774,2022-05-23,"Cara Blokir Kartu ATM BCA yang Hilang Lewat HP, Bisa Pakai M-Banking atau WhatsApp",Bisnis,BBCA
775,2022-05-23,Kurs Jual Beli Dolar AS di BCA (BBCA) dan BRI (BBRI) Hari Ini Senin 23 Mei 2022,Bisnis,BBCA
776,2022-05-29,"Ramalan Bos BCA Soal Hanya 3 Bank Digital yang Akan Bertahan, Mulai Terbukti?",Bisnis,BBCA
777,2022-05-30,Begini Cara BCA Bersaing di Kompetisi Bank Digital,Bisnis,BBCA
778,2022-05-30,Bareskrim Polri Berhasil Bongkar Deposit Box Indra Kenz di BCA,Bisnis,BBCA
779,2022-06-02,"Saham-Saham Big Cap Penekan IHSG, EMTK-BBCA Masuk Daftar",Bisnis,BBCA
780,2022-06-03,"Lowongan Kerja Magang Bakti BCA Bagi Lulusan SMA hingga S1, Ini Link dan Syaratnya",Bisnis,BBCA
781,2022-06-04,Saham Emiten Mertua Syahrini (PLIN) sampai Hary Tanoe (BCAP) Masuk Top Losers Pekan Ini,Bisnis,BBCA
782,2022-06-05,"Arab Saudi Buka Ibadah Haji, Anak Usaha BCA (BBCA) Ikut Untung",Bisnis,BBCA
783,2022-06-07,"Bunga 6%-7%, Begini Cara Dapat KUR dari BRI Hingga BCA",CNBC Indonesia,BBCA
784,2022-06-08,"Viral Penipuan Berkedok Tawaran Jadi Nasabah BCA Prioritas, Ini Cirinya!",Bisnis,BBCA
785,2022-06-09,Ini 3 Cara Cek Nomor Rekening BCA secara Online dan Offline,Kontan,BBCA
786,2022-06-09,"BCA Hanya Surati Kandidat Prioritas, Selain Ini Penipuan!",CNBC Indonesia,BBCA
787,2022-06-13,"Makin Ramai, BCA (BBCA) Catat AUM Nasabah Prioritas Naik 14 Persen",Bisnis,BBCA
788,2022-06-13,BCA (BBCA) Siapkan Belanja Rp500 Miliar Tangkal Kejahatan Siber,Bisnis,BBCA
789,2022-06-13,"Perkuat Sistem Keamanan Digital, BCA Siapkan Rp 500 M",CNBC Indonesia,BBCA
790,2022-06-13,Nemu Akun Palsu BCA di Media Sosial? Laporkan Segera!,CNBC Indonesia,BBCA
791,2022-06-14,"Saham GOTO Punya Bobot Lebih Besar dari BBCA, Begini Pandangan Analis",Kontan,BBCA
792,2022-06-15,"Tarik Tunai Tanpa Kartu BCA (BBCA), Transaksi Capai 54 Juta",Bisnis,BBCA
793,2022-06-18,"Gaet Konsultan Singapura, BCA hadirkan Gedung Ramah Lingkungan di Wisma BCA Foresta",Kontan,BBCA
794,2022-06-19,BCA Finance Kejar Setoran Demi Pulihkan Aset,Bisnis,BBCA
795,2022-06-20,Produsen Taro (AISA) Mau Tarik Pinjaman US$350 Juta dari BNI dan BCA,Bisnis,BBCA
796,2022-06-20,"BBRI, BBCA, BBNI dan Isu Lingkungan di Pembiayaan Perbankan Indonesia",Bisnis,BBCA
797,2022-06-20,"Cucu Usaha Grup Djarum (TOWR) Tambah Utang Rp1,5 Triliun dari BCA",Bisnis,BBCA
798,2022-06-21,BCA Kucurkan Rp 472 Miliar Untuk Eco Paper Indonesia,CNBC Indonesia,BBCA
799,2022-06-22,"Kurs Jual Beli Dollar AS di BCA, BRI, Mandiri & BNI, Hari Ini (22/6)",Bisnis,BBCA
800,2022-06-23,"Bank Disebut Serakah Cari Laba, Bos BCA (BBCA) Buka Suara",Bisnis,BBCA
801,2022-06-23,Beda Pandangan Bos BCA (BBCA) dan Bank Jago (ARTO) soal Ramalan Bank Digital,Bisnis,BBCA
802,2022-06-24,"Tingkatkan Penetrasi Hingga 20 Persen per Bulan, Ini Modal BCA Digital (BLU)",Bisnis,BBCA
803,2022-06-28,"Gandeng Pinjol, BCA Digital Bidik 19 Juta UMKM",Bisnis,BBCA
804,2022-06-30,Ini Sejumlah Inisiatif BCA Wujudkan Pembangunan Berkelanjutan,Kontan,BBCA
805,2022-07-01,"Sampah Operasional Bank BCA Berton-ton, Jadi Apaan?",CNBC Indonesia,BBCA
806,2022-07-01,"Gencar Salurkan Kredit Hijau, BCA Incar Sektor Ini",CNBC Indonesia,BBCA
807,2022-07-01,"Gak Latah Rilis Green Bond, Pembiayaan Hijau BCA Pakai Ini",CNBC Indonesia,BBCA
808,2022-07-02,BCA (BBCA) Dikabarkan Hapus Pinjaman Trikomsel Oke (TRIO),Bisnis,BBCA
809,2022-07-05,"Kurs Jual Beli Dollar AS di BCA, BRI, Bank Mandiri, dan BNI (BBNI), Hari Ini (5/7)",Bisnis,BBCA
810,2022-07-05,BCA (BBCA) Optimistis Sektor Pembiayaan Berkelanjutan Tetap Tumbuh Tahun Ini,Bisnis,BBCA
811,2022-07-05,"Inilah 4 Cara Isi Saldo LinkAja lewat Mobile Banking BCA, BRI, Mandiri, dan BNI",Kontan,BBCA
812,2022-07-06,"Survei Populix: m-Banking BCA dan BRI Dominasi Pasar, Siapa Menyusul?",Bisnis,BBCA
813,2022-07-07,"Kurs Jual Beli Dolar AS di BCA, BRI, Bank Mandiri, dan BNI Hari Ini (7/7)",Bisnis,BBCA
814,2022-07-07,"Mayoritas Big Cap Turun, Saham BBCA & BBRI Tetap Layak Dicermati",Bisnis,BBCA
815,2022-07-08,"Gugat BCA (BBCA), Cahaya Bintang Medan (CBMF) Persoalkan Jaminan yang Dilelang",Bisnis,BBCA
816,2022-07-11,"Suku Bunga Dasar Kredit di BRI, Mandiri, BNI, dan BCA per Senin 11 Juli",Bisnis,BBCA
817,2022-07-11,"Kurs Jual Beli Dolar AS di BCA (BBCA), BRI (BBRI), dan BNI (BBNI), Senin (11/7/2022)",Bisnis,BBCA
818,2022-07-14,"BCA Gelar BCA Expo 2022 di Medan, untuk Genjot Bisnis di Semester II-2022",Kontan,BBCA
819,2022-07-14,Bank BCA Digital Melaju Jadi Bank Digital Terbaik Indonesia,Kontan,BBCA
820,2022-07-15,"Kurs Jual Beli Dolar AS di BCA, BRI, Bank Mandiri & BNI Hari Ini, 15 Juli 2022",Bisnis,BBCA
821,2022-07-15,"BCA Ogah Tutup Kantor Cabang, Ternyata Ini Alasannya",Bisnis,BBCA
822,2022-07-15,"Rogoh Rp352,5 Juta, Direktur BCA (BBCA) Beli 50 Ribu Saham",Bisnis,BBCA
823,2022-07-16,"Laba BCA Life Tumbuh 73,9 Persen di Paruh 2022",Bisnis,BBCA
824,2022-07-16,"Suku Bunga KPR Terbaru 10 Bank Besar: BRI, BCA, hingga BTN",Bisnis,BBCA
825,2022-07-17,"Jumlah Pengguna BCA Digital (Blu) Sentuh 800.000, Berapa Pengguna Aktif?",Bisnis,BBCA
826,2022-07-19,"Saham Pilihan saat Inflasi Tinggi: Ada BBCA, BMRI, MAPI & PWON",Bisnis,BBCA
827,2022-07-22,"Bank Digital BCA Punya 806.000 Pengguna Aktif, Total Transaksi Sentuh Rp36 Triliun",Bisnis,BBCA
828,2022-07-22,"Kuartal I/2022, Rasio NPL BCA (BBCA) Terjaga di Level 2,3 Persen",Bisnis,BBCA
829,2022-07-23,"BCA Digital Sebut Jumlah Transaksi di Aplikasi Blu Sudah Capai 15,4 Juta Kali",Kontan,BBCA
830,2022-07-23,Bos BCA Digital: Nasabah Saldo Nol Hanya Menjadi Beban,Bisnis,BBCA
831,2022-07-23,"Bos BCA Digital Ingin Nasabah Gemar Transaksi Lewat Blu, Kenapa?",Bisnis,BBCA
832,2022-07-25,Cek! Ini Syarat dan Cara Buka Rekening Blu by BCA Digital,Bisnis,BBCA
833,2022-07-25,Nasabah Saldo Nol jadi Beban bagi BCA? Simak Alasannya,Bisnis,BBCA
834,2022-07-26,"Kode Transfer Bank BCA, BNI, BRI, Mandiri, BSI, BTN & Lainnya",CNBC Indonesia,BBCA
835,2022-07-26,"ATM Semakin Ditinggalkan, Data Transaksi BCA (BBCA) Buktinya",Bisnis,BBCA
