,published_date,title,publisher,kode_emitten
0,2018-09-19,BCA Finance Upayakan Dorong Kontribusi Makassar,Bisnis,BBCA
1,2018-09-26,Saham BBCA Jadi Motor Penggerak IHSG,Bisnis,BBCA
2,2018-10-04,"Tingkatkan Pelayanan, BCA Life Luncurkan Mobile Service",Bisnis,BBCA
3,2018-10-11,"BCA Pasarkan Asuransi Penyakit Kritis dari AIA, Premi Mulai Rp300.000 Per Bulan",Bisnis,BBCA
4,2018-10-16,BCA Tawarkan Buka Rekening Tanpa Buku Tabungan,Bisnis,BBCA
5,2018-11-04,UMKM dan Modal Kerja Dorong Pertumbuhan Kredit BCA,Bisnis,BBCA
6,2018-11-09,"Metode Perhitungan Indeks LQ45 & IDX30 Berubah, BCA Juaranya",CNBC Indonesia,BBCA
7,2018-11-12,BCA Kucurkan Kredit Rp20 Miliar melalui PT Askara Bangun Cemerlang,Bisnis,BBCA
8,2018-11-12,"Oktober 2018, Saham BCA Jadi Juara Nilai Transaksi Tertinggi",CNBC Indonesia,BBCA
9,2018-11-25,BCA MEDAN RUN 2018: 1.800 Peserta Akan Ikut Berpartisipasi,Bisnis,BBCA
10,2018-11-28,BCA Salurkan Kredit kepada Grup Pupuk Indonesia,Bisnis,BBCA
11,2018-12-03,BCA Luncurkan Kartu Kredit Co-Brand Bersama Singapore Airlines,Bisnis,BBCA
12,2018-12-03,Peluncuran BCA Singapore Airlines KrisFlyer Visa Infinite,Bisnis,BBCA
13,2018-12-10,BCA Raih ‘Best of The Best Awards’ 2018 dari Forbes Indonesia,Bisnis,BBCA
14,2018-12-13,Vonis Johanes Kotjo: Pemblokiran 4 Rekening BCA Terpidana Dicabut,Bisnis,BBCA
15,2018-12-17,"BCA Kucurkan Pinjaman Rp 1,2 T ke Perusahaan Sawit Ini",CNBC Indonesia,BBCA
16,2018-12-20,Alipay Disebut Mulai Dekati BRI & BCA,Bisnis,BBCA
17,2018-12-20,"Bos BCA Akui 'Pedekate' dengan Alipay, Fasilitasi Turis China",CNBC Indonesia,BBCA
18,2019-01-02,"Sepanjang tahun 2018, bunga deposito Bank Central Asia (BBCA) meningkat 175 bps",Kontan,BBCA
19,2019-01-07,Kapitalisasi Pasar Saham BCA Tembus Tertinggi di Asia Tenggara,Bisnis,BBCA
20,2019-01-09,"Hijrah ke Digital, Transaksi Nasabah di Cabang BCA Tinggal 3%",CNBC Indonesia,BBCA
21,2019-01-14,"Soal Rencana Akuisisi, Bos BCA: Satu Sudah Siap Janurnya",CNBC Indonesia,BBCA
22,2019-01-15,Sejauh Mana Proses Rencana Akuisisi Bank BCA?,CNBC Indonesia,BBCA
23,2019-01-15,BCA Kantongi Nama Bank yang Mau Dibeli,Bisnis,BBCA
24,2019-01-16,"Rencana BCA Akuisisi Bank Kecil, Ini Daftar Bank yang Dirumorkan Masuk Nominasi",Bisnis,BBCA
25,2019-01-22,Rekor! Harga BCA Capai Level Tertinggi Sepanjang Sejarah,CNBC Indonesia,BBCA
26,2019-01-23,"Jika Punya Saham BCA 10 Tahun Lalu, Anda Sudah Cuan 900%!",CNBC Indonesia,BBCA
27,2019-01-26,"Bayar Utang ke BCA, Taksi Express Jual Tanah",CNBC Indonesia,BBCA
28,2019-01-27,Ahok Hingga Bos BCA Belasungkawa untuk Eka Tjipta Widjaja,CNBC Indonesia,BBCA
29,2019-01-30,Buka-bukaan Bos BCA soal Ancaman Bisnis Perbankan,CNBC Indonesia,BBCA
30,2019-01-31,Penjelasan Bos BCA Atas Kepemilikan 1% Saham di BTPN,CNBC Indonesia,BBCA
31,2019-02-03,"Siap-siap, BCA Bagi-bagi Promo Khusus di Ultah ke-62",Bisnis,BBCA
32,2019-02-04,"Cara Jahja Setiaatmadja Pimpin BCA: Ngobrol, Tak Perlu Marah",CNBC Indonesia,BBCA
33,2019-02-04,"BCA mencatat laba Rp 25,55 triliun di akhir 2018",Kontan,BBCA
34,2019-02-04,Begini Cara Jahja Setiaatmadja Pimpin BCA !,CNBC Indonesia,BBCA
35,2019-02-05,"Merger Rampung, BNI & BCA Jadi Pemegang Saham Bank BTPN",CNBC Indonesia,BBCA
36,2019-02-06,"5 Berita Populer Finansial, BCA dan BNI Genggam BTPN, Inklusi Keuangan Meningkat Tiap Tahun",Bisnis,BBCA
37,2019-02-06,BCA dan BNI Genggam Saham BTPN,Bisnis,BBCA
38,2019-02-07,"Sepanjang 2018, BCA Naikkan Bunga Deposito 1,75%",Bisnis,BBCA
39,2019-02-08,"Cicil Utang ke BCA, TAXI Berencana Jual 1.200 Armada",Bisnis,BBCA
40,2019-02-08,"Cicil Utang ke BCA, Taksi Express Jual 1.200 Kendaraan",CNBC Indonesia,BBCA
41,2019-02-10,BCA Tertarik Layani Transaksi 'Coworking Space',Bisnis,BBCA
42,2019-02-13,BCA Serahkan Beasiswa Rp250 Juta untuk Universitas Sriwijaya,Bisnis,BBCA
43,2019-02-14,AIA Financial gandeng BCA Siapkan Asuransi Pendidikan,Bisnis,BBCA
44,2019-02-19,"Perkuat Layanan Digital, BCA Gelontorkan Investasi Rp1,5 Triliun",Bisnis,BBCA
45,2019-02-20,"Jadi Incaran Akuisisi BCA, Ini Profil Bank Royal dari Ciparay",CNBC Indonesia,BBCA
46,2019-02-20,Terungkap! Ini Bank yang akan Diakuisisi oleh BCA,CNBC Indonesia,BBCA
47,2019-02-22,"Optimalkan pendapatan non bunga, Bank BCA anggarkan belanja modal IT Rp 5,2 triliun",Kontan,BBCA
48,2019-02-28,Berita BCA Syariah Hari Ini Terkini dan Terlengkap,Bisnis,BBCA
49,2019-02-28,"Bos BCA: NIM Perbankan Turun, IHSG Bisa Hancur",CNBC Indonesia,BBCA
50,2019-02-28,"Bank BCA (BBCA) catat laba bersih Rp 25,9 triliun ditopang pendapatan bunga bersih",Kontan,BBCA
51,2019-02-28,"Wah, Mulai 11 Maret Bisa Bikin Rekening BCA dari Aplikasi",CNBC Indonesia,BBCA
52,2019-02-28,BCA Keyboard Belum Bisa di Apple iPhone? Ini Penjelasan BCA,CNBC Indonesia,BBCA
53,2019-03-01,"Kinerja 2018 Diapresiasi, Saham BCA Diborong Asing",CNBC Indonesia,BBCA
54,2019-03-02,Bank Central Asia (BBCA) kerjasama dengan Duo China,Kontan,BBCA
55,2019-03-05,BCA Gelar Pelatihan Kepemimpinan dan Komunikasi Bagi Pengurus Desa Wisata Pentingsari,Bisnis,BBCA
56,2019-03-06,"Terkaya di RI, Berapa Keuntungan Dua Hartono Dari BCA?",CNBC Indonesia,BBCA
57,2019-03-08,"Mengulik Harta Duo Hartono di BCA, Orang Terkaya di Indonesia",CNBC Indonesia,BBCA
58,2019-03-14,Direktur BCA Suwignyo Budiman Diusulkan Jabat Wakil Presiden Direktur,Bisnis,BBCA
59,2019-04-11,BCA Bagi Dividen Rp 340/Saham dan Tunjuk Wapresdir Baru,CNBC Indonesia,BBCA
60,2019-04-11,"Gandeng WeChat, BCA Bisa Layani Turis China Pakai QR Code",CNBC Indonesia,BBCA
61,2019-04-11,BCA jadi bank terbaik di Indonesia versi Forbes,Kontan,BBCA
62,2019-04-16,Migrasi Kartu ATM Cip BCA Sudah Tembus 9 Juta Keping,Bisnis,BBCA
63,2019-04-17,Bos BCA Berharap Presiden Terpilih Menjaga Stabilitas Likuiditas,Bisnis,BBCA
64,2019-04-22,BCA Akuisisi Bank Royal Senilai Rp1 Triliun,Bisnis,BBCA
65,2019-04-23,"Konsolidasi Bank, BCA Resmi Beli Bank Royal Senilai Rp 1 T",CNBC Indonesia,BBCA
66,2019-04-23,"BCA Akuisisi dengan Harga Tinggi, Ini Nasib Bank Royal Nantinya",Bisnis,BBCA
67,2019-04-25,"BCA, BRI dan Mandiri masuk jajaran sepuluh bank terbesar di Asia Tenggara",Kontan,BBCA
68,2019-04-26,Ini Profil Bank Royal yang Akan Diakuisisi BCA,Bisnis,BBCA
69,2019-05-09,BCA perkuat kerjasama dengan Fintech untuk ciptakan ekosistem keuangan yang stabil,Kontan,BBCA
70,2019-05-17,"Penuhi Kebutuhan Lebaran, BCA Andalkan Uang Elektronik",Bisnis,BBCA
71,2019-05-21,"Direksi BCA Getol Tambah Saham, Total Transaksi Rp11,42 Miliar",Bisnis,BBCA
72,2019-05-21,"Kapitalisasi BEI Susut Rp 435 T, eh Bobot BCA Bertambah",CNBC Indonesia,BBCA
73,2019-05-23,BCA Gelar Autoshow 2019 di Padang,Bisnis,BBCA
74,2019-05-26,"Profit Asuransi Umum BCA Naik Hingga 20,52 Persen",Bisnis,BBCA
75,2019-05-28,284 Cabang BCA Beroperasi Terbatas pada Libur Idulfitri 2019,Bisnis,BBCA
76,2019-06-01,"Ini jadwal layanan operasional BCA, Bank Mandiri, BRI dan BNI saat libur Lebaran",Kontan,BBCA
77,2019-06-10,"Usai Caplok Bank Royal, BCA akan Akuisisi Satu Bank Lagi",CNBC Indonesia,BBCA
78,2019-06-10,"Tembus Harga Rp 30.100, Saham BCA Rekor Tertinggi Sejak IPO",CNBC Indonesia,BBCA
79,2019-06-11,BCA bakal suntik modal BCA Syariah di kuartal II-2019,Kontan,BBCA
80,2019-06-11,"Harga Saham Rekor Lagi, BCA Tiap Hari Cetak Laba Rp 57,14 M",CNBC Indonesia,BBCA
81,2019-06-12,Bos BCA: Bank Royal Kemungkinan Dimerger ke BCA Syariah,CNBC Indonesia,BBCA
82,2019-06-17,Pertumbuhan Kartu Kredit BCA Stabil,Bisnis,BBCA
83,2019-06-20,BCA Akuisisi Bank Royal,Bisnis,BBCA
84,2019-06-21,"Cegah penjaminan berganda, BCA Finance ikut terapkan sistem pendaftaran agunan",Kontan,BBCA
85,2019-06-28,"Simak rekomendasi BBCA, PTBA dan ACES berikut ini",Kontan,BBCA
86,2019-06-28,KlikBCA,Kontan,BBCA
87,2019-06-30,BCA Tak Patok Kenaikan NIM Hingga Akhir Tahun,Bisnis,BBCA
88,2019-07-02,BCA Rogoh Kocek Rp500 Miliar untuk Sewa Asrama BCA Learning Institute,Bisnis,BBCA
89,2019-07-02,"Sewa Asrama Karyawan, BCA Rogoh Kocek hingga Rp 497 M",CNBC Indonesia,BBCA
90,2019-07-07,BCA dan BNN Gelar Pelatihan Relawan Anti Narkoba,Bisnis,BBCA
91,2019-07-12,"Saham BCA & BRI Rekor, Bobot Sektor Perbankan Capai 33,5%",CNBC Indonesia,BBCA
92,2019-07-18,"Tingkatkan Penetrasi Produk, Ini Inovasi Digital Terkini BCA Life",Bisnis,BBCA
93,2019-07-21,BCA Kembali Raih Gallup Great Workplace Award,Bisnis,BBCA
94,2019-07-22,"Wuih, Saham BBCA Tembus Rekor Baru",CNBC Indonesia,BBCA
95,2019-07-24,"BCA Hati-hati Beri Kredit, Kenapa?",CNBC Indonesia,BBCA
96,2019-07-24,"Deposito Bank BCA tumbuh 18,1% di semester I, apa dampaknya terhadap kinerja?",Kontan,BBCA
97,2019-07-30,Lagi! Vera Eva Lim Tambah Kepemilikan Saham BCA,CNBC Indonesia,BBCA
98,2019-08-05,"1.500 ATM BCA Down, Dirut: Kami Tak Bisa Apa-apa",CNBC Indonesia,BBCA
99,2019-08-05,"Saham BBCA (Bank BCA) turun 0,72%, ini PER dan PBV terbaru (2/8)",Kontan,BBCA
100,2019-08-08,BCA Fasiltasi Lulusan SMK Siap Bekerja,Bisnis,BBCA
101,2019-08-12,"Layanan M-Banking BCA Gangguan, Nasabah Teriak",CNBC Indonesia,BBCA
102,2019-08-13,"M-Banking Eror, Nasabah Sulit Transaksi dan Penjelasan BCA",CNBC Indonesia,BBCA
103,2019-08-15,Apa Kabar Kerja Sama Alipay & WeChat dengan BCA?,CNBC Indonesia,BBCA
104,2019-08-18,Bank Artos Indonesia (ARTO) bantah akan diakuisisi BCA,Kontan,BBCA
105,2019-08-22,BrandZ Top 50: BCA Kembali Merajai Pemeringkatan,Bisnis,BBCA
106,2019-09-02,"Dukung Pendidikan Dasar Berkualitas, BCA Beri Pelatihan Guru Sekolah Binaan",Bisnis,BBCA
107,2019-09-03,"Gantikan Jan Hendra, BCA angkat Raymon Yonarto jadi sekretaris perusahaan",Kontan,BBCA
108,2019-09-04,BCA Angkat Sekretaris Perusahaan Baru,Bisnis,BBCA
109,2019-09-20,BCA Sesuaikan LTV KPR dan KKB Sesuai Profil Risiko Nasabah,Bisnis,BBCA
110,2019-09-23,"5 Berita Terpopuler Market, Langkah Blue Bird Hadapi Transportasi Daring dan BCA Alihkan Utang TAXI ke Perusahaan Singapura",Bisnis,BBCA
111,2019-09-24,BCA Kejar Penyaluran KPR Rp95 Triliun sampai Akhir Tahun,Bisnis,BBCA
112,2019-09-25,BCA: Uang elektronik berbasis kartu unggul pada kecepatan transaksi,Kontan,BBCA
113,2019-10-07,"Direstui OJK, BCA Resmi Miliki 2 Wakil Presdir",CNBC Indonesia,BBCA
114,2019-10-07,BCA Dinobatkan Sebagai Bank Paling Aman di Indonesia,Kontan,BBCA
115,2019-10-07,"BCA-Sinarmas Gelar Expo, Tawarkan Bunga Murah Kredit Rumah dan Kendaraan",Bisnis,BBCA
116,2019-10-08,Semua Nasabah BCA Bisa Mulai Berinvestasi Lewat Aplikasi Welma,Bisnis,BBCA
117,2019-10-08,"BCA Kini Punya Welma, Beli Reksa Dana via HP!",CNBC Indonesia,BBCA
118,2019-10-08,"Direksi & Komisaris Transaksi Saham BCA, Berapa Nilainya?",CNBC Indonesia,BBCA
119,2019-10-11,"BCA Multi Finance Diresmikan, Pengganti Central Sentosa Finance",Bisnis,BBCA
120,2019-10-14,Menanti Harga UNVR dan BBCA menjadi Lebih Murah,Kontan,BBCA
121,2019-10-14,Pembahasan Skema Kerja Sama BCA dengan Alipay dan WeChat Pay Masih Alot,Bisnis,BBCA
122,2019-10-17,BCA Raih Penghargaan ‘Best Financial Sector’,Bisnis,BBCA
123,2019-10-18,BCA Surabaya Kejar Penyaluran Kredit 1.500 Kendaraan,Bisnis,BBCA
124,2019-10-19,"Agar tak boros belanja, begini cara kontrol kartu kredit BCA",Kontan,BBCA
125,2019-10-24,Siap-siap! Saham BCA Bisa Tembus Rekor Baru Lagi,CNBC Indonesia,BBCA
126,2019-10-24,"Suku Bunga Turun, Saham BBCA Sentuh Level Tertinggi",CNBC Indonesia,BBCA
127,2019-10-26,"Incar Dana Rp1,5 Triliun, BCA Finance Tawarkan Obligasi dengan Bunga 7,8%",Bisnis,BBCA
128,2019-10-28,"Q3-2019, Laba BCA Naik 13% Jadi Rp 20,9 T",CNBC Indonesia,BBCA
129,2019-10-28,Jadikah Alipay dan WeChat Kerja Sama dengan Bank BCA?,CNBC Indonesia,BBCA
130,2019-10-29,Kinerja Operasional Yang Solid Dorong Laju Bisnis BCA,CNBC Indonesia,BBCA
131,2019-11-04,BCA Salurkan Beasiswa Rp350 Juta untuk 50 Mahasiswa UB,Bisnis,BBCA
132,2019-11-04,Kongsi BCA Dengan Alipay dan WeChat Pay Dimulai Awal 2020,Bisnis,BBCA
133,2019-11-05,Sah! BCA Rampungkan Akuisisi Bank Royal Rp 988 M,CNBC Indonesia,BBCA
134,2019-11-08,Nasib Ribuan Cabang BCA yang Mulai Ditinggal Nasabah,CNBC Indonesia,BBCA
135,2019-11-10,"Transaksi Tinggal 1,8%, Bagaimana Nasib Kantor Cabang BCA?",CNBC Indonesia,BBCA
136,2019-11-11,BCA-JCB Black Manjakan Para Pelancong ke Mancanegara,Bisnis,BBCA
137,2019-11-11,Bos BCA: Kami Sudah Digital Bank,CNBC Indonesia,BBCA
138,2019-11-11,Cerita BCA yang Tak Lagi Jor-joran Buka Kantor Cabang,CNBC Indonesia,BBCA
139,2019-11-16,Bank BCA Lelang Rumah Milik Mantan Dirut Tiga Pilar (AISA) Seharga Rp 106 Miliar,Kontan,BBCA
140,2019-11-20,Malindo Feedmill (MAIN) mengantongi pinjaman Rp 250 miliar dari BCA,Kontan,BBCA
141,2019-11-23,BCA Siapkan Implementasi Blockchain demi Efisiensi,Bisnis,BBCA
142,2019-11-23,15 Finalis Lolos Kompetisi Teknologi Berbasis Blockchain BCA Finhacks 2019,Bisnis,BBCA
143,2019-11-28,"2020, BBCA Suntik Modal Bank Royal Rp 700 M",CNBC Indonesia,BBCA
144,2019-11-30,"Uang tunai di dompet kurang, bisa bayar transaksi pakai Flazz BCA",Kontan,BBCA
145,2019-12-03,"Ini penyebab layanan m-BCA mengalami gangguan, Senin (2/12)",Kontan,BBCA
146,2019-12-03,"Mobile Banking BCA Error, Ini Penjelasan dari Manajemen",Bisnis,BBCA
147,2019-12-04,BCA RAIH PENGHARGAAN MARKETEER OF THE YEAR,Bisnis,BBCA
148,2019-12-04,"Ekspansi Fintech, BCA Suntik Central Capital Ventura Rp 200 M",CNBC Indonesia,BBCA
149,2019-12-10,"JP Morgan: Mandiri, BRI dan BCA Tumbuh di Atas Ekspektasi",CNBC Indonesia,BBCA
150,2019-12-11,BCA Akuisisi Rabobank Senilai Rp397 Miliar,Bisnis,BBCA
151,2019-12-11,"Ini Alasan BCA Akuisisi Rabobank Indonesia, Dimergerkah?",CNBC Indonesia,BBCA
152,2019-12-11,Wah! BCA Resmi Caplok Rabobank Indonesia,CNBC Indonesia,BBCA
153,2019-12-11,BCA Sudah Caplok 2 Bank dalam Setahun,CNBC Indonesia,BBCA
154,2019-12-12,"Hikayat Rabobank Indonesia, Tutup Operasi hingga Dicaplok BCA",CNBC Indonesia,BBCA
155,2019-12-12,"Ikut Caplok Rabobank Indonesia, Begini Kinerja BCA Finance",CNBC Indonesia,BBCA
156,2019-12-14,"Usai diakuisisi BBCA, Bank Royal Minta Nasabah Tutup Rekening dan Tarik Dana",Kontan,BBCA
157,2019-12-18,Ini Jadwal Layanan Kantor BCA di Libur Natal 2019 dan Tahun Baru 2020,Bisnis,BBCA
158,2019-12-19,"Sempat Rekor Harga Tertinggi, Apakah Saham BCA Sudah Mahal?",CNBC Indonesia,BBCA
159,2019-12-20,BCAP Beli Aset Default di Reksa Dana MNC Asset Management,Bisnis,BBCA
160,2019-12-23,Jahja Setiaatmadja jual saham BBCA jelang akhir tahun,Kontan,BBCA
161,2019-12-23,"Jajan Sederhana, Berapa Nilai Saham Bambang Hartono di BCA?",CNBC Indonesia,BBCA
162,2019-12-24,"Tebak! Jika Saham BCA Rp 40.000, Berapa Kekayaan Duo Hartono?",CNBC Indonesia,BBCA
163,2020-01-03,"Terdampak Banjir, Enam Kantor Cabang BCA Tutup Sementara",CNBC Indonesia,BBCA
164,2020-01-06,BCA Syariah Tekan Pembiayaan Bermasalah di Bawah 1 Persen,Bisnis,BBCA
165,2020-01-07,Pembiayaan BCA Finance Menyusut Tergerus Permintaan Roda Empat,Bisnis,BBCA
166,2020-01-08,"2019, Aset BCA Syariah Melesat 22 Persen",Bisnis,BBCA
167,2020-01-13,Kolaborasi BCA dengan WeChat akan Meluncur Dalam Waktu Dekat,CNBC Indonesia,BBCA
168,2020-01-13,"Kongsi dengan WeChat Pay & Alipay, Ini yang Disiapkan BCA",Bisnis,BBCA
169,2020-01-15,Harga Saham BCA Cetak Rekor Baru,CNBC Indonesia,BBCA
170,2020-02-06,"PER saham BBCA hampir 30 kali, kemarin saham ini paling diincar asing",Kontan,BBCA
171,2020-02-08,"Mana yang lebih cuan: saham BCA atau deposito BCA? Yuk, kita hitung!",Kontan,BBCA
172,2020-02-18,"Hendra Lembong, Jebolan Citibank yang Kabarnya Gabung ke BCA",CNBC Indonesia,BBCA
173,2020-02-18,"Ada Kabar Gabung ke BCA, Siapa Haryanto Budiman?",CNBC Indonesia,BBCA
174,2020-02-20,"Laba BCA 2019 Tembus Rp 28,6 T, Melesat 11%",CNBC Indonesia,BBCA
175,2020-02-20,BCA Expoversary Makassar Tawarkan Promo Kredit Rumah dan Kendaraan,Bisnis,BBCA
176,2020-02-21,"Haryanto Budiman & Hendra Lembong Join BCA, Jahja Buka Suara",CNBC Indonesia,BBCA
177,2020-02-21,BCA Expoversary 2020 Bidik Transaksi Rp5 Triliun,Bisnis,BBCA
178,2020-02-22,BCA Bakal Tambah Direksi Baru?,Bisnis,BBCA
179,2020-02-22,"BCA Surabaya Kejar Penyaluran Kredit Rp3,5 Triliun Tahun Ini",Bisnis,BBCA
180,2020-02-23,"BCA Gandeng Sinar Mas Land Tawarkan Bunga KPR 2,63 Persen",Bisnis,BBCA
181,2020-02-24,"Kasus Jiwasraya: Kejaksaan Agung Panggil Pimpinan, BCA dan Bank Mandiri Buka Suara",Bisnis,BBCA
182,2020-02-28,BCA Kenalkan Layanan Valas Full Payment,Bisnis,BBCA
183,2020-03-01,"Arab Saudi Setop Umrah, BCA Syariah Belum Terdampak",Bisnis,BBCA
184,2020-03-04,"Aset 5 Bank Besar: BRI Masih Juara, BCA Tumbuh Paling Tinggi",Bisnis,BBCA
185,2020-03-10,Pengembang The Sanctuary Collection Gandeng Bank BCA,Bisnis,BBCA
186,2020-03-11,"RUPS 9 April, Haryanto Budiman & Hendra Lembong ke BCA",CNBC Indonesia,BBCA
187,2020-03-18,"Cegah Corona, Ini #BankingFromHome a La BCA",CNBC Indonesia,BBCA
188,2020-03-19,"Perdagangan Dihentikan, BCA Kena ARB & 161 Saham Mendekati",CNBC Indonesia,BBCA
189,2020-03-19,"BCA Jual Dolar AS di Rp 16.150, Beli di Rp 15.950",CNBC Indonesia,BBCA
190,2020-03-20,"Kurs Jual-Beli Dolar AS di BCA dan Mandiri, 20 Maret 2020",Bisnis,BBCA
191,2020-03-24,Catat! Ini Daftar Kantor Cabang BCA yang Tutup Sementara,Bisnis,BBCA
192,2020-03-25,"Daftar Kode Transfer Bank di Indonesia 2020, BRI, Mandiri, BCA dan Lainnya",Bisnis,BBCA
193,2020-03-26,"Harga Saham BBCA Cepat Naik Tapi Susah Turun, Kenapa?",Bisnis,BBCA
194,2020-03-28,"Kabar baik, Bank BCA tambah limit transfer KlikBCA individu, ini besaranya",Kontan,BBCA
195,2020-03-30,"5 Berita Populer Finansial, Kabar Pengumuman Bank Mandiri, BNI, & BRI Soal Keringanan Kredit dan Beli Surat Utang, Bank BCA Jaga Likuiditas",Bisnis,BBCA
196,2020-04-09,"Budi dan Michael Hartono, Genap 12 Tahun Jadi Orang Terkaya Berkat BCA",Bisnis,BBCA
197,2020-04-09,BCA Pilih Haryanto Budiman & Gregory Lembong Jadi Direktur,CNBC Indonesia,BBCA
198,2020-04-09,Sah! Haryanto Budiman & Gregory Lembong Jadi Direktur BCA,CNBC Indonesia,BBCA
199,2020-04-09,"Kompetisi Era Digital Kian Ketat, BCA Tambah Dua Direksi Baru",Bisnis,BBCA
200,2020-04-09,"Haryanto Budiman dan Hendra Lembong sah jadi anggota direksi BBCA, ini profil mereka",Kontan,BBCA
201,2020-04-14,"Dari BCA Duo Hartono Dapat Dividen Rp 7,5 T, Salim Berapa?",CNBC Indonesia,BBCA
202,2020-04-16,"Kurs Jual-Beli Dolar AS di BNI dan BCA, 16 April 2020",Bisnis,BBCA
203,2020-04-16,"Bos-Bos BCA Tambah Kepemilikan Saham, Investasi Jangka Panjang",Bisnis,BBCA
204,2020-04-17,"Ikuti anggota direksi lain, empat direksi BCA lainnya juga ikut borong saham BBCA",Kontan,BBCA
205,2020-04-20,Ini Bonus yang Direksi dan Komisaris Bank BCA (BBCA) Peroleh atas Kinerja 2019,Kontan,BBCA
206,2020-04-20,"Aktivitas Dibatasi, BCA Finance Tutup Sementara Kantor Layanan di Mal Jakarta",Bisnis,BBCA
207,2020-04-22,Driver GoCar Dapat Keringanan Kredit dari BCA Finance,Bisnis,BBCA
208,2020-04-27,"Bantu Tangani Corona, Penyaluran CSR BCA Mencapai Rp12 Miliar",Bisnis,BBCA
209,2020-05-12,Karyawan BCA Galang Donasi Rp1 Miliar Lawan Covid-19,Bisnis,BBCA
210,2020-05-12,"BCA pangkas batas tarik tunai kartu kredit jadi 20% dari limit kartu, apa alasannya?",Kontan,BBCA
211,2020-05-12,BCA batasi penarikan tunai kartu kredit dari 50% jadi 20%,Kontan,BBCA
212,2020-05-12,Calon kuat bank jangkar cuma Himbara dan BCA?,Kontan,BBCA
213,2020-05-13,"Cek! Ini Bunga Deposito BRI, Bank Mandiri, BNI, BCA, dan CIMB Niaga",Bisnis,BBCA
214,2020-05-14,"Asyik, kartu debit BCA kini bisa dipakai buat belanja online",Kontan,BBCA
215,2020-05-15,"Kurs Jual Beli Dolar AS di Bank Mandiri dan BCA, 15 Mei 2020",Bisnis,BBCA
216,2020-05-22,"Bos BCA Jahja Setiaatmadja, Buah Jatuh Tak Jauh dari Pohonnya...",Bisnis,BBCA
217,2020-05-22,BCA punya fitur layanan digital BagiBagi untuk transfer THR,Kontan,BBCA
218,2020-05-27,Analisis Kinerja Bank BCA (BBCA) dan Potensi Sahamnya,Bisnis,BBCA
219,2020-05-27,BCA Resmi Ganti Nama Bank Royal Jadi Bank Digital BCA,CNBC Indonesia,BBCA
220,2020-05-28,"Peduli Masyarakat Terdampak Covid-19, Bank BCA Ikut Program KSBB",Bisnis,BBCA
221,2020-05-28,"Harga saham BBCA turun tipis (27/5), PER anjlok jauh dari Desember 2019",Kontan,BBCA
222,2020-05-28,Ini Alasan BCA Ganti Nama Bank Royal jadi Bank Digital BCA,CNBC Indonesia,BBCA
223,2020-05-28,"Royal Bank jadi Bank Digital BCA, Nama Rabobank jadi Apa?",CNBC Indonesia,BBCA
224,2020-05-28,"Bank Royal: dari Ciparay, Dibeli Djarum Jadi Bank Digital BCA",CNBC Indonesia,BBCA
225,2020-05-29,Kinerja Keuangan BCA Solid Dalam Merespons Ketidakpastian,CNBC Indonesia,BBCA
226,2020-06-06,"Komut BCA Lepas 800.000 Saham BBCA, Kantongi Rp 23 M",CNBC Indonesia,BBCA
227,2020-06-08,"Kartu Kredit Wajib PIN 1 Juli 2020, Ini Cara Aktivasi di Bank Mandiri dan BCA",Bisnis,BBCA
228,2020-06-08,"Suku Bunga Deposito: Bank Mandiri, BRI, dan BNI Tetap, BCA Pangkas Lagi",Bisnis,BBCA
229,2020-06-08,Presiden Komisaris Bank BCA Melego Saham BBCA Saat Harganya Rebound,Kontan,BBCA
230,2020-06-09,Akuisisi Perbankan: BCA Bakal Merger Rabobank dengan Anak Usaha,Bisnis,BBCA
231,2020-06-09,"Nilai Akuisisi Rabobank Melonjak, BCA Rogoh Rp 500 M",CNBC Indonesia,BBCA
232,2020-06-10,BCA & Bakti BCA Serahkan Donasi Rp1 Miliar,Bisnis,BBCA
233,2020-06-11,"IHSG Goyang! Saham Mandiri, BNI, BRI & BCA Terjun Bebas",CNBC Indonesia,BBCA
234,2020-06-11,Kisah BCA Pernah Dikuras Dananya Saat Krisis 1998,Bisnis,BBCA
235,2020-06-15,BCA Bakal Kembangkan Produk Pinjaman Online Lewat Bank Digital BCA,Bisnis,BBCA
236,2020-06-15,"Pandemi Covid-19 Belum Berakhir, Begini Strategi BCA",CNBC Indonesia,BBCA
237,2020-06-26,"Viral Video Nasabah Tak Bisa Cairkan Deposito BCA, Benarkah?",CNBC Indonesia,BBCA
238,2020-06-29,"Permintaan Kredit Lesu, Ini Strategi BCA Finance Tekan Biaya Operasional",Bisnis,BBCA
239,2020-07-06,BCA Kembali Raih Merek Paling Bernilai di Indonesia,Bisnis,BBCA
240,2020-07-10,"Direksi BCA kompak lepas saham, siapa saja?",Kontan,BBCA
241,2020-07-15,BCA Syariah buka kantor cabang di Makassar untuk jangkau wilayah Timur,Kontan,BBCA
242,2020-07-16,"BCA Punya Jurus Khusus Agar Kredit Bermasalah Tidak Melonjak, Apa Itu?",Bisnis,BBCA
243,2020-07-20,"IHSG Melemah, Asing Net Sell di Pasar Reguler, Jual BBRI Borong BBCA",Kontan,BBCA
244,2020-07-23,Bos BCA: Masih Ada 200 Ribu Nasabah Setia Pakai SMS Banking,CNBC Indonesia,BBCA
245,2020-07-27,"BCA Ada Hapus Buku Kredit pada Paruh Pertama, Seberapa Besar?",Bisnis,BBCA
246,2020-07-27,"BCA Cetak Laba Rp 12,2 T di Semester I, Turun 4,8%",CNBC Indonesia,BBCA
247,2020-07-27,"Pasca Akuisisi 2 Bank, Apakah BCA Bakal Berhenti Beli Bank?",CNBC Indonesia,BBCA
248,2020-07-28,"Catat Laba Rp 12,24 Triliun, Ini Rapor BCA Semester I/2020",CNBC Indonesia,BBCA
249,2020-08-07,"Sst...Ada Target Harga BCA, BRI & Mandiri dari Morgan Stanley",CNBC Indonesia,BBCA
250,2020-08-11,Wah! Debit BCA Kini Bisa Digunakan untuk Transaksi Online,Bisnis,BBCA
251,2020-08-24,"Market Cap BCA Menuju Rp 800 T, Kokoh Berada di Puncak",CNBC Indonesia,BBCA
252,2020-08-25,Bank Mandiri dan BCA Menjawab Kasus Kredit Proyek Fiktif Pertamina oleh PT MJPL,Kontan,BBCA
253,2020-08-31,"Apakah Saham BBCA Bisa Tembus Rp 35.000, Kapan?",CNBC Indonesia,BBCA
254,2020-09-03,Bos BCA Ungkap Bahaya Nomor Seluler yang tidak Aktif,CNBC Indonesia,BBCA
255,2020-09-03,"Disebut Mau Jadi Bank e-Commerce, Ini Penjelasan Bos BCA",CNBC Indonesia,BBCA
256,2020-09-03,"Perbankan Digital, Bos BCA Ungkap Tantangan yang Dihadapi BBCA",Bisnis,BBCA
257,2020-09-03,Bos BCA: Fintech Adalah Sahabat,CNBC Indonesia,BBCA
258,2020-09-04,"Mudah, Ini Cara Mendaftar BCA Internet Banking",CNBC Indonesia,BBCA
259,2020-09-04,Ini Taktik Jitu BCA Tingkatkan Pelayanan Konsumen,Bisnis,BBCA
260,2020-09-14,"IHSG Hari Ini Melompat 2,89%, Asing Borong BBRI, Lepas Saham BBCA dan ASII",Kontan,BBCA
261,2020-09-15,"Sejak Akhir Maret, Kekayaan Budi Hartono Naik Rp110 Triliun Berkat Saham BCA",Bisnis,BBCA
262,2020-09-22,"Disebut Terlibat Transaksi Janggal, Ini Kata BCA dan Bank Mandiri",Bisnis,BBCA
263,2020-09-24,"Rabobank Ganti Nama jadi Bank Interim Indonesia, Ini Respons BCA",Bisnis,BBCA
264,2020-09-29,"Digitalisasi Layanan, Bos BCA: Kami Gak Akan PHK Karyawan",CNBC Indonesia,BBCA
265,2020-09-30,BCA Kini Resmi Menggenggam Bank Interim,Bisnis,BBCA
266,2020-10-03,Bos BCA Ungkap Ancaman Besar yang Buat Bank Ditinggal Nasabah,CNBC Indonesia,BBCA
267,2020-10-07,"Bank Permata (BNLI) Naik Kasta! Sekelas BCA, BRI, BNI, & Bank Mandiri",Bisnis,BBCA
268,2020-10-11,Saham BCA (BBCA) Jadi Motor Utama Penguatan IHSG 5 Sesi Beruntun,Bisnis,BBCA
269,2020-10-12,BCA Tambah Dua Produk Reksa Dana dari Schroder,Bisnis,BBCA
270,2020-10-12,BCA dan CoffeeTalk Gencarkan Produk Kopi Organik,Bisnis,BBCA
271,2020-10-13,Peluang BCA Syariah di Tengah Kompetisi Merger Bank BUMN Syariah,Bisnis,BBCA
272,2020-10-13,"Bank Syariah BUMN Dimerger, BCA Syariah Siap Stock Split",CNBC Indonesia,BBCA
273,2020-10-13,"Kurs dollar-rupiah di BCA hari ini Selasa 13 Oktober, simak sebelum tukar valas",Kontan,BBCA
274,2020-10-17,Bank Ikut Libur Saat Cuti Bersama? Ini Jawaban BCA,CNBC Indonesia,BBCA
275,2020-10-20,Cara bayar iuran BPJS Ketenagakerjaan melalui KlikBCA dan ATM BCA,Kontan,BBCA
276,2020-10-24,"Bos BCA : 10 Tahun Lagi, Bankir Harus Siap dengan Kemajuan Teknologi",Bisnis,BBCA
277,2020-10-25,Ingat Ya! Ini Jadwal Operasional Kantor BCA di Libur Panjang Akhir Oktober,Bisnis,BBCA
278,2020-10-26,Respons BCA Soal Gugatan Deposito Nasabah yang Hilang,CNBC Indonesia,BBCA
279,2020-10-26,"BCA Digugat, Nasabah Klaim Deposito Hangus",Bisnis,BBCA
280,2020-10-26,Bos BCA Sebut Layanan Digital Masa Depan Industri Bank,CNBC Indonesia,BBCA
281,2020-10-28,"Long Weekend, Layanan BRI, Mandiri, BTN & BCA Tetap Buka",CNBC Indonesia,BBCA
282,2020-10-30,"Pencadangan Terus Naik dan Tekan Laba. Ini Proyeksi Bank Mandiri, BNI, dan BCA",Bisnis,BBCA
283,2020-10-31,Awas Ketipu Modus Busuk Penipuan Pakai OneKlik BCA!,CNBC Indonesia,BBCA
284,2020-11-10,BCA Sebut Kenaikan Jumlah Pengguna Kerek Transaksi Kartu Flazz,Bisnis,BBCA
285,2020-11-12,"BBCA jadi bank dengan laba terbesar kuartal III 2020, kalahkan dua bank pemerintah",Kontan,BBCA
286,2020-11-16,Menghitung Cuan Saham BBCA dari Tabungan Winda Earl,Bisnis,BBCA
287,2020-11-16,"Mari Cek Bunga Deposito di Mandiri, BNI, dan BCA. Siapa Tertinggi?",Bisnis,BBCA
288,2020-11-17,"IHSG Menguat di Sesi I, Asing Borong Saham TLKM dan BBCA",Kontan,BBCA
289,2020-11-18,"Lagi, Nama Bank BCA & Mandiri Disebut Saksi OJK pada Kredit Proyek Fiktif Pertamina",Kontan,BBCA
