title,description,published date,url,publisher,keywords,content
Akhmad Lafranta Siregar Dikukuhkan Sebagai Ketum Forum Lima Perguruan Silat Pahlawan Beksi - Investor.ID,Akhmad Lafranta Siregar Dikukuhkan Sebagai Ketum Forum Lima Perguruan Silat Pahlawan Beksi  Investor.ID,2022-03-28,https://news.google.com/rss/articles/CBMif2h0dHBzOi8vaW52ZXN0b3IuaWQvbGlmZXN0eWxlLzI4ODU3Mi9ha2htYWQtbGFmcmFudGEtc2lyZWdhci1kaWt1a3Voa2FuLXNlYmFnYWkta2V0dW0tZm9ydW0tbGltYS1wZXJndXJ1YW4tc2lsYXQtcGFobGF3YW4tYmVrc2nSAQA?oc=5&hl=en-ID&gl=ID&ceid=ID:en,"{'href': 'https://investor.id', 'title': 'Investor.ID'}",Missing,Missing
"BTPN Syariah (BTPS) Gencar Biayai Usaha Ibu-ibu, Tanpa Jaminan Bund! - Investor.ID","BTPN Syariah (BTPS) Gencar Biayai Usaha Ibu-ibu, Tanpa Jaminan Bund!  Investor.ID",2022-03-27,https://news.google.com/rss/articles/CBMiYmh0dHBzOi8vaW52ZXN0b3IuaWQvZmluYW5jZS8yODg0MTMvYnRwbi1zeWFyaWFoLWJ0cHMtZ2VuY2FyLWJpYXlhaS11c2FoYS1pYnVpYnUtdGFucGEtamFtaW5hbi1idW5k0gEA?oc=5&hl=en-ID&gl=ID&ceid=ID:en,"{'href': 'https://investor.id', 'title': 'Investor.ID'}",Missing,Missing
"Selamatkan Pertamina,Amankan Distribusi BBM - Investor.ID","Selamatkan Pertamina,Amankan Distribusi BBM  Investor.ID",2022-03-22,https://news.google.com/rss/articles/CBMiT2h0dHBzOi8vaW52ZXN0b3IuaWQvZWRpdG9yaWFsLzI4NzU3NS9zZWxhbWF0a2FuLXBlcnRhbWluYWFtYW5rYW4tZGlzdHJpYnVzaS1iYm3SAQA?oc=5&hl=en-ID&gl=ID&ceid=ID:en,"{'href': 'https://investor.id', 'title': 'Investor.ID'}",Missing,Missing
Tren dan Prospek Apartemen Mewah di Jantung Kota Bandung - Investor.ID,Tren dan Prospek Apartemen Mewah di Jantung Kota Bandung  Investor.ID,2022-03-18,https://news.google.com/rss/articles/CBMiXGh0dHBzOi8vaW52ZXN0b3IuaWQvYnVzaW5lc3MvMjg3MTE0L3RyZW4tZGFuLXByb3NwZWstYXBhcnRlbWVuLW1ld2FoLWRpLWphbnR1bmcta290YS1iYW5kdW5n0gEA?oc=5&hl=en-ID&gl=ID&ceid=ID:en,"{'href': 'https://investor.id', 'title': 'Investor.ID'}",Missing,Missing
SWI: Penawaran Investasi Via Grup Telegram Pasti Ilegal - Investor.ID,SWI: Penawaran Investasi Via Grup Telegram Pasti Ilegal  Investor.ID,2022-03-16,https://news.google.com/rss/articles/CBMiWWh0dHBzOi8vaW52ZXN0b3IuaWQvZmluYW5jZS8yODY4OTcvc3dpLXBlbmF3YXJhbi1pbnZlc3Rhc2ktdmlhLWdydXAtdGVsZWdyYW0tcGFzdGktaWxlZ2Fs0gEA?oc=5&hl=en-ID&gl=ID&ceid=ID:en,"{'href': 'https://investor.id', 'title': 'Investor.ID'}",Missing,Missing
"GoTo Blak-blakan Faktor Risiko, Selalu Rugi dan Tak akan Bukukan Laba? - Investor.ID","GoTo Blak-blakan Faktor Risiko, Selalu Rugi dan Tak akan Bukukan Laba?  Investor.ID",2022-03-16,https://news.google.com/rss/articles/CBMic2h0dHBzOi8vaW52ZXN0b3IuaWQvbWFya2V0LWFuZC1jb3Jwb3JhdGUvMjg2Nzk4L2dvdG8tYmxha2JsYWthbi1mYWt0b3ItcmlzaWtvLXNlbGFsdS1ydWdpLWRhbi10YWstYWthbi1idWt1a2FuLWxhYmHSAQA?oc=5&hl=en-ID&gl=ID&ceid=ID:en,"{'href': 'https://investor.id', 'title': 'Investor.ID'}",Missing,Missing
IPO Saham GoTo Menjadi Game Changer Market Cap dan Perhitungan IHSG - Investor.ID,IPO Saham GoTo Menjadi Game Changer Market Cap dan Perhitungan IHSG  Investor.ID,2022-03-16,https://news.google.com/rss/articles/CBMic2h0dHBzOi8vaW52ZXN0b3IuaWQvbWFya2V0LWFuZC1jb3Jwb3JhdGUvMjg2ODIzL2lwby1zYWhhbS1nb3RvLW1lbmphZGktZ2FtZS1jaGFuZ2VyLW1hcmtldC1jYXAtZGFuLXBlcmhpdHVuZ2FuLWloc2fSAQA?oc=5&hl=en-ID&gl=ID&ceid=ID:en,"{'href': 'https://investor.id', 'title': 'Investor.ID'}",Missing,Missing
11 Perusahaan Telah Melantai Sepanjang 2022 - Investor.ID,11 Perusahaan Telah Melantai Sepanjang 2022  Investor.ID,2022-03-12,https://news.google.com/rss/articles/CBMiW2h0dHBzOi8vaW52ZXN0b3IuaWQvbWFya2V0LWFuZC1jb3Jwb3JhdGUvMjg2Mjc1LzExLXBlcnVzYWhhYW4tdGVsYWgtbWVsYW50YWktc2VwYW5qYW5nLTIwMjLSAQA?oc=5&hl=en-ID&gl=ID&ceid=ID:en,"{'href': 'https://investor.id', 'title': 'Investor.ID'}",Missing,Missing
Phintraco Sekuritas: IHSG Bakal Uji Resistance di 6.930. Cermati Saham Consumer! - Investor.ID,Phintraco Sekuritas: IHSG Bakal Uji Resistance di 6.930. Cermati Saham Consumer!  Investor.ID,2022-03-11,https://news.google.com/rss/articles/CBMifGh0dHBzOi8vaW52ZXN0b3IuaWQvbWFya2V0LWFuZC1jb3Jwb3JhdGUvMjg2MDk4L3BoaW50cmFjby1zZWt1cml0YXMtaWhzZy1iYWthbC11amktcmVzaXN0YW5jZS1kaS02OTMwLWNlcm1hdGktc2FoYW0tY29uc3VtZXLSAQA?oc=5&hl=en-ID&gl=ID&ceid=ID:en,"{'href': 'https://investor.id', 'title': 'Investor.ID'}",Missing,Missing
Safran Edi Harianto Pimpin Apersi Banten Sampai 2025 - Investor.ID,Safran Edi Harianto Pimpin Apersi Banten Sampai 2025  Investor.ID,2022-03-11,https://news.google.com/rss/articles/CBMiWGh0dHBzOi8vaW52ZXN0b3IuaWQvYnVzaW5lc3MvMjg2MTQ3L3NhZnJhbi1lZGktaGFyaWFudG8tcGltcGluLWFwZXJzaS1iYW50ZW4tc2FtcGFpLTIwMjXSAQA?oc=5&hl=en-ID&gl=ID&ceid=ID:en,"{'href': 'https://investor.id', 'title': 'Investor.ID'}",Missing,Missing
"Berlaku Mulai Hari Ini, 477 Saham Masuk Indeks Syariah - Investor.ID","Berlaku Mulai Hari Ini, 477 Saham Masuk Indeks Syariah  Investor.ID",2022-03-10,https://news.google.com/rss/articles/CBMiZWh0dHBzOi8vaW52ZXN0b3IuaWQvbWFya2V0LWFuZC1jb3Jwb3JhdGUvMjg1OTU2L2Jlcmxha3UtbXVsYWktaGFyaS1pbmktNDc3LXNhaGFtLW1hc3VrLWluZGVrcy1zeWFyaWFo0gEA?oc=5&hl=en-ID&gl=ID&ceid=ID:en,"{'href': 'https://investor.id', 'title': 'Investor.ID'}",Missing,Missing
Harga Saham Bukalapak (BUKA) Saat Ini Tak Masuk Akal - Investor.ID,Harga Saham Bukalapak (BUKA) Saat Ini Tak Masuk Akal  Investor.ID,2022-03-09,https://news.google.com/rss/articles/CBMiYmh0dHBzOi8vaW52ZXN0b3IuaWQvbWFya2V0LWFuZC1jb3Jwb3JhdGUvMjg1ODc2L2hhcmdhLXNhaGFtLWJ1a2FsYXBhay1idWthLXNhYXQtaW5pLXRhay1tYXN1ay1ha2Fs0gEA?oc=5&hl=en-ID&gl=ID&ceid=ID:en,"{'href': 'https://investor.id', 'title': 'Investor.ID'}",Missing,Missing
Jangan Lupa! Berikut Jadwal Pembagian Dividen BRI (BBRI) - Investor.ID,Jangan Lupa! Berikut Jadwal Pembagian Dividen BRI (BBRI)  Investor.ID,2022-03-06,https://news.google.com/rss/articles/CBMiZWh0dHBzOi8vaW52ZXN0b3IuaWQvbWFya2V0LWFuZC1jb3Jwb3JhdGUvMjg1Mzk0L2phbmdhbi1sdXBhLWJlcmlrdXQtamFkd2FsLXBlbWJhZ2lhbi1kaXZpZGVuLWJyaS1iYnJp0gEA?oc=5&hl=en-ID&gl=ID&ceid=ID:en,"{'href': 'https://investor.id', 'title': 'Investor.ID'}",Missing,Missing
Desain IKN Berkonsep Kota Pintar Terintegrasi - Investor.ID,Desain IKN Berkonsep Kota Pintar Terintegrasi  Investor.ID,2022-03-04,https://news.google.com/rss/articles/CBMiUWh0dHBzOi8vaW52ZXN0b3IuaWQvYnVzaW5lc3MvMjg1MjUxL2Rlc2Fpbi1pa24tYmVya29uc2VwLWtvdGEtcGludGFyLXRlcmludGVncmFzadIBAA?oc=5&hl=en-ID&gl=ID&ceid=ID:en,"{'href': 'https://investor.id', 'title': 'Investor.ID'}",Missing,Missing
"Rekor Baru Rp 701 Triliun, Market Cap BRI Bertambah Rp 63,67 Triliun - Investor.ID","Rekor Baru Rp 701 Triliun, Market Cap BRI Bertambah Rp 63,67 Triliun  Investor.ID",2022-03-01,https://news.google.com/rss/articles/CBMicmh0dHBzOi8vaW52ZXN0b3IuaWQvbWFya2V0LWFuZC1jb3Jwb3JhdGUvMjg0Nzc2L3Jla29yLWJhcnUtcnAtNzAxLXRyaWxpdW4tbWFya2V0LWNhcC1icmktYmVydGFtYmFoLXJwLTYzNjctdHJpbGl1btIBAA?oc=5&hl=en-ID&gl=ID&ceid=ID:en,"{'href': 'https://investor.id', 'title': 'Investor.ID'}",Missing,Missing
"Terbaru, Barisan Elite Emiten dengan Market Cap di Atas Rp 100 Triliun - Investor.ID","Terbaru, Barisan Elite Emiten dengan Market Cap di Atas Rp 100 Triliun  Investor.ID",2022-02-28,https://news.google.com/rss/articles/CBMidWh0dHBzOi8vaW52ZXN0b3IuaWQvbWFya2V0LWFuZC1jb3Jwb3JhdGUvMjg0NjE4L3RlcmJhcnUtYmFyaXNhbi1lbGl0ZS1lbWl0ZW4tZGVuZ2FuLW1hcmtldC1jYXAtZGktYXRhcy1ycC0xMDAtdHJpbGl1btIBAA?oc=5&hl=en-ID&gl=ID&ceid=ID:en,"{'href': 'https://investor.id', 'title': 'Investor.ID'}",Missing,Missing
"Motor Listrik sudah, Kini WIKA akan Ikut Kelola Bandara Hang Nadim, Segera Setor Modal - Investor.ID","Motor Listrik sudah, Kini WIKA akan Ikut Kelola Bandara Hang Nadim, Segera Setor Modal  Investor.ID",2022-02-24,https://news.google.com/rss/articles/CBMihAFodHRwczovL2ludmVzdG9yLmlkL21hcmtldC1hbmQtY29ycG9yYXRlLzI4NDExMi9tb3Rvci1saXN0cmlrLXN1ZGFoLWtpbmktd2lrYS1ha2FuLWlrdXQta2Vsb2xhLWJhbmRhcmEtaGFuZy1uYWRpbS1zZWdlcmEtc2V0b3ItbW9kYWzSAQA?oc=5&hl=en-ID&gl=ID&ceid=ID:en,"{'href': 'https://investor.id', 'title': 'Investor.ID'}",Missing,Missing
Wijaya Karya (WIKA) Biayai Jalan Tol Semarang-Demak - Investor.ID,Wijaya Karya (WIKA) Biayai Jalan Tol Semarang-Demak  Investor.ID,2022-02-20,https://news.google.com/rss/articles/CBMiYGh0dHBzOi8vaW52ZXN0b3IuaWQvbWFya2V0LWFuZC1jb3Jwb3JhdGUvMjgzNDY4L3dpamF5YS1rYXJ5YS13aWthLWJpYXlhaS1qYWxhbi10b2wtc2VtYXJhbmdkZW1ha9IBAA?oc=5&hl=en-ID&gl=ID&ceid=ID:en,"{'href': 'https://investor.id', 'title': 'Investor.ID'}",Missing,Missing
Industri Substitusi Ekspor - Investor.ID,Industri Substitusi Ekspor  Investor.ID,2022-02-18,https://news.google.com/rss/articles/CBMiO2h0dHBzOi8vaW52ZXN0b3IuaWQvb3BpbmkvMjgzMzA4L2luZHVzdHJpLXN1YnN0aXR1c2ktZWtzcG9y0gEA?oc=5&hl=en-ID&gl=ID&ceid=ID:en,"{'href': 'https://investor.id', 'title': 'Investor.ID'}",Missing,Missing
Pembangunan Rumah Rakyat Tingkatkan Ekonomi Nasional - Investor.ID,Pembangunan Rumah Rakyat Tingkatkan Ekonomi Nasional  Investor.ID,2022-02-16,https://news.google.com/rss/articles/CBMiWGh0dHBzOi8vaW52ZXN0b3IuaWQvYnVzaW5lc3MvMjgyOTI1L3BlbWJhbmd1bmFuLXJ1bWFoLXJha3lhdC10aW5na2F0a2FuLWVrb25vbWktbmFzaW9uYWzSAQA?oc=5&hl=en-ID&gl=ID&ceid=ID:en,"{'href': 'https://investor.id', 'title': 'Investor.ID'}",Missing,Missing
"Buka Kantor Cabangdi Jakarta, Didimax Gelontorkan Investasi Rp 100 Miliar - Investor.ID","Buka Kantor Cabangdi Jakarta, Didimax Gelontorkan Investasi Rp 100 Miliar  Investor.ID",2022-02-12,https://news.google.com/rss/articles/CBMieGh0dHBzOi8vaW52ZXN0b3IuaWQvbWFya2V0LWFuZC1jb3Jwb3JhdGUvMjgyMzgxL2J1a2Eta2FudG9yLWNhYmFuZ2RpLWpha2FydGEtZGlkaW1heC1nZWxvbnRvcmthbi1pbnZlc3Rhc2ktcnAtMTAwLW1pbGlhctIBAA?oc=5&hl=en-ID&gl=ID&ceid=ID:en,"{'href': 'https://investor.id', 'title': 'Investor.ID'}",Missing,Missing
Bank Permata dan Batavia Luncurkan Reksa Dana Syariah Teknologi - Investor.ID,Bank Permata dan Batavia Luncurkan Reksa Dana Syariah Teknologi  Investor.ID,2022-02-09,https://news.google.com/rss/articles/CBMib2h0dHBzOi8vaW52ZXN0b3IuaWQvbWFya2V0LWFuZC1jb3Jwb3JhdGUvMjgyMDA1L2JhbmstcGVybWF0YS1kYW4tYmF0YXZpYS1sdW5jdXJrYW4tcmVrc2EtZGFuYS1zeWFyaWFoLXRla25vbG9nadIBAA?oc=5&hl=en-ID&gl=ID&ceid=ID:en,"{'href': 'https://investor.id', 'title': 'Investor.ID'}",Missing,Missing
Wijaya Karya (WIKA) Rombak Jajaran Direksi - Investor.ID,Wijaya Karya (WIKA) Rombak Jajaran Direksi  Investor.ID,2022-02-04,https://news.google.com/rss/articles/CBMiWGh0dHBzOi8vaW52ZXN0b3IuaWQvbWFya2V0LWFuZC1jb3Jwb3JhdGUvMjgxMzA5L3dpamF5YS1rYXJ5YS13aWthLXJvbWJhay1qYWphcmFuLWRpcmVrc2nSAQA?oc=5&hl=en-ID&gl=ID&ceid=ID:en,"{'href': 'https://investor.id', 'title': 'Investor.ID'}",Missing,Missing
Pasar Menunggu IPO GoTo - Investor.ID,Pasar Menunggu IPO GoTo  Investor.ID,2022-02-04,https://news.google.com/rss/articles/CBMiR2h0dHBzOi8vaW52ZXN0b3IuaWQvbWFya2V0LWFuZC1jb3Jwb3JhdGUvMjgxMjg3L3Bhc2FyLW1lbnVuZ2d1LWlwby1nb3Rv0gEA?oc=5&hl=en-ID&gl=ID&ceid=ID:en,"{'href': 'https://investor.id', 'title': 'Investor.ID'}",Missing,Missing
Prospek Positif Kinerja PGN - Investor.ID,Prospek Positif Kinerja PGN  Investor.ID,2022-02-02,https://news.google.com/rss/articles/CBMiS2h0dHBzOi8vaW52ZXN0b3IuaWQvbWFya2V0LWFuZC1jb3Jwb3JhdGUvMjgwOTcxL3Byb3NwZWstcG9zaXRpZi1raW5lcmphLXBnbtIBAA?oc=5&hl=en-ID&gl=ID&ceid=ID:en,"{'href': 'https://investor.id', 'title': 'Investor.ID'}",Missing,Missing
Prospek Positif Kinerja PGN - Investor.ID,Prospek Positif Kinerja PGN  Investor.ID,2022-02-02,https://news.google.com/rss/articles/CBMiS2h0dHBzOi8vaW52ZXN0b3IuaWQvbWFya2V0LWFuZC1jb3Jwb3JhdGUvMjgwOTcxL3Byb3NwZWstcG9zaXRpZi1raW5lcmphLXBnbtIBAA?oc=5&hl=en-ID&gl=ID&ceid=ID:en,"{'href': 'https://investor.id', 'title': 'Investor.ID'}",Missing,Missing
"Pak Erick, Hanya 5 BUMN yang Sahamnya Positif, Sisanya Nyungsep - Investor.ID","Pak Erick, Hanya 5 BUMN yang Sahamnya Positif, Sisanya Nyungsep  Investor.ID",2022-02-01,https://news.google.com/rss/articles/CBMibWh0dHBzOi8vaW52ZXN0b3IuaWQvbWFya2V0LWFuZC1jb3Jwb3JhdGUvMjgwODQ1L3Bhay1lcmljay1oYW55YS01LWJ1bW4teWFuZy1zYWhhbW55YS1wb3NpdGlmLXNpc2FueWEtbnl1bmdzZXDSAQA?oc=5&hl=en-ID&gl=ID&ceid=ID:en,"{'href': 'https://investor.id', 'title': 'Investor.ID'}",Missing,Missing
Rutin Cek Prostat Tingkatkan Harapan Hidup Laki-Laki - Investor.ID,Rutin Cek Prostat Tingkatkan Harapan Hidup Laki-Laki  Investor.ID,2022-01-28,https://news.google.com/rss/articles/CBMiWGh0dHBzOi8vaW52ZXN0b3IuaWQvbGlmZXN0eWxlLzI4MDM2My9ydXRpbi1jZWstcHJvc3RhdC10aW5na2F0a2FuLWhhcmFwYW4taGlkdXAtbGFraWxha2nSAQA?oc=5&hl=en-ID&gl=ID&ceid=ID:en,"{'href': 'https://investor.id', 'title': 'Investor.ID'}",Missing,Missing
"Emtek dan Waskita Masuk IDX30, Gudang Garam dan HM Sampoerna Tersingkir - Investor.ID","Emtek dan Waskita Masuk IDX30, Gudang Garam dan HM Sampoerna Tersingkir  Investor.ID",2022-01-25,https://news.google.com/rss/articles/CBMidmh0dHBzOi8vaW52ZXN0b3IuaWQvbWFya2V0LWFuZC1jb3Jwb3JhdGUvMjc5OTM5L2VtdGVrLWRhbi13YXNraXRhLW1hc3VrLWlkeDMwLWd1ZGFuZy1nYXJhbS1kYW4taG0tc2FtcG9lcm5hLXRlcnNpbmdraXLSAQA?oc=5&hl=en-ID&gl=ID&ceid=ID:en,"{'href': 'https://investor.id', 'title': 'Investor.ID'}",Missing,Missing
Terbaru! Lima Saham yang Masuk dan Keluar LQ45 - Investor.ID,Terbaru! Lima Saham yang Masuk dan Keluar LQ45  Investor.ID,2022-01-25,https://news.google.com/rss/articles/CBMiXWh0dHBzOi8vaW52ZXN0b3IuaWQvbWFya2V0LWFuZC1jb3Jwb3JhdGUvMjc5OTQyL3RlcmJhcnUtbGltYS1zYWhhbS15YW5nLW1hc3VrLWRhbi1rZWx1YXItbHE0NdIBAA?oc=5&hl=en-ID&gl=ID&ceid=ID:en,"{'href': 'https://investor.id', 'title': 'Investor.ID'}",Missing,Missing
BNI bakal Sulap Bank Mayora Jadi Bank Digital UMKM - Investor.ID,BNI bakal Sulap Bank Mayora Jadi Bank Digital UMKM  Investor.ID,2022-01-24,https://news.google.com/rss/articles/CBMiYmh0dHBzOi8vaW52ZXN0b3IuaWQvbWFya2V0LWFuZC1jb3Jwb3JhdGUvMjc5NjgyL2JuaS1iYWthbC1zdWxhcC1iYW5rLW1heW9yYS1qYWRpLWJhbmstZGlnaXRhbC11bWtt0gEA?oc=5&hl=en-ID&gl=ID&ceid=ID:en,"{'href': 'https://investor.id', 'title': 'Investor.ID'}",Missing,Missing
"Hadir di Forum NLG, Nucleus Farma Paparkan Khasiat Onogra - Investor.ID","Hadir di Forum NLG, Nucleus Farma Paparkan Khasiat Onogra  Investor.ID",2022-01-23,https://news.google.com/rss/articles/CBMiXWh0dHBzOi8vaW52ZXN0b3IuaWQvbGlmZXN0eWxlLzI3OTU2NC9oYWRpci1kaS1mb3J1bS1ubGctbnVjbGV1cy1mYXJtYS1wYXBhcmthbi1raGFzaWF0LW9ub2dyYdIBAA?oc=5&hl=en-ID&gl=ID&ceid=ID:en,"{'href': 'https://investor.id', 'title': 'Investor.ID'}",Missing,Missing
PGN Siap Gasifikasi 33 PLTD di Indonesia Timur - Investor.ID,PGN Siap Gasifikasi 33 PLTD di Indonesia Timur  Investor.ID,2022-01-19,https://news.google.com/rss/articles/CBMiUmh0dHBzOi8vaW52ZXN0b3IuaWQvYnVzaW5lc3MvMjc4OTU0L3Bnbi1zaWFwLWdhc2lmaWthc2ktMzMtcGx0ZC1kaS1pbmRvbmVzaWEtdGltdXLSAQA?oc=5&hl=en-ID&gl=ID&ceid=ID:en,"{'href': 'https://investor.id', 'title': 'Investor.ID'}",Missing,Missing
"Bank Rakyat Indonesia (BBRI) dan Telkom Indonesia (TLKM) Diuntungkan karena Akselerasi Digital, Ini Target ... - Investor.ID","Bank Rakyat Indonesia (BBRI) dan Telkom Indonesia (TLKM) Diuntungkan karena Akselerasi Digital, Ini Target ...  Investor.ID",2022-01-19,https://news.google.com/rss/articles/CBMingFodHRwczovL2ludmVzdG9yLmlkL21hcmtldC1hbmQtY29ycG9yYXRlLzI3ODk3OC9iYW5rLXJha3lhdC1pbmRvbmVzaWEtYmJyaS1kYW4tdGVsa29tLWluZG9uZXNpYS10bGttLWRpdW50dW5na2FuLWthcmVuYS1ha3NlbGVyYXNpLWRpZ2l0YWwtaW5pLXRhcmdldC1oYXJnYW55YdIBAA?oc=5&hl=en-ID&gl=ID&ceid=ID:en,"{'href': 'https://investor.id', 'title': 'Investor.ID'}",Missing,Missing
"Altcoin Season, Ini Pengertian dan Cara Mengetahuinya - Investor.ID","Altcoin Season, Ini Pengertian dan Cara Mengetahuinya  Investor.ID",2022-01-18,https://news.google.com/rss/articles/CBMiWWh0dHBzOi8vaW52ZXN0b3IuaWQvaW52ZXN0b3J5LzI3ODc2Mi9hbHRjb2luLXNlYXNvbi1pbmktcGVuZ2VydGlhbi1kYW4tY2FyYS1tZW5nZXRhaHVpbnlh0gEA?oc=5&hl=en-ID&gl=ID&ceid=ID:en,"{'href': 'https://investor.id', 'title': 'Investor.ID'}",Missing,Missing
"Resmi Ganti Nama, Stockbit Sekuritas Siap Jadi Platform Trading Terdepan - Investor.ID","Resmi Ganti Nama, Stockbit Sekuritas Siap Jadi Platform Trading Terdepan  Investor.ID",2022-01-17,https://news.google.com/rss/articles/CBMiamh0dHBzOi8vaW52ZXN0b3IuaWQvZmluYW5jZS8yNzg2NjkvcmVzbWktZ2FudGktbmFtYS1zdG9ja2JpdC1zZWt1cml0YXMtc2lhcC1qYWRpLXBsYXRmb3JtLXRyYWRpbmctdGVyZGVwYW7SAQA?oc=5&hl=en-ID&gl=ID&ceid=ID:en,"{'href': 'https://investor.id', 'title': 'Investor.ID'}",Missing,Missing
"Dipimpin Ethereum (ETH), Hati-Hati Harga 5 Koin Teratas Ini Kompak Terjun Bebas - Investor.ID","Dipimpin Ethereum (ETH), Hati-Hati Harga 5 Koin Teratas Ini Kompak Terjun Bebas  Investor.ID",2022-01-14,https://news.google.com/rss/articles/CBMie2h0dHBzOi8vaW52ZXN0b3IuaWQvbWFya2V0LWFuZC1jb3Jwb3JhdGUvMjc4MjY5L2RpcGltcGluLWV0aGVyZXVtLWV0aC1oYXRpaGF0aS1oYXJnYS01LWtvaW4tdGVyYXRhcy1pbmkta29tcGFrLXRlcmp1bi1iZWJhc9IBAA?oc=5&hl=en-ID&gl=ID&ceid=ID:en,"{'href': 'https://investor.id', 'title': 'Investor.ID'}",Missing,Missing
"Pengguna BRImo Mencapai 14,15 Juta User per November 2021 - Investor.ID","Pengguna BRImo Mencapai 14,15 Juta User per November 2021  Investor.ID",2022-01-11,https://news.google.com/rss/articles/CBMiW2h0dHBzOi8vaW52ZXN0b3IuaWQvZmluYW5jZS8yNzc4ODgvcGVuZ2d1bmEtYnJpbW8tbWVuY2FwYWktMTQxNS1qdXRhLXVzZXItcGVyLW5vdmVtYmVyLTIwMjHSAQA?oc=5&hl=en-ID&gl=ID&ceid=ID:en,"{'href': 'https://investor.id', 'title': 'Investor.ID'}",Missing,Missing
BRI Siap Berlari dengan Mesin Pertumbuhan Baru - Investor.ID,BRI Siap Berlari dengan Mesin Pertumbuhan Baru  Investor.ID,2022-01-07,https://news.google.com/rss/articles/CBMiXmh0dHBzOi8vaW52ZXN0b3IuaWQvbWFya2V0LWFuZC1jb3Jwb3JhdGUvMjc3MzQ1L2JyaS1zaWFwLWJlcmxhcmktZGVuZ2FuLW1lc2luLXBlcnR1bWJ1aGFuLWJhcnXSAQA?oc=5&hl=en-ID&gl=ID&ceid=ID:en,"{'href': 'https://investor.id', 'title': 'Investor.ID'}",Missing,Missing
"Nasabah Jadi Tersangka, BRI Hormati Proses Hukum - Investor.ID","Nasabah Jadi Tersangka, BRI Hormati Proses Hukum  Investor.ID",2022-01-06,https://news.google.com/rss/articles/CBMiUmh0dHBzOi8vaW52ZXN0b3IuaWQvZmluYW5jZS8yNzcxOTUvbmFzYWJhaC1qYWRpLXRlcnNhbmdrYS1icmktaG9ybWF0aS1wcm9zZXMtaHVrdW3SAQA?oc=5&hl=en-ID&gl=ID&ceid=ID:en,"{'href': 'https://investor.id', 'title': 'Investor.ID'}",Missing,Missing
"Siapkan Rp 500 M, Una Brands Bawa Brand Lokal ke Kancah Internasional - Investor.ID","Siapkan Rp 500 M, Una Brands Bawa Brand Lokal ke Kancah Internasional  Investor.ID",2022-01-02,https://news.google.com/rss/articles/CBMiaGh0dHBzOi8vaW52ZXN0b3IuaWQvYnVzaW5lc3MvMjc2NjYwL3NpYXBrYW4tcnAtNTAwLW0tdW5hLWJyYW5kcy1iYXdhLWJyYW5kLWxva2FsLWtlLWthbmNhaC1pbnRlcm5hc2lvbmFs0gEA?oc=5&hl=en-ID&gl=ID&ceid=ID:en,"{'href': 'https://investor.id', 'title': 'Investor.ID'}",Missing,Missing
Bumame Farmasi Beri Trauma Healing dan Bantuan Langsung bagi Korban Semeru - Investor.ID,Bumame Farmasi Beri Trauma Healing dan Bantuan Langsung bagi Korban Semeru  Investor.ID,2021-12-31,https://news.google.com/rss/articles/CBMib2h0dHBzOi8vaW52ZXN0b3IuaWQvbGlmZXN0eWxlLzI3NjU0Ny9idW1hbWUtZmFybWFzaS1iZXJpLXRyYXVtYS1oZWFsaW5nLWRhbi1iYW50dWFuLWxhbmdzdW5nLWJhZ2kta29yYmFuLXNlbWVyddIBAA?oc=5&hl=en-ID&gl=ID&ceid=ID:en,"{'href': 'https://investor.id', 'title': 'Investor.ID'}",Missing,Missing
Somethinc Dampingi Reseller Memperkuat Kepercayaan Konsumen - Investor.ID,Somethinc Dampingi Reseller Memperkuat Kepercayaan Konsumen  Investor.ID,2021-12-28,https://news.google.com/rss/articles/CBMiYGh0dHBzOi8vaW52ZXN0b3IuaWQvbGlmZXN0eWxlLzI3NjExNC9zb21ldGhpbmMtZGFtcGluZ2ktcmVzZWxsZXItbWVtcGVya3VhdC1rZXBlcmNheWFhbi1rb25zdW1lbtIBAA?oc=5&hl=en-ID&gl=ID&ceid=ID:en,"{'href': 'https://investor.id', 'title': 'Investor.ID'}",Missing,Missing
"Supermal Karawaci Milik David Salim Masuk PKPU, Sidang 21 Desember - Investor.ID","Supermal Karawaci Milik David Salim Masuk PKPU, Sidang 21 Desember  Investor.ID",2021-12-13,https://news.google.com/rss/articles/CBMiZWh0dHBzOi8vaW52ZXN0b3IuaWQvbmF0aW9uYWwvMjc0Mzg5L3N1cGVybWFsLWthcmF3YWNpLW1pbGlrLWRhdmlkLXNhbGltLW1hc3VrLXBrcHUtc2lkYW5nLTIxLWRlc2VtYmVy0gEA?oc=5&hl=en-ID&gl=ID&ceid=ID:en,"{'href': 'https://investor.id', 'title': 'Investor.ID'}",Missing,Missing
Fundraising di Pasar Modal Menuju Rp 350 Triliun - Investor.ID,Fundraising di Pasar Modal Menuju Rp 350 Triliun  Investor.ID,2021-12-10,https://news.google.com/rss/articles/CBMiYGh0dHBzOi8vaW52ZXN0b3IuaWQvbWFya2V0LWFuZC1jb3Jwb3JhdGUvMjc0MDU3L2Z1bmRyYWlzaW5nLWRpLXBhc2FyLW1vZGFsLW1lbnVqdS1ycC0zNTAtdHJpbGl1btIBAA?oc=5&hl=en-ID&gl=ID&ceid=ID:en,"{'href': 'https://investor.id', 'title': 'Investor.ID'}",Missing,Missing
Kuatnya Pertumbuhan Kinerja PGN - Investor.ID,Kuatnya Pertumbuhan Kinerja PGN  Investor.ID,2021-12-07,https://news.google.com/rss/articles/CBMiT2h0dHBzOi8vaW52ZXN0b3IuaWQvbWFya2V0LWFuZC1jb3Jwb3JhdGUvMjczNjA5L2t1YXRueWEtcGVydHVtYnVoYW4ta2luZXJqYS1wZ27SAQA?oc=5&hl=en-ID&gl=ID&ceid=ID:en,"{'href': 'https://investor.id', 'title': 'Investor.ID'}",Missing,Missing
Erajaya Tumbuh Melampaui Kompetitor - Investor.ID,Erajaya Tumbuh Melampaui Kompetitor  Investor.ID,2021-12-01,https://news.google.com/rss/articles/CBMiU2h0dHBzOi8vaW52ZXN0b3IuaWQvbWFya2V0LWFuZC1jb3Jwb3JhdGUvMjcyOTAyL2VyYWpheWEtdHVtYnVoLW1lbGFtcGF1aS1rb21wZXRpdG9y0gEA?oc=5&hl=en-ID&gl=ID&ceid=ID:en,"{'href': 'https://investor.id', 'title': 'Investor.ID'}",Missing,Missing
29 Perusahaan Antre Masuk Bursa - Investor.ID,29 Perusahaan Antre Masuk Bursa  Investor.ID,2021-11-29,https://news.google.com/rss/articles/CBMiT2h0dHBzOi8vaW52ZXN0b3IuaWQvbWFya2V0LWFuZC1jb3Jwb3JhdGUvMjcyNjEzLzI5LXBlcnVzYWhhYW4tYW50cmUtbWFzdWstYnVyc2HSAQA?oc=5&hl=en-ID&gl=ID&ceid=ID:en,"{'href': 'https://investor.id', 'title': 'Investor.ID'}",Missing,Missing
Potensi Investasi Pertanian di Banten Sangat Menjanjikan - Investor.ID,Potensi Investasi Pertanian di Banten Sangat Menjanjikan  Investor.ID,2021-11-29,https://news.google.com/rss/articles/CBMiXGh0dHBzOi8vaW52ZXN0b3IuaWQvYnVzaW5lc3MvMjcyNjEyL3BvdGVuc2ktaW52ZXN0YXNpLXBlcnRhbmlhbi1kaS1iYW50ZW4tc2FuZ2F0LW1lbmphbmppa2Fu0gEA?oc=5&hl=en-ID&gl=ID&ceid=ID:en,"{'href': 'https://investor.id', 'title': 'Investor.ID'}",Missing,Missing
Hangry Buka Restoran Dine-in Single Brand Pertama - Investor.ID,Hangry Buka Restoran Dine-in Single Brand Pertama  Investor.ID,2021-11-27,https://news.google.com/rss/articles/CBMiWmh0dHBzOi8vaW52ZXN0b3IuaWQvaW5kdXN0cnktdHJhZGUvMjcyNDY3L2hhbmdyeS1idWthLXJlc3RvcmFuLWRpbmVpbi1zaW5nbGUtYnJhbmQtcGVydGFtYdIBAA?oc=5&hl=en-ID&gl=ID&ceid=ID:en,"{'href': 'https://investor.id', 'title': 'Investor.ID'}",Missing,Missing
P-Pop Idol BINI dan BGYO Siap Masuk Pasar Musik Indonesia - Investor.ID,P-Pop Idol BINI dan BGYO Siap Masuk Pasar Musik Indonesia  Investor.ID,2021-11-23,https://news.google.com/rss/articles/CBMiXWh0dHBzOi8vaW52ZXN0b3IuaWQvbGlmZXN0eWxlLzI3MTgyOC9wcG9wLWlkb2wtYmluaS1kYW4tYmd5by1zaWFwLW1hc3VrLXBhc2FyLW11c2lrLWluZG9uZXNpYdIBAA?oc=5&hl=en-ID&gl=ID&ceid=ID:en,"{'href': 'https://investor.id', 'title': 'Investor.ID'}",Missing,Missing
IBM-McDonald's Teken Percepatan Teknologi AOT - Investor.ID,IBM-McDonald's Teken Percepatan Teknologi AOT  Investor.ID,2021-11-22,https://news.google.com/rss/articles/CBMiYWh0dHBzOi8vaW52ZXN0b3IuaWQvaXQtYW5kLXRlbGVjb21tdW5pY2F0aW9uLzI3MTgwMS9pYm1tY2RvbmFsZDM5cy10ZWtlbi1wZXJjZXBhdGFuLXRla25vbG9naS1hb3TSAQA?oc=5&hl=en-ID&gl=ID&ceid=ID:en,"{'href': 'https://investor.id', 'title': 'Investor.ID'}",Missing,Missing
3 Keistimewaan Sambal Rendang Khas Indonesia - Investor.ID,3 Keistimewaan Sambal Rendang Khas Indonesia  Investor.ID,2021-11-21,https://news.google.com/rss/articles/CBMiUWh0dHBzOi8vaW52ZXN0b3IuaWQvbGlmZXN0eWxlLzI3MTYxMC8zLWtlaXN0aW1ld2Fhbi1zYW1iYWwtcmVuZGFuZy1raGFzLWluZG9uZXNpYdIBAA?oc=5&hl=en-ID&gl=ID&ceid=ID:en,"{'href': 'https://investor.id', 'title': 'Investor.ID'}",Missing,Missing
Artha Graha Peduli Dukung Startup Anak Bangsa Kelola Lingkungan Indonesia - Investor.ID,Artha Graha Peduli Dukung Startup Anak Bangsa Kelola Lingkungan Indonesia  Investor.ID,2021-11-10,https://news.google.com/rss/articles/CBMibWh0dHBzOi8vaW52ZXN0b3IuaWQvYnVzaW5lc3MvMjcwMzQzL2FydGhhLWdyYWhhLXBlZHVsaS1kdWt1bmctc3RhcnR1cC1hbmFrLWJhbmdzYS1rZWxvbGEtbGluZ2t1bmdhbi1pbmRvbmVzaWHSAQA?oc=5&hl=en-ID&gl=ID&ceid=ID:en,"{'href': 'https://investor.id', 'title': 'Investor.ID'}",Missing,Missing
"BPS: 21,32 Juta Penduduk Usia Kerja Masih Terdampak Covid-19 - Investor.ID","BPS: 21,32 Juta Penduduk Usia Kerja Masih Terdampak Covid-19  Investor.ID",2021-11-07,https://news.google.com/rss/articles/CBMiXWh0dHBzOi8vaW52ZXN0b3IuaWQvYnVzaW5lc3MvMjY5OTk5L2Jwcy0yMTMyLWp1dGEtcGVuZHVkdWstdXNpYS1rZXJqYS1tYXNpaC10ZXJkYW1wYWstY292aWQxOdIBAA?oc=5&hl=en-ID&gl=ID&ceid=ID:en,"{'href': 'https://investor.id', 'title': 'Investor.ID'}",Missing,Missing
"Deklarasi, Carbon Inisiatif Indonesia Siap Bantu Pemerintah Wujudkan Ketahanan Pangan - Investor.ID","Deklarasi, Carbon Inisiatif Indonesia Siap Bantu Pemerintah Wujudkan Ketahanan Pangan  Investor.ID",2021-11-06,https://news.google.com/rss/articles/CBMieGh0dHBzOi8vaW52ZXN0b3IuaWQvYnVzaW5lc3MvMjY5OTM4L2Rla2xhcmFzaS1jYXJib24taW5pc2lhdGlmLWluZG9uZXNpYS1zaWFwLWJhbnR1LXBlbWVyaW50YWgtd3VqdWRrYW4ta2V0YWhhbmFuLXBhbmdhbtIBAA?oc=5&hl=en-ID&gl=ID&ceid=ID:en,"{'href': 'https://investor.id', 'title': 'Investor.ID'}",Missing,Missing
Optimisme terhadap Kinerja BNI - Investor.ID,Optimisme terhadap Kinerja BNI  Investor.ID,2021-11-05,https://news.google.com/rss/articles/CBMiTmh0dHBzOi8vaW52ZXN0b3IuaWQvbWFya2V0LWFuZC1jb3Jwb3JhdGUvMjY5ODYzL29wdGltaXNtZS10ZXJoYWRhcC1raW5lcmphLWJuadIBAA?oc=5&hl=en-ID&gl=ID&ceid=ID:en,"{'href': 'https://investor.id', 'title': 'Investor.ID'}",Missing,Missing
Momentum BRI untuk Tumbuh Pesat Menjelang Akhir Tahun - Investor.ID,Momentum BRI untuk Tumbuh Pesat Menjelang Akhir Tahun  Investor.ID,2021-11-04,https://news.google.com/rss/articles/CBMiZWh0dHBzOi8vaW52ZXN0b3IuaWQvbWFya2V0LWFuZC1jb3Jwb3JhdGUvMjY5NjgyL21vbWVudHVtLWJyaS11bnR1ay10dW1idWgtcGVzYXQtbWVuamVsYW5nLWFraGlyLXRhaHVu0gEA?oc=5&hl=en-ID&gl=ID&ceid=ID:en,"{'href': 'https://investor.id', 'title': 'Investor.ID'}",Missing,Missing
Bank Danamon dan Grab Luncurkan Kartu Kredit Khusus Milenial dan GenZ - Investor.ID,Bank Danamon dan Grab Luncurkan Kartu Kredit Khusus Milenial dan GenZ  Investor.ID,2021-11-02,https://news.google.com/rss/articles/CBMiaGh0dHBzOi8vaW52ZXN0b3IuaWQvZmluYW5jZS8yNjk0NzEvYmFuay1kYW5hbW9uLWRhbi1ncmFiLWx1bmN1cmthbi1rYXJ0dS1rcmVkaXQta2h1c3VzLW1pbGVuaWFsLWRhbi1nZW560gEA?oc=5&hl=en-ID&gl=ID&ceid=ID:en,"{'href': 'https://investor.id', 'title': 'Investor.ID'}",Missing,Missing
