title,description,published date,url,publisher,keywords,content
GOTO Tempuh Langkah Baru - Investor.ID,GOTO Tempuh Langkah Baru  Investor.ID,2023-02-17,https://news.google.com/rss/articles/CBMiSGh0dHBzOi8vaW52ZXN0b3IuaWQvbWFya2V0LWFuZC1jb3Jwb3JhdGUvMzIyMDg0L2dvdG8tdGVtcHVoLWxhbmdrYWgtYmFyddIBAA?oc=5&hl=en-ID&gl=ID&ceid=ID:en,"{'href': 'https://investor.id', 'title': 'Investor.ID'}",Missing,Missing
"BRI (BBRI) Kucurkan Pembiayaan Berkelanjutan Rp 694,9 T - Investor.ID","BRI (BBRI) Kucurkan Pembiayaan Berkelanjutan Rp 694,9 T  Investor.ID",2023-02-15,https://news.google.com/rss/articles/CBMiV2h0dHBzOi8vaW52ZXN0b3IuaWQvZmluYW5jZS8zMjE4MDcvYnJpLWJicmkta3VjdXJrYW4tcGVtYmlheWFhbi1iZXJrZWxhbmp1dGFuLXJwLTY5NDktdNIBAA?oc=5&hl=en-ID&gl=ID&ceid=ID:en,"{'href': 'https://investor.id', 'title': 'Investor.ID'}",Missing,Missing
Fantastis! Laba BUMN 2022 Tembus Rp 300 Triliun - Investor.ID,Fantastis! Laba BUMN 2022 Tembus Rp 300 Triliun  Investor.ID,2023-02-13,https://news.google.com/rss/articles/CBMiXmh0dHBzOi8vaW52ZXN0b3IuaWQvbWFya2V0LWFuZC1jb3Jwb3JhdGUvMzIxNjcwL2ZhbnRhc3Rpcy1sYWJhLWJ1bW4tMjAyMi10ZW1idXMtcnAtMzAwLXRyaWxpdW7SAQA?oc=5&hl=en-ID&gl=ID&ceid=ID:en,"{'href': 'https://investor.id', 'title': 'Investor.ID'}",Missing,Missing
"Jejak Investor Misterius, Tandingan Lo Kheng Hong - Investor.ID","Jejak Investor Misterius, Tandingan Lo Kheng Hong  Investor.ID",2023-02-13,https://news.google.com/rss/articles/CBMiVWh0dHBzOi8vaW52ZXN0b3IuaWQvaW52ZXN0b3J5LzMyMTYxOS9qZWphay1pbnZlc3Rvci1taXN0ZXJpdXMtdGFuZGluZ2FuLWxvLWtoZW5nLWhvbmfSAQA?oc=5&hl=en-ID&gl=ID&ceid=ID:en,"{'href': 'https://investor.id', 'title': 'Investor.ID'}",Missing,Missing
Pendiri Alfamart Djoko Susanto Jadi Pemegang Saham LAJU - Investor.ID,Pendiri Alfamart Djoko Susanto Jadi Pemegang Saham LAJU  Investor.ID,2023-02-09,https://news.google.com/rss/articles/CBMiZ2h0dHBzOi8vaW52ZXN0b3IuaWQvbWFya2V0LWFuZC1jb3Jwb3JhdGUvMzIxMjg5L3BlbmRpcmktYWxmYW1hcnQtZGpva28tc3VzYW50by1qYWRpLXBlbWVnYW5nLXNhaGFtLWxhanXSAQA?oc=5&hl=en-ID&gl=ID&ceid=ID:en,"{'href': 'https://investor.id', 'title': 'Investor.ID'}",Missing,Missing
"Saham UNVR Diprediksi Menuju Rp 6.000, Begini Argumentasinya - Investor.ID","Saham UNVR Diprediksi Menuju Rp 6.000, Begini Argumentasinya  Investor.ID",2023-02-03,https://news.google.com/rss/articles/CBMiamh0dHBzOi8vaW52ZXN0b3IuaWQvbWFya2V0LWFuZC1jb3Jwb3JhdGUvMzIwNzA3L3NhaGFtLXVudnItZGlwcmVkaWtzaS1tZW51anUtcnAtNjAwMC1iZWdpbmktYXJndW1lbnRhc2lueWHSAQA?oc=5&hl=en-ID&gl=ID&ceid=ID:en,"{'href': 'https://investor.id', 'title': 'Investor.ID'}",Missing,Missing
"2023, BCA (BBCA) Tetapkan Capex Rp 8,7 T - Investor.ID","2023, BCA (BBCA) Tetapkan Capex Rp 8,7 T  Investor.ID",2023-02-03,https://news.google.com/rss/articles/CBMiVGh0dHBzOi8vaW52ZXN0b3IuaWQvbWFya2V0LWFuZC1jb3Jwb3JhdGUvMzIwNjg5LzIwMjMtYmNhLWJiY2EtdGV0YXBrYW4tY2FwZXgtcnAtODctdNIBAA?oc=5&hl=en-ID&gl=ID&ceid=ID:en,"{'href': 'https://investor.id', 'title': 'Investor.ID'}",Missing,Missing
Cerita Andre Soelistyo Bangun GoTo: Dari Investor ke Eksekutor - Investor.ID,Cerita Andre Soelistyo Bangun GoTo: Dari Investor ke Eksekutor  Investor.ID,2023-02-02,https://news.google.com/rss/articles/CBMibWh0dHBzOi8vaW52ZXN0b3IuaWQvbWFya2V0LWFuZC1jb3Jwb3JhdGUvMzIwNjEzL2Nlcml0YS1hbmRyZS1zb2VsaXN0eW8tYmFuZ3VuLWdvdG8tZGFyaS1pbnZlc3Rvci1rZS1la3Nla3V0b3LSAQA?oc=5&hl=en-ID&gl=ID&ceid=ID:en,"{'href': 'https://investor.id', 'title': 'Investor.ID'}",Missing,Missing
"Melesat 34,06%, Saham GOTO Kerek Indeks Teknologi BEI - Investor.ID","Melesat 34,06%, Saham GOTO Kerek Indeks Teknologi BEI  Investor.ID",2023-02-02,https://news.google.com/rss/articles/CBMiYmh0dHBzOi8vaW52ZXN0b3IuaWQvbWFya2V0LWFuZC1jb3Jwb3JhdGUvMzIwNjE5L21lbGVzYXQtMzQwNi1zYWhhbS1nb3RvLWtlcmVrLWluZGVrcy10ZWtub2xvZ2ktYmVp0gEA?oc=5&hl=en-ID&gl=ID&ceid=ID:en,"{'href': 'https://investor.id', 'title': 'Investor.ID'}",Missing,Missing
"Telah Dibuka, BCA (BBCA) Akui Keliru Lakukan Pemblokiran Rekening - Investor.ID","Telah Dibuka, BCA (BBCA) Akui Keliru Lakukan Pemblokiran Rekening  Investor.ID",2023-01-30,https://news.google.com/rss/articles/CBMibmh0dHBzOi8vaW52ZXN0b3IuaWQvbWFya2V0LWFuZC1jb3Jwb3JhdGUvMzIwMjA4L3RlbGFoLWRpYnVrYS1iY2EtYmJjYS1ha3VpLWtlbGlydS1sYWt1a2FuLXBlbWJsb2tpcmFuLXJla2VuaW5n0gEA?oc=5&hl=en-ID&gl=ID&ceid=ID:en,"{'href': 'https://investor.id', 'title': 'Investor.ID'}",Missing,Missing
"Akhirnya, Bos Indika (INDY) Buka-bukaan soal Masa Depan Batu Bara - Investor.ID","Akhirnya, Bos Indika (INDY) Buka-bukaan soal Masa Depan Batu Bara  Investor.ID",2023-01-30,https://news.google.com/rss/articles/CBMibWh0dHBzOi8vaW52ZXN0b3IuaWQvbWFya2V0LWFuZC1jb3Jwb3JhdGUvMzIwMjIzL2FraGlybnlhLWJvcy1pbmRpa2EtaW5keS1idWthYnVrYWFuLXNvYWwtbWFzYS1kZXBhbi1iYXR1LWJhcmHSAQA?oc=5&hl=en-ID&gl=ID&ceid=ID:en,"{'href': 'https://investor.id', 'title': 'Investor.ID'}",Missing,Missing
"Sukses Cuan 100 Kali Lipat, Ini Jejak Portofolio Robert Susilo Murid Lo Kheng Hong - Investor.ID","Sukses Cuan 100 Kali Lipat, Ini Jejak Portofolio Robert Susilo Murid Lo Kheng Hong  Investor.ID",2023-01-30,https://news.google.com/rss/articles/CBMidmh0dHBzOi8vaW52ZXN0b3IuaWQvaW52ZXN0b3J5LzMyMDI5Mi9zdWtzZXMtY3Vhbi0xMDAta2FsaS1saXBhdC1pbmktamVqYWstcG9ydG9mb2xpby1yb2JlcnQtc3VzaWxvLW11cmlkLWxvLWtoZW5nLWhvbmfSAQA?oc=5&hl=en-ID&gl=ID&ceid=ID:en,"{'href': 'https://investor.id', 'title': 'Investor.ID'}",Missing,Missing
"Totalindo Persada (TOPS) Bangun Hotel Soll Marina Alam Sutera Rp 74,8 Miliar - Investor.ID","Totalindo Persada (TOPS) Bangun Hotel Soll Marina Alam Sutera Rp 74,8 Miliar  Investor.ID",2023-01-26,https://news.google.com/rss/articles/CBMieWh0dHBzOi8vaW52ZXN0b3IuaWQvbWFya2V0LWFuZC1jb3Jwb3JhdGUvMzE5OTEwL3RvdGFsaW5kby1wZXJzYWRhLXRvcHMtYmFuZ3VuLWhvdGVsLXNvbGwtbWFyaW5hLWFsYW0tc3V0ZXJhLXJwLTc0OC1taWxpYXLSAQA?oc=5&hl=en-ID&gl=ID&ceid=ID:en,"{'href': 'https://investor.id', 'title': 'Investor.ID'}",Missing,Missing
Ssstt! Segini Jumlah Kekayaan Lo Kheng Hong Hasil Investasi Saham 30 Tahun Lebih - Investor.ID,Ssstt! Segini Jumlah Kekayaan Lo Kheng Hong Hasil Investasi Saham 30 Tahun Lebih  Investor.ID,2023-01-20,https://news.google.com/rss/articles/CBMif2h0dHBzOi8vaW52ZXN0b3IuaWQvbWFya2V0LWFuZC1jb3Jwb3JhdGUvMzE5NTc5L3Nzc3R0LXNlZ2luaS1qdW1sYWgta2VrYXlhYW4tbG8ta2hlbmctaG9uZy1oYXNpbC1pbnZlc3Rhc2ktc2FoYW0tMzAtdGFodW4tbGViaWjSAQA?oc=5&hl=en-ID&gl=ID&ceid=ID:en,"{'href': 'https://investor.id', 'title': 'Investor.ID'}",Missing,Missing
"Rumah Peninggalan Tjong A Fie, Melihat Sejarah Kota Medan dari Sisi Berbeda - Investor.ID","Rumah Peninggalan Tjong A Fie, Melihat Sejarah Kota Medan dari Sisi Berbeda  Investor.ID",2023-01-18,https://news.google.com/rss/articles/CBMibmh0dHBzOi8vaW52ZXN0b3IuaWQvbmF0aW9uYWwvMzE5Mzc0L3J1bWFoLXBlbmluZ2dhbGFuLXRqb25nLWEtZmllLW1lbGloYXQtc2VqYXJhaC1rb3RhLW1lZGFuLWRhcmktc2lzaS1iZXJiZWRh0gEA?oc=5&hl=en-ID&gl=ID&ceid=ID:en,"{'href': 'https://investor.id', 'title': 'Investor.ID'}",Missing,Missing
Kode Lo Kheng Hong Beli Saham Bank Singapura Beraset Rp 200 Triliun - Investor.ID,Kode Lo Kheng Hong Beli Saham Bank Singapura Beraset Rp 200 Triliun  Investor.ID,2023-01-13,https://news.google.com/rss/articles/CBMic2h0dHBzOi8vaW52ZXN0b3IuaWQvbWFya2V0LWFuZC1jb3Jwb3JhdGUvMzE4OTY0L2tvZGUtbG8ta2hlbmctaG9uZy1iZWxpLXNhaGFtLWJhbmstc2luZ2FwdXJhLWJlcmFzZXQtcnAtMjAwLXRyaWxpdW7SAQA?oc=5&hl=en-ID&gl=ID&ceid=ID:en,"{'href': 'https://investor.id', 'title': 'Investor.ID'}",Missing,Missing
"Bursa Rilis Daftar Pemantauan Khusus Efektif 12 Januari, Ada 151 Saham, Hati-hati! - Investor.ID","Bursa Rilis Daftar Pemantauan Khusus Efektif 12 Januari, Ada 151 Saham, Hati-hati!  Investor.ID",2023-01-12,https://news.google.com/rss/articles/CBMifmh0dHBzOi8vaW52ZXN0b3IuaWQvbWFya2V0LWFuZC1jb3Jwb3JhdGUvMzE4ODc1L2J1cnNhLXJpbGlzLWRhZnRhci1wZW1hbnRhdWFuLWtodXN1cy1lZmVrdGlmLTEyLWphbnVhcmktYWRhLTE1MS1zYWhhbS1oYXRpaGF0adIBAA?oc=5&hl=en-ID&gl=ID&ceid=ID:en,"{'href': 'https://investor.id', 'title': 'Investor.ID'}",Missing,Missing
"Saham Properti Lagi Murah, Lo Kheng Hong: Beli Boleh tapi Harus Menunggu, Tak Tahu Naiknya Kapan - Investor.ID","Saham Properti Lagi Murah, Lo Kheng Hong: Beli Boleh tapi Harus Menunggu, Tak Tahu Naiknya Kapan  Investor.ID",2023-01-11,https://news.google.com/rss/articles/CBMijQFodHRwczovL2ludmVzdG9yLmlkL21hcmtldC1hbmQtY29ycG9yYXRlLzMxODgwMS9zYWhhbS1wcm9wZXJ0aS1sYWdpLW11cmFoLWxvLWtoZW5nLWhvbmctYmVsaS1ib2xlaC10YXBpLWhhcnVzLW1lbnVuZ2d1LXRhay10YWh1LW5haWtueWEta2FwYW7SAQA?oc=5&hl=en-ID&gl=ID&ceid=ID:en,"{'href': 'https://investor.id', 'title': 'Investor.ID'}",Missing,Missing
"Kapok Punya Saham Ini, Lo Kheng Hong: Ingin Keluar aja, Hanya Mau Pegang Wonderful Company - Investor.ID","Kapok Punya Saham Ini, Lo Kheng Hong: Ingin Keluar aja, Hanya Mau Pegang Wonderful Company  Investor.ID",2023-01-09,https://news.google.com/rss/articles/CBMihwFodHRwczovL2ludmVzdG9yLmlkL21hcmtldC1hbmQtY29ycG9yYXRlLzMxODU3MC9rYXBvay1wdW55YS1zYWhhbS1pbmktbG8ta2hlbmctaG9uZy1pbmdpbi1rZWx1YXItYWphLWhhbnlhLW1hdS1wZWdhbmctd29uZGVyZnVsLWNvbXBhbnnSAQA?oc=5&hl=en-ID&gl=ID&ceid=ID:en,"{'href': 'https://investor.id', 'title': 'Investor.ID'}",Missing,Missing
"Ini Sederet Rekor, Gelar, dan Trofi yang Diraih Pele - Investor.ID","Ini Sederet Rekor, Gelar, dan Trofi yang Diraih Pele  Investor.ID",2022-12-30,https://news.google.com/rss/articles/CBMiV2h0dHBzOi8vaW52ZXN0b3IuaWQvbGlmZXN0eWxlLzMxNzgyMS9pbmktc2VkZXJldC1yZWtvci1nZWxhci1kYW4tdHJvZmkteWFuZy1kaXJhaWgtcGVsZdIBAA?oc=5&hl=en-ID&gl=ID&ceid=ID:en,"{'href': 'https://investor.id', 'title': 'Investor.ID'}",Missing,Missing
"Pendapatan Melesat Ditambah Kontrak Baru, Saham Djasa Ubersakti (PTDU) Bisa Dicermati - Investor.ID","Pendapatan Melesat Ditambah Kontrak Baru, Saham Djasa Ubersakti (PTDU) Bisa Dicermati  Investor.ID",2022-12-30,https://news.google.com/rss/articles/CBMiggFodHRwczovL2ludmVzdG9yLmlkL21hcmtldC1hbmQtY29ycG9yYXRlLzMxNzgwMS9wZW5kYXBhdGFuLW1lbGVzYXQtZGl0YW1iYWgta29udHJhay1iYXJ1LXNhaGFtLWRqYXNhLXViZXJzYWt0aS1wdGR1LWJpc2EtZGljZXJtYXRp0gEA?oc=5&hl=en-ID&gl=ID&ceid=ID:en,"{'href': 'https://investor.id', 'title': 'Investor.ID'}",Missing,Missing
PGN Percepat Program Konversi di Tarakan - Investor.ID,PGN Percepat Program Konversi di Tarakan  Investor.ID,2022-12-28,https://news.google.com/rss/articles/CBMiTGh0dHBzOi8vaW52ZXN0b3IuaWQvYnVzaW5lc3MvMzE3NjYzL3Bnbi1wZXJjZXBhdC1wcm9ncmFtLWtvbnZlcnNpLWRpLXRhcmFrYW7SAQA?oc=5&hl=en-ID&gl=ID&ceid=ID:en,"{'href': 'https://investor.id', 'title': 'Investor.ID'}",Missing,Missing
Alasan Saham Bayan Lebih Ngacir ketimbang Para Pesaing - Investor.ID,Alasan Saham Bayan Lebih Ngacir ketimbang Para Pesaing  Investor.ID,2022-12-28,https://news.google.com/rss/articles/CBMiZmh0dHBzOi8vaW52ZXN0b3IuaWQvbWFya2V0LWFuZC1jb3Jwb3JhdGUvMzE3NTg2L2FsYXNhbi1zYWhhbS1iYXlhbi1sZWJpaC1uZ2FjaXIta2V0aW1iYW5nLXBhcmEtcGVzYWluZ9IBAA?oc=5&hl=en-ID&gl=ID&ceid=ID:en,"{'href': 'https://investor.id', 'title': 'Investor.ID'}",Missing,Missing
"Saham-saham Paling Cuan 2022, Bikin Orang Jadi Tajir Mendadak! - Investor.ID","Saham-saham Paling Cuan 2022, Bikin Orang Jadi Tajir Mendadak!  Investor.ID",2022-12-28,https://news.google.com/rss/articles/CBMia2h0dHBzOi8vaW52ZXN0b3IuaWQvbWFya2V0LWFuZC1jb3Jwb3JhdGUvMzE3Njc0L3NhaGFtc2FoYW0tcGFsaW5nLWN1YW4tMjAyMi1iaWtpbi1vcmFuZy1qYWRpLXRhamlyLW1lbmRhZGFr0gEA?oc=5&hl=en-ID&gl=ID&ceid=ID:en,"{'href': 'https://investor.id', 'title': 'Investor.ID'}",Missing,Missing
"Wijono & Hermanto Tanoko, Pemilik Cat Avian (AVIA) yang Jadi Orang Terkaya No 11 - Investor.ID","Wijono & Hermanto Tanoko, Pemilik Cat Avian (AVIA) yang Jadi Orang Terkaya No 11  Investor.ID",2022-12-27,https://news.google.com/rss/articles/CBMie2h0dHBzOi8vaW52ZXN0b3IuaWQvbWFya2V0LWFuZC1jb3Jwb3JhdGUvMzE3NTM2L3dpam9uby1oZXJtYW50by10YW5va28tcGVtaWxpay1jYXQtYXZpYW4tYXZpYS15YW5nLWphZGktb3JhbmctdGVya2F5YS1uby0xMdIBAA?oc=5&hl=en-ID&gl=ID&ceid=ID:en,"{'href': 'https://investor.id', 'title': 'Investor.ID'}",Missing,Missing
Wujudkan Beli Rumah Impian di Usia 30 Tahun - Investor.ID,Wujudkan Beli Rumah Impian di Usia 30 Tahun  Investor.ID,2022-12-25,https://news.google.com/rss/articles/CBMiT2h0dHBzOi8vaW52ZXN0b3IuaWQvYnVzaW5lc3MvMzE3NDMwL3d1anVka2FuLWJlbGktcnVtYWgtaW1waWFuLWRpLXVzaWEtMzAtdGFodW7SAQA?oc=5&hl=en-ID&gl=ID&ceid=ID:en,"{'href': 'https://investor.id', 'title': 'Investor.ID'}",Missing,Missing
Dharma Polimetal (DRMA) Akuisisi Entitas Milik Kuroda Group dari Jepang - Investor.ID,Dharma Polimetal (DRMA) Akuisisi Entitas Milik Kuroda Group dari Jepang  Investor.ID,2022-12-22,https://news.google.com/rss/articles/CBMidWh0dHBzOi8vaW52ZXN0b3IuaWQvbWFya2V0LWFuZC1jb3Jwb3JhdGUvMzE3MTA3L2RoYXJtYS1wb2xpbWV0YWwtZHJtYS1ha3Vpc2lzaS1lbnRpdGFzLW1pbGlrLWt1cm9kYS1ncm91cC1kYXJpLWplcGFuZ9IBAA?oc=5&hl=en-ID&gl=ID&ceid=ID:en,"{'href': 'https://investor.id', 'title': 'Investor.ID'}",Missing,Missing
"Gandeng Obayashi dan Jaya Konstruksi, WIKA Bakal Garap Proyek Air dan Sanitasi Rp 3,3 Triliun - Investor.ID","Gandeng Obayashi dan Jaya Konstruksi, WIKA Bakal Garap Proyek Air dan Sanitasi Rp 3,3 Triliun  Investor.ID",2022-12-22,https://news.google.com/rss/articles/CBMiiwFodHRwczovL2ludmVzdG9yLmlkL21hcmtldC1hbmQtY29ycG9yYXRlLzMxNzE3My9nYW5kZW5nLW9iYXlhc2hpLWRhbi1qYXlhLWtvbnN0cnVrc2ktd2lrYS1iYWthbC1nYXJhcC1wcm95ZWstYWlyLWRhbi1zYW5pdGFzaS1ycC0zMy10cmlsaXVu0gEA?oc=5&hl=en-ID&gl=ID&ceid=ID:en,"{'href': 'https://investor.id', 'title': 'Investor.ID'}",Missing,Missing
Rans Nusantara Hebat Dapat Antusiasme Luar Biasa Dari Warga Surakarta - Investor.ID,Rans Nusantara Hebat Dapat Antusiasme Luar Biasa Dari Warga Surakarta  Investor.ID,2022-12-21,https://news.google.com/rss/articles/CBMiamh0dHBzOi8vaW52ZXN0b3IuaWQvbGlmZXN0eWxlLzMxNzAwNS9yYW5zLW51c2FudGFyYS1oZWJhdC1kYXBhdC1hbnR1c2lhc21lLWx1YXItYmlhc2EtZGFyaS13YXJnYS1zdXJha2FydGHSAQA?oc=5&hl=en-ID&gl=ID&ceid=ID:en,"{'href': 'https://investor.id', 'title': 'Investor.ID'}",Missing,Missing
"Memasuki Tahun 2023, Mandiri Sekuritas Ungkap 10 Saham Pilihan, Ada GOTO - Investor.ID","Memasuki Tahun 2023, Mandiri Sekuritas Ungkap 10 Saham Pilihan, Ada GOTO  Investor.ID",2022-12-21,https://news.google.com/rss/articles/CBMidmh0dHBzOi8vaW52ZXN0b3IuaWQvbWFya2V0LWFuZC1jb3Jwb3JhdGUvMzE2OTU2L21lbWFzdWtpLXRhaHVuLTIwMjMtbWFuZGlyaS1zZWt1cml0YXMtdW5na2FwLTEwLXNhaGFtLXBpbGloYW4tYWRhLWdvdG_SAQA?oc=5&hl=en-ID&gl=ID&ceid=ID:en,"{'href': 'https://investor.id', 'title': 'Investor.ID'}",Missing,Missing
"Sah! IBC Akuisisi 53,93% Saham Produsen Motor Listrik Gesits dari WIKA - Investor.ID","Sah! IBC Akuisisi 53,93% Saham Produsen Motor Listrik Gesits dari WIKA  Investor.ID",2022-12-15,https://news.google.com/rss/articles/CBMic2h0dHBzOi8vaW52ZXN0b3IuaWQvbWFya2V0LWFuZC1jb3Jwb3JhdGUvMzE2NDUxL3NhaC1pYmMtYWt1aXNpc2ktNTM5My1zYWhhbS1wcm9kdXNlbi1tb3Rvci1saXN0cmlrLWdlc2l0cy1kYXJpLXdpa2HSAQA?oc=5&hl=en-ID&gl=ID&ceid=ID:en,"{'href': 'https://investor.id', 'title': 'Investor.ID'}",Missing,Missing
"Mengenal Keluarga Arnault, Orang Terkaya Dunia yang Geser Elon Musk - Investor.ID","Mengenal Keluarga Arnault, Orang Terkaya Dunia yang Geser Elon Musk  Investor.ID",2022-12-13,https://news.google.com/rss/articles/CBMia2h0dHBzOi8vaW52ZXN0b3IuaWQvaW50ZXJuYXRpb25hbC8zMTYxNTUvbWVuZ2VuYWwta2VsdWFyZ2EtYXJuYXVsdC1vcmFuZy10ZXJrYXlhLWR1bmlhLXlhbmctZ2VzZXItZWxvbi1tdXNr0gEA?oc=5&hl=en-ID&gl=ID&ceid=ID:en,"{'href': 'https://investor.id', 'title': 'Investor.ID'}",Missing,Missing
"Lagi-lagi Anjlok, Bagaimana Sebenarnya Prospek Saham Bank Jago (ARTO)? - Investor.ID","Lagi-lagi Anjlok, Bagaimana Sebenarnya Prospek Saham Bank Jago (ARTO)?  Investor.ID",2022-12-12,https://news.google.com/rss/articles/CBMicWh0dHBzOi8vaW52ZXN0b3IuaWQvbWFya2V0LWFuZC1jb3Jwb3JhdGUvMzE2MDg0L2xhZ2lsYWdpLWFuamxvay1iYWdhaW1hbmEtc2ViZW5hcm55YS1wcm9zcGVrLXNhaGFtLWJhbmstamFnby1hcnRv0gEA?oc=5&hl=en-ID&gl=ID&ceid=ID:en,"{'href': 'https://investor.id', 'title': 'Investor.ID'}",Missing,Missing
"Mengenal Model Bisnis Tech Company Venteny (VTNY) yang IPO, di Baliknya Banyak Investor Gede - Investor.ID","Mengenal Model Bisnis Tech Company Venteny (VTNY) yang IPO, di Baliknya Banyak Investor Gede  Investor.ID",2022-12-09,https://news.google.com/rss/articles/CBMiiQFodHRwczovL2ludmVzdG9yLmlkL21hcmtldC1hbmQtY29ycG9yYXRlLzMxNTc5NS9tZW5nZW5hbC1tb2RlbC1iaXNuaXMtdGVjaC1jb21wYW55LXZlbnRlbnktdnRueS15YW5nLWlwby1kaS1iYWxpa255YS1iYW55YWstaW52ZXN0b3ItZ2VkZdIBAA?oc=5&hl=en-ID&gl=ID&ceid=ID:en,"{'href': 'https://investor.id', 'title': 'Investor.ID'}",Missing,Missing
"Lo Kheng Hong Kirim Pesan WA, Isinya: Kopi, Koran, dan Batu Bara - Investor.ID","Lo Kheng Hong Kirim Pesan WA, Isinya: Kopi, Koran, dan Batu Bara  Investor.ID",2022-12-09,https://news.google.com/rss/articles/CBMiYWh0dHBzOi8vaW52ZXN0b3IuaWQvaW52ZXN0b3J5LzMxNTgxNy9sby1raGVuZy1ob25nLWtpcmltLXBlc2FuLXdhLWlzaW55YS1rb3BpLWtvcmFuLWRhbi1iYXR1LWJhcmHSAQA?oc=5&hl=en-ID&gl=ID&ceid=ID:en,"{'href': 'https://investor.id', 'title': 'Investor.ID'}",Missing,Missing
"Saham Bank Jago (ARTO) Balik ke Level Sebelum Gojek, Jerry Ng, dan Patrick Walujo Jadi Pengendali - Investor.ID","Saham Bank Jago (ARTO) Balik ke Level Sebelum Gojek, Jerry Ng, dan Patrick Walujo Jadi Pengendali  Investor.ID",2022-12-08,https://news.google.com/rss/articles/CBMijQFodHRwczovL2ludmVzdG9yLmlkL21hcmtldC1hbmQtY29ycG9yYXRlLzMxNTcwMi9zYWhhbS1iYW5rLWphZ28tYXJ0by1iYWxpay1rZS1sZXZlbC1zZWJlbHVtLWdvamVrLWplcnJ5LW5nLWRhbi1wYXRyaWNrLXdhbHVqby1qYWRpLXBlbmdlbmRhbGnSAQA?oc=5&hl=en-ID&gl=ID&ceid=ID:en,"{'href': 'https://investor.id', 'title': 'Investor.ID'}",Missing,Missing
"Telkom (TLKM) Sebut GOTO Akan Untungkan Telkom Mulai 2023, Kok Bisa? - Investor.ID","Telkom (TLKM) Sebut GOTO Akan Untungkan Telkom Mulai 2023, Kok Bisa?  Investor.ID",2022-12-07,https://news.google.com/rss/articles/CBMicGh0dHBzOi8vaW52ZXN0b3IuaWQvbWFya2V0LWFuZC1jb3Jwb3JhdGUvMzE1NTY1L3RlbGtvbS10bGttLXNlYnV0LWdvdG8tYWthbi11bnR1bmdrYW4tdGVsa29tLW11bGFpLTIwMjMta29rLWJpc2HSAQA?oc=5&hl=en-ID&gl=ID&ceid=ID:en,"{'href': 'https://investor.id', 'title': 'Investor.ID'}",Missing,Missing
"Saham Telkom (TLKM) Terpangkas 11%, Apa pemicunya? - Investor.ID","Saham Telkom (TLKM) Terpangkas 11%, Apa pemicunya?  Investor.ID",2022-12-06,https://news.google.com/rss/articles/CBMiXWh0dHBzOi8vaW52ZXN0b3IuaWQvbWFya2V0LWFuZC1jb3Jwb3JhdGUvMzE1NDIyL3NhaGFtLXRlbGtvbS10bGttLXRlcnBhbmdrYXMtMTEtYXBhLXBlbWljdW55YdIBAA?oc=5&hl=en-ID&gl=ID&ceid=ID:en,"{'href': 'https://investor.id', 'title': 'Investor.ID'}",Missing,Missing
"Suwannarut Juara BNI Indonesian Masters 2022 Presented by TNE, BNI Beri Apresiasi - Investor.ID","Suwannarut Juara BNI Indonesian Masters 2022 Presented by TNE, BNI Beri Apresiasi  Investor.ID",2022-12-04,https://news.google.com/rss/articles/CBMidWh0dHBzOi8vaW52ZXN0b3IuaWQvbGlmZXN0eWxlLzMxNTIwMC9zdXdhbm5hcnV0LWp1YXJhLWJuaS1pbmRvbmVzaWFuLW1hc3RlcnMtMjAyMi1wcmVzZW50ZWQtYnktdG5lLWJuaS1iZXJpLWFwcmVzaWFzadIBAA?oc=5&hl=en-ID&gl=ID&ceid=ID:en,"{'href': 'https://investor.id', 'title': 'Investor.ID'}",Missing,Missing
BI Ungkap Lima Isu Ekonomi Global yang Harus Diwaspadai di 2023 - Investor.ID,BI Ungkap Lima Isu Ekonomi Global yang Harus Diwaspadai di 2023  Investor.ID,2022-11-30,https://news.google.com/rss/articles/CBMiY2h0dHBzOi8vaW52ZXN0b3IuaWQvYnVzaW5lc3MvMzE0NzM2L2JpLXVuZ2thcC1saW1hLWlzdS1la29ub21pLWdsb2JhbC15YW5nLWhhcnVzLWRpd2FzcGFkYWktZGktMjAyM9IBAA?oc=5&hl=en-ID&gl=ID&ceid=ID:en,"{'href': 'https://investor.id', 'title': 'Investor.ID'}",Missing,Missing
"Tahun Depan, Sariguna Primatirta (CLEO) Kembali Ekspansi Pabrik - Investor.ID","Tahun Depan, Sariguna Primatirta (CLEO) Kembali Ekspansi Pabrik  Investor.ID",2022-11-30,https://news.google.com/rss/articles/CBMibGh0dHBzOi8vaW52ZXN0b3IuaWQvbWFya2V0LWFuZC1jb3Jwb3JhdGUvMzE0NjY1L3RhaHVuLWRlcGFuLXNhcmlndW5hLXByaW1hdGlydGEtY2xlby1rZW1iYWxpLWVrc3BhbnNpLXBhYnJpa9IBAA?oc=5&hl=en-ID&gl=ID&ceid=ID:en,"{'href': 'https://investor.id', 'title': 'Investor.ID'}",Missing,Missing
Kisah Mantan Kuli Bangunan yang Sukses Jadi Pengusaha Online - Investor.ID,Kisah Mantan Kuli Bangunan yang Sukses Jadi Pengusaha Online  Investor.ID,2022-11-29,https://news.google.com/rss/articles/CBMiYGh0dHBzOi8vaW52ZXN0b3IuaWQvYnVzaW5lc3MvMzE0NTkzL2tpc2FoLW1hbnRhbi1rdWxpLWJhbmd1bmFuLXlhbmctc3Vrc2VzLWphZGktcGVuZ3VzYWhhLW9ubGluZdIBAA?oc=5&hl=en-ID&gl=ID&ceid=ID:en,"{'href': 'https://investor.id', 'title': 'Investor.ID'}",Missing,Missing
Kisah Mantan Kuli Bangunan yang Sukses Jadi Pengusaha Online - Investor.ID,Kisah Mantan Kuli Bangunan yang Sukses Jadi Pengusaha Online  Investor.ID,2022-11-29,https://news.google.com/rss/articles/CBMiYGh0dHBzOi8vaW52ZXN0b3IuaWQvYnVzaW5lc3MvMzE0NTkzL2tpc2FoLW1hbnRhbi1rdWxpLWJhbmd1bmFuLXlhbmctc3Vrc2VzLWphZGktcGVuZ3VzYWhhLW9ubGluZdIBAA?oc=5&hl=en-ID&gl=ID&ceid=ID:en,"{'href': 'https://investor.id', 'title': 'Investor.ID'}",Missing,Missing
"CPO Bikin Laba Bersih Teladan Prima Agro (TLDN) Terbang 108,5% - Investor.ID","CPO Bikin Laba Bersih Teladan Prima Agro (TLDN) Terbang 108,5%  Investor.ID",2022-11-27,https://news.google.com/rss/articles/CBMiamh0dHBzOi8vaW52ZXN0b3IuaWQvbWFya2V0LWFuZC1jb3Jwb3JhdGUvMzE0MzcwL2Nwby1iaWtpbi1sYWJhLWJlcnNpaC10ZWxhZGFuLXByaW1hLWFncm8tdGxkbi10ZXJiYW5nLTEwODXSAQA?oc=5&hl=en-ID&gl=ID&ceid=ID:en,"{'href': 'https://investor.id', 'title': 'Investor.ID'}",Missing,Missing
Cerita Lo Kheng Hong Lolos dari Floating Loss Terbesarnya di Saham BUMI - Investor.ID,Cerita Lo Kheng Hong Lolos dari Floating Loss Terbesarnya di Saham BUMI  Investor.ID,2022-11-25,https://news.google.com/rss/articles/CBMid2h0dHBzOi8vaW52ZXN0b3IuaWQvbWFya2V0LWFuZC1jb3Jwb3JhdGUvMzE0MjE0L2Nlcml0YS1sby1raGVuZy1ob25nLWxvbG9zLWRhcmktZmxvYXRpbmctbG9zcy10ZXJiZXNhcm55YS1kaS1zYWhhbS1idW1p0gEA?oc=5&hl=en-ID&gl=ID&ceid=ID:en,"{'href': 'https://investor.id', 'title': 'Investor.ID'}",Missing,Missing
"Lo Kheng Hong: Jangan lihat yang Makro, Bisa Pusing - Investor.ID","Lo Kheng Hong: Jangan lihat yang Makro, Bisa Pusing  Investor.ID",2022-11-23,https://news.google.com/rss/articles/CBMiYWh0dHBzOi8vaW52ZXN0b3IuaWQvbWFya2V0LWFuZC1jb3Jwb3JhdGUvMzEzOTMyL2xvLWtoZW5nLWhvbmctamFuZ2FuLWxpaGF0LXlhbmctbWFrcm8tYmlzYS1wdXNpbmfSAQA?oc=5&hl=en-ID&gl=ID&ceid=ID:en,"{'href': 'https://investor.id', 'title': 'Investor.ID'}",Missing,Missing
Ini Strategi Pemerintah Hadapi Putusan WTO soal Larangan Ekspor Nikel - Investor.ID,Ini Strategi Pemerintah Hadapi Putusan WTO soal Larangan Ekspor Nikel  Investor.ID,2022-11-21,https://news.google.com/rss/articles/CBMiaWh0dHBzOi8vaW52ZXN0b3IuaWQvYnVzaW5lc3MvMzEzNzIxL2luaS1zdHJhdGVnaS1wZW1lcmludGFoLWhhZGFwaS1wdXR1c2FuLXd0by1zb2FsLWxhcmFuZ2FuLWVrc3Bvci1uaWtlbNIBAA?oc=5&hl=en-ID&gl=ID&ceid=ID:en,"{'href': 'https://investor.id', 'title': 'Investor.ID'}",Missing,Missing
"WIKA Setor Modal Kereta Cepat Rp 6,12 Triliun - Investor.ID","WIKA Setor Modal Kereta Cepat Rp 6,12 Triliun  Investor.ID",2022-11-20,https://news.google.com/rss/articles/CBMiXGh0dHBzOi8vaW52ZXN0b3IuaWQvbWFya2V0LWFuZC1jb3Jwb3JhdGUvMzEzNjEyL3dpa2Etc2V0b3ItbW9kYWwta2VyZXRhLWNlcGF0LXJwLTYxMi10cmlsaXVu0gEA?oc=5&hl=en-ID&gl=ID&ceid=ID:en,"{'href': 'https://investor.id', 'title': 'Investor.ID'}",Missing,Missing
PGN Targetkan Pipa Gas KIT Batang On Stream 2023 - Investor.ID,PGN Targetkan Pipa Gas KIT Batang On Stream 2023  Investor.ID,2022-11-18,https://news.google.com/rss/articles/CBMiVGh0dHBzOi8vaW52ZXN0b3IuaWQvYnVzaW5lc3MvMzEzMzc0L3Bnbi10YXJnZXRrYW4tcGlwYS1nYXMta2l0LWJhdGFuZy1vbi1zdHJlYW0tMjAyM9IBAA?oc=5&hl=en-ID&gl=ID&ceid=ID:en,"{'href': 'https://investor.id', 'title': 'Investor.ID'}",Missing,Missing
Ini Modus Penipuan Berkedok Toko Online yang Jerat Mahasiswa IPB - Investor.ID,Ini Modus Penipuan Berkedok Toko Online yang Jerat Mahasiswa IPB  Investor.ID,2022-11-18,https://news.google.com/rss/articles/CBMiY2h0dHBzOi8vaW52ZXN0b3IuaWQvZmluYW5jZS8zMTM0NzQvaW5pLW1vZHVzLXBlbmlwdWFuLWJlcmtlZG9rLXRva28tb25saW5lLXlhbmctamVyYXQtbWFoYXNpc3dhLWlwYtIBAA?oc=5&hl=en-ID&gl=ID&ceid=ID:en,"{'href': 'https://investor.id', 'title': 'Investor.ID'}",Missing,Missing
"Ini Kompensasi untuk Karyawan GOTO, di Atas Standar lho! - Investor.ID","Ini Kompensasi untuk Karyawan GOTO, di Atas Standar lho!  Investor.ID",2022-11-18,https://news.google.com/rss/articles/CBMiZmh0dHBzOi8vaW52ZXN0b3IuaWQvbWFya2V0LWFuZC1jb3Jwb3JhdGUvMzEzNDg2L2luaS1rb21wZW5zYXNpLXVudHVrLWthcnlhd2FuLWdvdG8tZGktYXRhcy1zdGFuZGFyLWxob9IBAA?oc=5&hl=en-ID&gl=ID&ceid=ID:en,"{'href': 'https://investor.id', 'title': 'Investor.ID'}",Missing,Missing
Film Sri Asih Tayang di Bioskop Mulai 17 November - Investor.ID,Film Sri Asih Tayang di Bioskop Mulai 17 November  Investor.ID,2022-11-16,https://news.google.com/rss/articles/CBMiVmh0dHBzOi8vaW52ZXN0b3IuaWQvbGlmZXN0eWxlLzMxMzE3OS9maWxtLXNyaS1hc2loLXRheWFuZy1kaS1iaW9za29wLW11bGFpLTE3LW5vdmVtYmVy0gEA?oc=5&hl=en-ID&gl=ID&ceid=ID:en,"{'href': 'https://investor.id', 'title': 'Investor.ID'}",Missing,Missing
Bocoran Target dan Rencana Aksi Kapuas Prima (ZINC) Tahun Depan - Investor.ID,Bocoran Target dan Rencana Aksi Kapuas Prima (ZINC) Tahun Depan  Investor.ID,2022-11-16,https://news.google.com/rss/articles/CBMibWh0dHBzOi8vaW52ZXN0b3IuaWQvbWFya2V0LWFuZC1jb3Jwb3JhdGUvMzEzMjM1L2JvY29yYW4tdGFyZ2V0LWRhbi1yZW5jYW5hLWFrc2kta2FwdWFzLXByaW1hLXppbmMtdGFodW4tZGVwYW7SAQA?oc=5&hl=en-ID&gl=ID&ceid=ID:en,"{'href': 'https://investor.id', 'title': 'Investor.ID'}",Missing,Missing
Mengintip Kinerja Keuangan Isra Presisi (ISAP) yang IPO dan Hubungannya dengan Grup Astra - Investor.ID,Mengintip Kinerja Keuangan Isra Presisi (ISAP) yang IPO dan Hubungannya dengan Grup Astra  Investor.ID,2022-11-15,https://news.google.com/rss/articles/CBMihwFodHRwczovL2ludmVzdG9yLmlkL21hcmtldC1hbmQtY29ycG9yYXRlLzMxMzAyMy9tZW5naW50aXAta2luZXJqYS1rZXVhbmdhbi1pc3JhLXByZXNpc2ktaXNhcC15YW5nLWlwby1kYW4taHVidW5nYW5ueWEtZGVuZ2FuLWdydXAtYXN0cmHSAQA?oc=5&hl=en-ID&gl=ID&ceid=ID:en,"{'href': 'https://investor.id', 'title': 'Investor.ID'}",Missing,Missing
"Bareng Mitsubishi dan SEPCOIII, WIKA Garap Pembangkit Listrik Tenaga Geotermal - Investor.ID","Bareng Mitsubishi dan SEPCOIII, WIKA Garap Pembangkit Listrik Tenaga Geotermal  Investor.ID",2022-11-14,https://news.google.com/rss/articles/CBMifWh0dHBzOi8vaW52ZXN0b3IuaWQvbWFya2V0LWFuZC1jb3Jwb3JhdGUvMzEyOTYzL2JhcmVuZy1taXRzdWJpc2hpLWRhbi1zZXBjb2lpaS13aWthLWdhcmFwLXBlbWJhbmdraXQtbGlzdHJpay10ZW5hZ2EtZ2VvdGVybWFs0gEA?oc=5&hl=en-ID&gl=ID&ceid=ID:en,"{'href': 'https://investor.id', 'title': 'Investor.ID'}",Missing,Missing
