title,description,published date,url,publisher,keywords,content
"Proyek Biomethane Konsorsium PGN dengan JGC, Osaka Gas dan INPEX di Sumatera Selatan - Investor.ID","Proyek Biomethane Konsorsium PGN dengan JGC, Osaka Gas dan INPEX di Sumatera Selatan  Investor.ID",2023-09-25,https://news.google.com/rss/articles/CBMid2h0dHBzOi8vaW52ZXN0b3IuaWQvYnVzaW5lc3MvMzQxNTYzL3Byb3llay1iaW9tZXRoYW5lLWtvbnNvcnNpdW0tcGduLWRlbmdhbi1qZ2Mtb3Nha2EtZ2FzLWRhbi1pbnBleC1kaS1zdW1hdGVyYS1zZWxhdGFu0gEA?oc=5&hl=en-ID&gl=ID&ceid=ID:en,"{'href': 'https://investor.id', 'title': 'Investor.ID'}",Missing,Missing
PGN dan National Energy Solutions Kerja Sama Pengembangan Infrastruktur & Komersialisasi Mini LNG - Investor.ID,PGN dan National Energy Solutions Kerja Sama Pengembangan Infrastruktur & Komersialisasi Mini LNG  Investor.ID,2023-09-21,https://news.google.com/rss/articles/CBMiggFodHRwczovL2ludmVzdG9yLmlkL2J1c2luZXNzLzM0MTIyNi9wZ25kYW4tbmF0aW9uYWwtZW5lcmd5LXNvbHV0aW9ucy1rZXJqYS1zYW1hLXBlbmdlbWJhbmdhbi1pbmZyYXN0cnVrdHVyLWtvbWVyc2lhbGlzYXNpLW1pbmktbG5n0gEA?oc=5&hl=en-ID&gl=ID&ceid=ID:en,"{'href': 'https://investor.id', 'title': 'Investor.ID'}",Missing,Missing
"Produsen Bir Lovina Beach Brewery (STRK) IPO Kisaran Rp 100-119, Murah? - Investor.ID","Produsen Bir Lovina Beach Brewery (STRK) IPO Kisaran Rp 100-119, Murah?  Investor.ID",2023-09-21,https://news.google.com/rss/articles/CBMiZGh0dHBzOi8vaW52ZXN0b3IuaWQvbWFya2V0LzM0MTIyMS9wcm9kdXNlbi1iaXItbG92aW5hLWJlYWNoLWJyZXdlcnktc3Ryay1pcG8ta2lzYXJhbi1ycC0xMDAxMTktbXVyYWjSAQA?oc=5&hl=en-ID&gl=ID&ceid=ID:en,"{'href': 'https://investor.id', 'title': 'Investor.ID'}",Missing,Missing
"Pembiayaan Terus Tumbuh, Laba BSI (BRIS) Melesat 32,41% - Investor.ID","Pembiayaan Terus Tumbuh, Laba BSI (BRIS) Melesat 32,41%  Investor.ID",2023-09-19,https://news.google.com/rss/articles/CBMiVWh0dHBzOi8vaW52ZXN0b3IuaWQvZmluYW5jZS8zNDEwMDYvcGVtYmlheWFhbi10ZXJ1cy10dW1idWgtbGFiYS1ic2ktYnJpcy1tZWxlc2F0LTMyNDHSAQA?oc=5&hl=en-ID&gl=ID&ceid=ID:en,"{'href': 'https://investor.id', 'title': 'Investor.ID'}",Missing,Missing
BNI (BBNI) Perbanyak Opsi Perumahan Akses LRT Jabodebek Bagi Milenial - Investor.ID,BNI (BBNI) Perbanyak Opsi Perumahan Akses LRT Jabodebek Bagi Milenial  Investor.ID,2023-09-15,https://news.google.com/rss/articles/CBMiZmh0dHBzOi8vaW52ZXN0b3IuaWQvZmluYW5jZS8zNDA3NDAvYm5pLWJibmktcGVyYmFueWFrLW9wc2ktcGVydW1haGFuLWFrc2VzLWxydC1qYWJvZGViZWstYmFnaS1taWxlbmlhbNIBAA?oc=5&hl=en-ID&gl=ID&ceid=ID:en,"{'href': 'https://investor.id', 'title': 'Investor.ID'}",Missing,Missing
"Asing Masif Jualan, 10 Saham Ini Jadi Bulan-bulanan - Investor.ID","Asing Masif Jualan, 10 Saham Ini Jadi Bulan-bulanan  Investor.ID",2023-09-10,https://news.google.com/rss/articles/CBMiU2h0dHBzOi8vaW52ZXN0b3IuaWQvbWFya2V0LzM0MDE4Mi9hc2luZy1tYXNpZi1qdWFsYW4tMTAtc2FoYW0taW5pLWphZGktYnVsYW5idWxhbmFu0gEA?oc=5&hl=en-ID&gl=ID&ceid=ID:en,"{'href': 'https://investor.id', 'title': 'Investor.ID'}",Missing,Missing
Cerita Lo Kheng Hong Beli PGAS selepas Jual MBSS: BUMN dan Swasta Sama Saja - Investor.ID,Cerita Lo Kheng Hong Beli PGAS selepas Jual MBSS: BUMN dan Swasta Sama Saja  Investor.ID,2023-09-09,https://news.google.com/rss/articles/CBMia2h0dHBzOi8vaW52ZXN0b3IuaWQvbWFya2V0LzM0MDEzNy9jZXJpdGEtbG8ta2hlbmctaG9uZy1iZWxpLXBnYXMtc2VsZXBhcy1qdWFsLW1ic3MtYnVtbi1kYW5zd2FzdGEtc2FtYS1zYWph0gEA?oc=5&hl=en-ID&gl=ID&ceid=ID:en,"{'href': 'https://investor.id', 'title': 'Investor.ID'}",Missing,Missing
"Hold Saham GOTO, Secara Teknikal Bisa Lanjut Naik ke Sini - Investor.ID","Hold Saham GOTO, Secara Teknikal Bisa Lanjut Naik ke Sini  Investor.ID",2023-09-07,https://news.google.com/rss/articles/CBMiWmh0dHBzOi8vaW52ZXN0b3IuaWQvbWFya2V0LzMzOTk5OC9ob2xkLXNhaGFtLWdvdG8tc2VjYXJhLXRla25pa2FsLWJpc2EtbGFuanV0LW5haWsta2Utc2luadIBAA?oc=5&hl=en-ID&gl=ID&ceid=ID:en,"{'href': 'https://investor.id', 'title': 'Investor.ID'}",Missing,Missing
"Jumlah Pemegang Saham PGN (PGAS) Jadi Segini, Potensi Cuan Masih Tinggi - Investor.ID","Jumlah Pemegang Saham PGN (PGAS) Jadi Segini, Potensi Cuan Masih Tinggi  Investor.ID",2023-09-06,https://news.google.com/rss/articles/CBMiZmh0dHBzOi8vaW52ZXN0b3IuaWQvbWFya2V0LzMzOTgwMS9qdW1sYWgtcGVtZWdhbmctc2FoYW0tcGduLXBnYXMtamFkaS1zZWdpbmktcG90ZW5zaS1jdWFuLW1hc2loLXRpbmdnadIBAA?oc=5&hl=en-ID&gl=ID&ceid=ID:en,"{'href': 'https://investor.id', 'title': 'Investor.ID'}",Missing,Missing
"Sekuritas Ini Pangkas Target Harga Saham PGN (PGAS), Berikut Faktor Pemicunya - Investor.ID","Sekuritas Ini Pangkas Target Harga Saham PGN (PGAS), Berikut Faktor Pemicunya  Investor.ID",2023-09-05,https://news.google.com/rss/articles/CBMibGh0dHBzOi8vaW52ZXN0b3IuaWQvbWFya2V0LzMzOTcwMS9zZWt1cml0YXMtaW5pLXBhbmdrYXMtdGFyZ2V0LWhhcmdhLXNhaGFtLXBnbi1wZ2FzLWJlcmlrdXQtZmFrdG9yLXBlbWljdW55YdIBAA?oc=5&hl=en-ID&gl=ID&ceid=ID:en,"{'href': 'https://investor.id', 'title': 'Investor.ID'}",Missing,Missing
"Target Harga Baru BBRI Keluar, Potensi Gain Tambah Lebar - Investor.ID","Target Harga Baru BBRI Keluar, Potensi Gain Tambah Lebar  Investor.ID",2023-09-04,https://news.google.com/rss/articles/CBMiWWh0dHBzOi8vaW52ZXN0b3IuaWQvbWFya2V0LzMzOTYzNi90YXJnZXQtaGFyZ2EtYmFydS1iYnJpLWtlbHVhci1wb3RlbnNpLWdhaW4tdGFtYmFoLWxlYmFy0gEA?oc=5&hl=en-ID&gl=ID&ceid=ID:en,"{'href': 'https://investor.id', 'title': 'Investor.ID'}",Missing,Missing
"Kontrak Baru Wijaya Karya (WIKA) Tembus Rp 15,41 T - Investor.ID","Kontrak Baru Wijaya Karya (WIKA) Tembus Rp 15,41 T  Investor.ID",2023-09-01,https://news.google.com/rss/articles/CBMiUWh0dHBzOi8vaW52ZXN0b3IuaWQvbWFya2V0LzMzOTQyNS9rb250cmFrLWJhcnUtd2lqYXlhLWthcnlhLXdpa2EtdGVtYnVzLXJwLTE1NDEtdNIBAA?oc=5&hl=en-ID&gl=ID&ceid=ID:en,"{'href': 'https://investor.id', 'title': 'Investor.ID'}",Missing,Missing
Ternyata Ini Alasan BRI (BBRI) Telat Publikasi Laporan Keuangan - Investor.ID,Ternyata Ini Alasan BRI (BBRI) Telat Publikasi Laporan Keuangan  Investor.ID,2023-08-30,https://news.google.com/rss/articles/CBMiX2h0dHBzOi8vaW52ZXN0b3IuaWQvbWFya2V0LzMzOTI1My90ZXJueWF0YS1pbmktYWxhc2FuLWJyaS1iYnJpLXRlbGF0LXB1Ymxpa2FzaS1sYXBvcmFuLWtldWFuZ2Fu0gEA?oc=5&hl=en-ID&gl=ID&ceid=ID:en,"{'href': 'https://investor.id', 'title': 'Investor.ID'}",Missing,Missing
Dafam Resort Belitung Mulai Beroperasi - Investor.ID,Dafam Resort Belitung Mulai Beroperasi  Investor.ID,2023-08-29,https://news.google.com/rss/articles/CBMiSmh0dHBzOi8vaW52ZXN0b3IuaWQvYnVzaW5lc3MvMzM5MjA3L2RhZmFtLXJlc29ydC1iZWxpdHVuZy1tdWxhaS1iZXJvcGVyYXNp0gEA?oc=5&hl=en-ID&gl=ID&ceid=ID:en,"{'href': 'https://investor.id', 'title': 'Investor.ID'}",Missing,Missing
Lo Kheng Hong Ditawari Posisi Komisaris - Investor.ID,Lo Kheng Hong Ditawari Posisi Komisaris  Investor.ID,2023-08-26,https://news.google.com/rss/articles/CBMiSWh0dHBzOi8vaW52ZXN0b3IuaWQvbWFya2V0LzMzODk5NS9sby1raGVuZy1ob25nLWRpdGF3YXJpLXBvc2lzaS1rb21pc2FyaXPSAQA?oc=5&hl=en-ID&gl=ID&ceid=ID:en,"{'href': 'https://investor.id', 'title': 'Investor.ID'}",Missing,Missing
"Load Factor Capai 115%, Jatim Luncurkan Bus Trans Jatim Koridor II - Investor.ID","Load Factor Capai 115%, Jatim Luncurkan Bus Trans Jatim Koridor II  Investor.ID",2023-08-22,https://news.google.com/rss/articles/CBMiZGh0dHBzOi8vaW52ZXN0b3IuaWQvYnVzaW5lc3MvMzM4NjA4L2xvYWQtZmFjdG9yLWNhcGFpLTExNS1qYXRpbS1sdW5jdXJrYW4tYnVzLXRyYW5zLWphdGltLWtvcmlkb3ItaWnSAQA?oc=5&hl=en-ID&gl=ID&ceid=ID:en,"{'href': 'https://investor.id', 'title': 'Investor.ID'}",Missing,Missing
PTBA dan ADRO Bakal Untung Besar Gara-gara Aturan Ini - Investor.ID,PTBA dan ADRO Bakal Untung Besar Gara-gara Aturan Ini  Investor.ID,2023-08-21,https://news.google.com/rss/articles/CBMiVmh0dHBzOi8vaW52ZXN0b3IuaWQvbWFya2V0LzMzODQ4NS9wdGJhLWRhbi1hZHJvLWJha2FsLXVudHVuZy1iZXNhci1nYXJhZ2FyYS1hdHVyYW4taW5p0gEA?oc=5&hl=en-ID&gl=ID&ceid=ID:en,"{'href': 'https://investor.id', 'title': 'Investor.ID'}",Missing,Missing
"Mengenal Susu Grass-fed, Kandungan Ini yang Bikin Spesial - Investor.ID","Mengenal Susu Grass-fed, Kandungan Ini yang Bikin Spesial  Investor.ID",2023-08-20,https://news.google.com/rss/articles/CBMiXGh0dHBzOi8vaW52ZXN0b3IuaWQvbGlmZXN0eWxlLzMzODQ3NC9tZW5nZW5hbC1zdXN1LWdyYXNzZmVkLWthbmR1bmdhbi1pbmkteWFuZy1iaWtpbi1zcGVzaWFs0gEA?oc=5&hl=en-ID&gl=ID&ceid=ID:en,"{'href': 'https://investor.id', 'title': 'Investor.ID'}",Missing,Missing
"Permintaan Kemasan Minuman Meningkat, Yoboy Cup Luncurkan Jenis Cup Baru - Investor.ID","Permintaan Kemasan Minuman Meningkat, Yoboy Cup Luncurkan Jenis Cup Baru  Investor.ID",2023-08-19,https://news.google.com/rss/articles/CBMia2h0dHBzOi8vaW52ZXN0b3IuaWQvYnVzaW5lc3MvMzM4NDA2L3Blcm1pbnRhYW4ta2VtYXNhbi1taW51bWFuLW1lbmluZ2thdC15b2JveS1jdXAtbHVuY3Vya2FuLWplbmlzLWN1cC1iYXJ10gEA?oc=5&hl=en-ID&gl=ID&ceid=ID:en,"{'href': 'https://investor.id', 'title': 'Investor.ID'}",Missing,Missing
"Jumlah Pemegang Saham Adaro (ADRO) Makin Banyak, Para Konglomerat Ini Ikut Koleksi - Investor.ID","Jumlah Pemegang Saham Adaro (ADRO) Makin Banyak, Para Konglomerat Ini Ikut Koleksi  Investor.ID",2023-08-16,https://news.google.com/rss/articles/CBMicWh0dHBzOi8vaW52ZXN0b3IuaWQvbWFya2V0LzMzODE2Ny9qdW1sYWgtcGVtZWdhbmctc2FoYW0tYWRhcm8tYWRyby1tYWtpbi1iYW55YWstcGFyYS1rb25nbG9tZXJhdC1pbmktaWt1dC1rb2xla3Np0gEA?oc=5&hl=en-ID&gl=ID&ceid=ID:en,"{'href': 'https://investor.id', 'title': 'Investor.ID'}",Missing,Missing
Saham HMSP Terancam Keluar dari BEI Gara-gara Ini - Investor.ID,Saham HMSP Terancam Keluar dari BEI Gara-gara Ini  Investor.ID,2023-08-13,https://news.google.com/rss/articles/CBMiUWh0dHBzOi8vaW52ZXN0b3IuaWQvbWFya2V0LzMzNzk0NC9zYWhhbWhtc3AtdGVyYW5jYW0ta2VsdWFyLWRhcmktYmVpLWdhcmFnYXJhLWluadIBAA?oc=5&hl=en-ID&gl=ID&ceid=ID:en,"{'href': 'https://investor.id', 'title': 'Investor.ID'}",Missing,Missing
Lo Kheng Hong Jual 2 Saham Ini: dari Rp 50 Juta Jadi Rp 1 Triliun di Tabungan - Investor.ID,Lo Kheng Hong Jual 2 Saham Ini: dari Rp 50 Juta Jadi Rp 1 Triliun di Tabungan  Investor.ID,2023-08-12,https://news.google.com/rss/articles/CBMibmh0dHBzOi8vaW52ZXN0b3IuaWQvbWFya2V0LzMzNzkxMy9sby1raGVuZy1ob25nLWp1YWwtMi1zYWhhbS1pbmktZGFyaS1ycC01MC1qdXRhLWphZGktcnAtMS10cmlsaXVuLWRpLXRhYnVuZ2Fu0gEA?oc=5&hl=en-ID&gl=ID&ceid=ID:en,"{'href': 'https://investor.id', 'title': 'Investor.ID'}",Missing,Missing
ASDP Aplikasikan Online Ticketing di Labuan Bajo dan Sape - Investor.ID,ASDP Aplikasikan Online Ticketing di Labuan Bajo dan Sape  Investor.ID,2023-08-10,https://news.google.com/rss/articles/CBMiXWh0dHBzOi8vaW52ZXN0b3IuaWQvYnVzaW5lc3MvMzM3NjgyL2FzZHAtYXBsaWthc2lrYW4tb25saW5lLXRpY2tldGluZy1kaS1sYWJ1YW4tYmFqby1kYW4tc2FwZdIBAA?oc=5&hl=en-ID&gl=ID&ceid=ID:en,"{'href': 'https://investor.id', 'title': 'Investor.ID'}",Missing,Missing
"Lo Kheng Hong Tambah Saham ABMM, Hermanto Tanoko dan Haiyanto Lakukan Ini - Investor.ID","Lo Kheng Hong Tambah Saham ABMM, Hermanto Tanoko dan Haiyanto Lakukan Ini  Investor.ID",2023-08-08,https://news.google.com/rss/articles/CBMiamh0dHBzOi8vaW52ZXN0b3IuaWQvbWFya2V0LzMzNzQ2NS9sby1raGVuZy1ob25nLXRhbWJhaC1zYWhhbS1hYm1tLWhlcm1hbnRvLXRhbm9rby1kYW4taGFpeWFudG8tbGFrdWthbi1pbmnSAQA?oc=5&hl=en-ID&gl=ID&ceid=ID:en,"{'href': 'https://investor.id', 'title': 'Investor.ID'}",Missing,Missing
"WIKA Diaudit BPKP dan Audit Internasional, Komut Buka Suara - Investor.ID","WIKA Diaudit BPKP dan Audit Internasional, Komut Buka Suara  Investor.ID",2023-08-07,https://news.google.com/rss/articles/CBMiXGh0dHBzOi8vaW52ZXN0b3IuaWQvbWFya2V0LzMzNzM5OC93aWthLWRpYXVkaXQtYnBrcC1kYW4tYXVkaXQtaW50ZXJuYXNpb25hbC1rb211dC1idWthLXN1YXJh0gEA?oc=5&hl=en-ID&gl=ID&ceid=ID:en,"{'href': 'https://investor.id', 'title': 'Investor.ID'}",Missing,Missing
Ada Entitas Konimex di Balik Folk Group (FOLK) yang Lagi IPO - Investor.ID,Ada Entitas Konimex di Balik Folk Group (FOLK) yang Lagi IPO  Investor.ID,2023-08-02,https://news.google.com/rss/articles/CBMiXGh0dHBzOi8vaW52ZXN0b3IuaWQvbWFya2V0LzMzNjkzNy9hZGEtZW50aXRhcy1rb25pbWV4LWRpLWJhbGlrLWZvbGstZ3JvdXAtZm9say15YW5nLWxhZ2ktaXBv0gEA?oc=5&hl=en-ID&gl=ID&ceid=ID:en,"{'href': 'https://investor.id', 'title': 'Investor.ID'}",Missing,Missing
Laba Bersih ABM Investama (ABMM) Melambung - Investor.ID,Laba Bersih ABM Investama (ABMM) Melambung  Investor.ID,2023-08-01,https://news.google.com/rss/articles/CBMiSmh0dHBzOi8vaW52ZXN0b3IuaWQvbWFya2V0LzMzNjgwNC9sYWJhLWJlcnNpaC1hYm0taW52ZXN0YW1hLWFibW0tbWVsYW1idW5n0gEA?oc=5&hl=en-ID&gl=ID&ceid=ID:en,"{'href': 'https://investor.id', 'title': 'Investor.ID'}",Missing,Missing
Laba BMTR Favorit Lo Kheng Hong Terkikis - Investor.ID,Laba BMTR Favorit Lo Kheng Hong Terkikis  Investor.ID,2023-08-01,https://news.google.com/rss/articles/CBMiSmh0dHBzOi8vaW52ZXN0b3IuaWQvbWFya2V0LzMzNjgxNC9sYWJhLWJtdHItZmF2b3JpdC1sby1raGVuZy1ob25nLXRlcmtpa2lz0gEA?oc=5&hl=en-ID&gl=ID&ceid=ID:en,"{'href': 'https://investor.id', 'title': 'Investor.ID'}",Missing,Missing
Matra Mandiri Prima Memasuki Industri Kedirgantaraan Indonesia dan Asean - Investor.ID,Matra Mandiri Prima Memasuki Industri Kedirgantaraan Indonesia dan Asean  Investor.ID,2023-07-31,https://news.google.com/rss/articles/CBMicmh0dHBzOi8vaW52ZXN0b3IuaWQvdHJhZGUtaW5kdXN0cnkvMzM2Njc4L21hdHJhLW1hbmRpcmktcHJpbWEtbWVtYXN1a2ktaW5kdXN0cmkta2VkaXJnYW50YXJhYW4taW5kb25lc2lhLWRhbi1hc2VhbtIBAA?oc=5&hl=en-ID&gl=ID&ceid=ID:en,"{'href': 'https://investor.id', 'title': 'Investor.ID'}",Missing,Missing
Komitmen Indofood atas Keberlanjutan Lingkungan Dapat Apresiasi BPOM - Investor.ID,Komitmen Indofood atas Keberlanjutan Lingkungan Dapat Apresiasi BPOM  Investor.ID,2023-07-30,https://news.google.com/rss/articles/CBMiaGh0dHBzOi8vaW52ZXN0b3IuaWQvYnVzaW5lc3MvMzM2NTk4L2tvbWl0bWVuLWluZG9mb29kLWF0YXMta2ViZXJsYW5qdXRhbi1saW5na3VuZ2FuLWRhcGF0LWFwcmVzaWFzaS1icG9t0gEA?oc=5&hl=en-ID&gl=ID&ceid=ID:en,"{'href': 'https://investor.id', 'title': 'Investor.ID'}",Missing,Missing
"BEI Rombak Indeks LQ45, Berikut Daftar Terbarunya! - Investor.ID","BEI Rombak Indeks LQ45, Berikut Daftar Terbarunya!  Investor.ID",2023-07-26,https://news.google.com/rss/articles/CBMiUmh0dHBzOi8vaW52ZXN0b3IuaWQvbWFya2V0LzMzNjEzOC9iZWktcm9tYmFrLWluZGVrcy1scTQ1LWJlcmlrdXQtZGFmdGFyLXRlcmJhcnVueWHSAQA?oc=5&hl=en-ID&gl=ID&ceid=ID:en,"{'href': 'https://investor.id', 'title': 'Investor.ID'}",Missing,Missing
"Baru IPO, Amman Mineral (AMMN) Sudah Punya Kejutan Lagi - Halaman all - Investor.ID","Baru IPO, Amman Mineral (AMMN) Sudah Punya Kejutan Lagi - Halaman all  Investor.ID",2023-07-25,https://news.google.com/rss/articles/CBMiWWh0dHBzOi8vaW52ZXN0b3IuaWQvbWFya2V0LzMzNTk5MC9iYXJ1LWlwby1hbW1hbi1taW5lcmFsLWFtbW4tc3VkYWgtcHVueWFrZWp1dGFuLWxhZ2kvYWxs0gEA?oc=5&hl=en-ID&gl=ID&ceid=ID:en,"{'href': 'https://investor.id', 'title': 'Investor.ID'}",Missing,Missing
"Waspada, Tiga Jenis Cedera Ancam Petenis - Investor.ID","Waspada, Tiga Jenis Cedera Ancam Petenis  Investor.ID",2023-07-23,https://news.google.com/rss/articles/CBMiTGh0dHBzOi8vaW52ZXN0b3IuaWQvbGlmZXN0eWxlLzMzNTgxMi93YXNwYWRhLXRpZ2EtamVuaXMtY2VkZXJhLWFuY2FtLXBldGVuaXPSAQA?oc=5&hl=en-ID&gl=ID&ceid=ID:en,"{'href': 'https://investor.id', 'title': 'Investor.ID'}",Missing,Missing
"Folk Group (FOLK) IPO, Range Harga Rp 100-105, Bonus Waran! - Investor.ID","Folk Group (FOLK) IPO, Range Harga Rp 100-105, Bonus Waran!  Investor.ID",2023-07-20,https://news.google.com/rss/articles/CBMiVmh0dHBzOi8vaW52ZXN0b3IuaWQvbWFya2V0LzMzNTU2Ni9mb2xrLWdyb3VwLWZvbGstaXBvcmFuZ2UtaGFyZ2EtcnAtMTAwMTA1LWJvbnVzLXdhcmFu0gEA?oc=5&hl=en-ID&gl=ID&ceid=ID:en,"{'href': 'https://investor.id', 'title': 'Investor.ID'}",Missing,Missing
"Saham BUKA dan GOTO Bisa Balik ke Harga IPO, Syaratnya Cuma Ini - Investor.ID","Saham BUKA dan GOTO Bisa Balik ke Harga IPO, Syaratnya Cuma Ini  Investor.ID",2023-07-20,https://news.google.com/rss/articles/CBMiYGh0dHBzOi8vaW52ZXN0b3IuaWQvbWFya2V0LzMzNTUzNC9zYWhhbS1idWthLWRhbi1nb3RvLWJpc2EtYmFsaWsta2UtaGFyZ2EtaXBvLXN5YXJhdG55YS1jdW1hLWluadIBAA?oc=5&hl=en-ID&gl=ID&ceid=ID:en,"{'href': 'https://investor.id', 'title': 'Investor.ID'}",Missing,Missing
"Go Public, ITSEC (CYBR) Siap Jadi Perusahaan IT di Asia - Investor.ID","Go Public, ITSEC (CYBR) Siap Jadi Perusahaan IT di Asia  Investor.ID",2023-07-19,https://news.google.com/rss/articles/CBMiVmh0dHBzOi8vaW52ZXN0b3IuaWQvbWFya2V0LzMzNTUyMC9nby1wdWJsaWMtaXRzZWMtY3lici1zaWFwLWphZGktcGVydXNhaGFhbi1pdC1kaS1hc2lh0gEA?oc=5&hl=en-ID&gl=ID&ceid=ID:en,"{'href': 'https://investor.id', 'title': 'Investor.ID'}",Missing,Missing
"IHSG Masuk Era Bullish, Dua Saham Ini Bakal Tambah Panas - Investor.ID","IHSG Masuk Era Bullish, Dua Saham Ini Bakal Tambah Panas  Investor.ID",2023-07-15,https://news.google.com/rss/articles/CBMiWWh0dHBzOi8vaW52ZXN0b3IuaWQvbWFya2V0LzMzNTE2NC9paHNnLW1hc3VrLWVyYS1idWxsaXNoLWR1YS1zYWhhbS1pbmktYmFrYWwtdGFtYmFoLXBhbmFz0gEA?oc=5&hl=en-ID&gl=ID&ceid=ID:en,"{'href': 'https://investor.id', 'title': 'Investor.ID'}",Missing,Missing
Wika Gedung (WEGE) Ungkap Progres Stasiun Kereta Cepat - Investor.ID,Wika Gedung (WEGE) Ungkap Progres Stasiun Kereta Cepat  Investor.ID,2023-07-14,https://news.google.com/rss/articles/CBMiVGh0dHBzOi8vaW52ZXN0b3IuaWQvbWFya2V0LzMzNTEwNC93aWthLWdlZHVuZy13ZWdlLXVuZ2thcHByb2dyZXNzdGFzaXVuLWtlcmV0YS1jZXBhdNIBAA?oc=5&hl=en-ID&gl=ID&ceid=ID:en,"{'href': 'https://investor.id', 'title': 'Investor.ID'}",Missing,Missing
"Gempar nih, Lo Kheng Hong Akhirnya Jual Saham Kesayangan - Investor.ID","Gempar nih, Lo Kheng Hong Akhirnya Jual Saham Kesayangan  Investor.ID",2023-07-12,https://news.google.com/rss/articles/CBMiWWh0dHBzOi8vaW52ZXN0b3IuaWQvbWFya2V0LzMzNDgxOC9nZW1wYXItbmloLWxvLWtoZW5nLWhvbmctYWtoaXJueWEtanVhbC1zYWhhbS1rZXNheWFuZ2Fu0gEA?oc=5&hl=en-ID&gl=ID&ceid=ID:en,"{'href': 'https://investor.id', 'title': 'Investor.ID'}",Missing,Missing
"Sempat Terpuruk Usai Cum Dividen, Saham CFIN Andalan Lo Kheng Hong Bangkit Lagi - Investor.ID","Sempat Terpuruk Usai Cum Dividen, Saham CFIN Andalan Lo Kheng Hong Bangkit Lagi  Investor.ID",2023-07-11,https://news.google.com/rss/articles/CBMib2h0dHBzOi8vaW52ZXN0b3IuaWQvbWFya2V0LzMzNDczNi9zZW1wYXQtdGVycHVydWt1c2FpLWN1bS1kaXZpZGVuLXNhaGFtLWNmaW4tYW5kYWxhbi1sby1raGVuZy1ob25nLWJhbmdraXQtbGFnadIBAA?oc=5&hl=en-ID&gl=ID&ceid=ID:en,"{'href': 'https://investor.id', 'title': 'Investor.ID'}",Missing,Missing
Konsumen di Pulau Jawa Berkontribusi 83% terhadap Transaksi e-Commerce - Investor.ID,Konsumen di Pulau Jawa Berkontribusi 83% terhadap Transaksi e-Commerce  Investor.ID,2023-07-11,https://news.google.com/rss/articles/CBMiaGh0dHBzOi8vaW52ZXN0b3IuaWQvYnVzaW5lc3MvMzM0NjcyL2tvbnN1bWVuLWRpLXB1bGF1LWphd2EtYmVya29udHJpYnVzaS04My10ZXJoYWRhcC10cmFuc2Frc2ktZWNvbW1lcmNl0gEA?oc=5&hl=en-ID&gl=ID&ceid=ID:en,"{'href': 'https://investor.id', 'title': 'Investor.ID'}",Missing,Missing
"Banyak Merugi, Konsep Bisnis Pertashop Harus Diubah - Investor.ID","Banyak Merugi, Konsep Bisnis Pertashop Harus Diubah  Investor.ID",2023-07-11,https://news.google.com/rss/articles/CBMiVmh0dHBzOi8vaW52ZXN0b3IuaWQvYnVzaW5lc3MvMzM0NjY5L2Jhbnlhay1tZXJ1Z2kta29uc2VwLWJpc25pcy1wZXJ0YXNob3AtaGFydXMtZGl1YmFo0gEA?oc=5&hl=en-ID&gl=ID&ceid=ID:en,"{'href': 'https://investor.id', 'title': 'Investor.ID'}",Missing,Missing
10 UMKM Bakal Melantai di Bursa Saham - Investor.ID,10 UMKM Bakal Melantai di Bursa Saham  Investor.ID,2023-07-10,https://news.google.com/rss/articles/CBMiR2h0dHBzOi8vaW52ZXN0b3IuaWQvbWFya2V0LzMzNDY3NC8xMC11bWttLWJha2FsLW1lbGFudGFpLWRpLWJ1cnNhLXNhaGFt0gEA?oc=5&hl=en-ID&gl=ID&ceid=ID:en,"{'href': 'https://investor.id', 'title': 'Investor.ID'}",Missing,Missing
"Daftar Saham yang Cocok untuk Trading, Semoga Cuan! - Investor.ID","Daftar Saham yang Cocok untuk Trading, Semoga Cuan!  Investor.ID",2023-07-09,https://news.google.com/rss/articles/CBMiU2h0dHBzOi8vaW52ZXN0b3IuaWQvbWFya2V0LzMzNDU1My9kYWZ0YXItc2FoYW0teWFuZy1jb2Nvay11bnR1ay10cmFkaW5nLXNlbW9nYS1jdWFu0gEA?oc=5&hl=en-ID&gl=ID&ceid=ID:en,"{'href': 'https://investor.id', 'title': 'Investor.ID'}",Missing,Missing
AKHLAK dan RACE Jadi Acuan BNI (BBNI) Tingkatkan Kinerja - Investor.ID,AKHLAK dan RACE Jadi Acuan BNI (BBNI) Tingkatkan Kinerja  Investor.ID,2023-07-09,https://news.google.com/rss/articles/CBMiWWh0dHBzOi8vaW52ZXN0b3IuaWQvZmluYW5jZS8zMzQ1MjUvYWtobGFrLWRhbi1yYWNlLWphZGktYWN1YW4tYm5pLWJibmktdGluZ2thdGthbi1raW5lcmph0gEA?oc=5&hl=en-ID&gl=ID&ceid=ID:en,"{'href': 'https://investor.id', 'title': 'Investor.ID'}",Missing,Missing
"Saham Ini Mendadak Terbang, Lo Kheng Hong Hold Terus - Investor.ID","Saham Ini Mendadak Terbang, Lo Kheng Hong Hold Terus  Investor.ID",2023-07-04,https://news.google.com/rss/articles/CBMiVWh0dHBzOi8vaW52ZXN0b3IuaWQvbWFya2V0LzMzNDAwOS9zYWhhbS1pbmktbWVuZGFkYWstdGVyYmFuZy1sby1raGVuZy1ob25nLWhvbGQtdGVydXPSAQA?oc=5&hl=en-ID&gl=ID&ceid=ID:en,"{'href': 'https://investor.id', 'title': 'Investor.ID'}",Missing,Missing
"Potensi Cuan Saham Astra Otoparts (AUTO) masih 64%, Begini Kalkulasinya - Investor.ID","Potensi Cuan Saham Astra Otoparts (AUTO) masih 64%, Begini Kalkulasinya  Investor.ID",2023-07-04,https://news.google.com/rss/articles/CBMiZWh0dHBzOi8vaW52ZXN0b3IuaWQvbWFya2V0LzMzMzk3NC9wb3RlbnNpLWN1YW4tc2FoYW0tYXN0cmEtb3RvcGFydHMtYXV0by1tYXNpaC02NC1iZWdpbmkta2Fsa3VsYXNpbnlh0gEA?oc=5&hl=en-ID&gl=ID&ceid=ID:en,"{'href': 'https://investor.id', 'title': 'Investor.ID'}",Missing,Missing
"Goto Diprediksi Untung Rp 179 Miliar di 2024, Saham Bisa Lompat 77% - Investor.ID","Goto Diprediksi Untung Rp 179 Miliar di 2024, Saham Bisa Lompat 77%  Investor.ID",2023-07-01,https://news.google.com/rss/articles/CBMiY2h0dHBzOi8vaW52ZXN0b3IuaWQvbWFya2V0LzMzMzc1Mi9nb3RvLWRpcHJlZGlrc2ktdW50dW5nLXJwLTE3OS1taWxpYXItZGktMjAyNC1zYWhhbS1iaXNhLWxvbXBhdC03N9IBAA?oc=5&hl=en-ID&gl=ID&ceid=ID:en,"{'href': 'https://investor.id', 'title': 'Investor.ID'}",Missing,Missing
Anak Usaha Wijaya Karya (WIKA) Ekspor 72 Kendaraan Listrik ke Nepal - Investor.ID,Anak Usaha Wijaya Karya (WIKA) Ekspor 72 Kendaraan Listrik ke Nepal  Investor.ID,2023-06-26,https://news.google.com/rss/articles/CBMiY2h0dHBzOi8vaW52ZXN0b3IuaWQvbWFya2V0LzMzMzM3Mi9hbmFrLXVzYWhhLXdpamF5YS1rYXJ5YS13aWthLWVrc3Bvci03Mi1rZW5kYXJhYW4tbGlzdHJpay1rZS1uZXBhbNIBAA?oc=5&hl=en-ID&gl=ID&ceid=ID:en,"{'href': 'https://investor.id', 'title': 'Investor.ID'}",Missing,Missing
Petinggi Kresna Graha (KREN) Beramai-ramai Mundur! - Investor.ID,Petinggi Kresna Graha (KREN) Beramai-ramai Mundur!  Investor.ID,2023-06-25,https://news.google.com/rss/articles/CBMiUGh0dHBzOi8vaW52ZXN0b3IuaWQvbWFya2V0LzMzMzI2Ny9wZXRpbmdnaS1rcmVzbmEtZ3JhaGEta3Jlbi1iZXJhbWFpcmFtYWktbXVuZHVy0gEA?oc=5&hl=en-ID&gl=ID&ceid=ID:en,"{'href': 'https://investor.id', 'title': 'Investor.ID'}",Missing,Missing
Bank DKI Gelar Promo Tiket Masuk Taman Margasatwa Ragunan - Investor.ID,Bank DKI Gelar Promo Tiket Masuk Taman Margasatwa Ragunan  Investor.ID,2023-06-24,https://news.google.com/rss/articles/CBMiXGh0dHBzOi8vaW52ZXN0b3IuaWQvZmluYW5jZS8zMzMyMDAvYmFuay1ka2ktZ2VsYXItcHJvbW8tdGlrZXQtbWFzdWstdGFtYW4tbWFyZ2FzYXR3YS1yYWd1bmFu0gEA?oc=5&hl=en-ID&gl=ID&ceid=ID:en,"{'href': 'https://investor.id', 'title': 'Investor.ID'}",Missing,Missing
Misteri Aksi Senyap Lo Kheng Hong Jual Saham CFIN Terungkap! - Investor.ID,Misteri Aksi Senyap Lo Kheng Hong Jual Saham CFIN Terungkap!  Investor.ID,2023-06-23,https://news.google.com/rss/articles/CBMiXWh0dHBzOi8vaW52ZXN0b3IuaWQvbWFya2V0LzMzMzE3MS9taXN0ZXJpLWFrc2ktc2VueWFwLWxvLWtoZW5nLWhvbmctanVhbC1zYWhhbS1jZmluLXRlcnVuZ2thcNIBAA?oc=5&hl=en-ID&gl=ID&ceid=ID:en,"{'href': 'https://investor.id', 'title': 'Investor.ID'}",Missing,Missing
Hadapi Tantangan Pertanian dengan Teknologi dan Inovasi - Investor.ID,Hadapi Tantangan Pertanian dengan Teknologi dan Inovasi  Investor.ID,2023-06-22,https://news.google.com/rss/articles/CBMiW2h0dHBzOi8vaW52ZXN0b3IuaWQvYnVzaW5lc3MvMzMyOTU4L2hhZGFwaS10YW50YW5nYW4tcGVydGFuaWFuLWRlbmdhbi10ZWtub2xvZ2ktZGFuLWlub3Zhc2nSAQA?oc=5&hl=en-ID&gl=ID&ceid=ID:en,"{'href': 'https://investor.id', 'title': 'Investor.ID'}",Missing,Missing
Emiten Favorit Cinta Laura (OASA) Bakal Lebih Mulus Gaet Investor Strategis - Investor.ID,Emiten Favorit Cinta Laura (OASA) Bakal Lebih Mulus Gaet Investor Strategis  Investor.ID,2023-06-22,https://news.google.com/rss/articles/CBMia2h0dHBzOi8vaW52ZXN0b3IuaWQvbWFya2V0LzMzMzAzMS9lbWl0ZW4tZmF2b3JpdC1jaW50YS1sYXVyYS1vYXNhLWJha2FsLWxlYmloLW11bHVzLWdhZXQtaW52ZXN0b3Itc3RyYXRlZ2lz0gEA?oc=5&hl=en-ID&gl=ID&ceid=ID:en,"{'href': 'https://investor.id', 'title': 'Investor.ID'}",Missing,Missing
"Ditinggal Lo Kheng Hong, Saham dan Dividen Clipan (CFIN) Tertinggi Sepanjang Masa - Investor.ID","Ditinggal Lo Kheng Hong, Saham dan Dividen Clipan (CFIN) Tertinggi Sepanjang Masa  Investor.ID",2023-06-22,https://news.google.com/rss/articles/CBMicGh0dHBzOi8vaW52ZXN0b3IuaWQvbWFya2V0LzMzMzAxMS9kaXRpbmdnYWwtbG8ta2hlbmctaG9uZy1zYWhhbS1kYW4tZGl2aWRlbi1jbGlwYW4tY2Zpbi10ZXJ0aW5nZ2ktc2VwYW5qYW5nLW1hc2HSAQA?oc=5&hl=en-ID&gl=ID&ceid=ID:en,"{'href': 'https://investor.id', 'title': 'Investor.ID'}",Missing,Missing
"PGN Suplai Gas 10,5 BBTUD ke Lotte Chemical Indonesia - Investor.ID","PGN Suplai Gas 10,5 BBTUD ke Lotte Chemical Indonesia  Investor.ID",2023-06-15,https://news.google.com/rss/articles/CBMiWGh0dHBzOi8vaW52ZXN0b3IuaWQvYnVzaW5lc3MvMzMyMzQ3L3Bnbi1zdXBsYWktZ2FzLTEwNS1iYnR1ZC1rZS1sb3R0ZS1jaGVtaWNhbC1pbmRvbmVzaWHSAQA?oc=5&hl=en-ID&gl=ID&ceid=ID:en,"{'href': 'https://investor.id', 'title': 'Investor.ID'}",Missing,Missing
TERPOPULER: Lo Kheng Hong Terpincut Saham Ini hingga Potensi Cuan BRIS (BSI) - Investor.ID,TERPOPULER: Lo Kheng Hong Terpincut Saham Ini hingga Potensi Cuan BRIS (BSI)  Investor.ID,2023-06-14,https://news.google.com/rss/articles/CBMia2h0dHBzOi8vaW52ZXN0b3IuaWQvbWFya2V0LzMzMjIwMi90ZXJwb3B1bGVyLWxvLWtoZW5nLWhvbmctdGVycGluY3V0LXNhaGFtLWluaS1oaW5nZ2EtcG90ZW5zaS1jdWFuLWJyaXMtYnNp0gEA?oc=5&hl=en-ID&gl=ID&ceid=ID:en,"{'href': 'https://investor.id', 'title': 'Investor.ID'}",Missing,Missing
"Lo Kheng Hong Ditanya Kenapa Akhirnya Diversifikasi: Suka Ketinggalan, tapi Duit Masih Banyak - Investor.ID","Lo Kheng Hong Ditanya Kenapa Akhirnya Diversifikasi: Suka Ketinggalan, tapi Duit Masih Banyak  Investor.ID",2023-06-10,https://news.google.com/rss/articles/CBMifWh0dHBzOi8vaW52ZXN0b3IuaWQvbWFya2V0LzMzMTg0MS9sby1raGVuZy1ob25nLWRpdGFueWEta2VuYXBhLWFraGlybnlhLWRpdmVyc2lmaWthc2ktc3VrYS1rZXRpbmdnYWxhbi10YXBpLWR1aXQtbWFzaWgtYmFueWFr0gEA?oc=5&hl=en-ID&gl=ID&ceid=ID:en,"{'href': 'https://investor.id', 'title': 'Investor.ID'}",Missing,Missing
